favourable risk–benefit ratio	0	1.0	2	When an antidepressant is to be prescribed, it should normally be an SSRI in a generic form because SSRIs are equally effective as other antidepressants and have a favourable risk–benefit ratio.	When an antidepressant is to be prescribed, it should normally be an SSRI in a generic form because SSRIs are equally effective as other antidepressants and have a favourable risk–benefit ratio.	
high-intensity psychological intervention	0	1.0	2	For people with moderate or severe depression, provide a combination of antidepressant medication and a high-intensity psychological intervention (CBT or IPT).	For people with moderate or severe depression, provide a combination of antidepressant medication and a high-intensity psychological intervention (CBT or IPT).	
initial pharmacological interventions	0	1.0	10	When reviewing drug treatment for a person with depression whose symptoms have not adequately responded to initial pharmacological interventions: check adherence to, and side effects from, initial treatment	When reviewing drug treatment for a person with depression whose symptoms have not adequately responded to initial pharmacological interventions: increase the frequency of appointments using outcome monitoring with a validated outcome measure	When reviewing drug treatment for a person with depression whose symptoms have not adequately responded to initial pharmacological interventions: be aware that using a single antidepressant rather than combination medication or augmentation (see recommendations 1.8.1.5 to 1.8.1.9) is usually associated with a lower side-effect burden	When reviewing drug treatment for a person with depression whose symptoms have not adequately responded to initial pharmacological interventions: consider reintroducing previous treatments that have been inadequately delivered or adhered to, including increasing the dose	When reviewing drug treatment for a person with depression whose symptoms have not adequately responded to initial pharmacological interventions: consider switching to an alternative antidepressant.	When reviewing drug treatment for a person with depression whose symptoms have not adequately responded to initial pharmacological interventions: check adherence to, and side effects from, initial treatment	When reviewing drug treatment for a person with depression whose symptoms have not adequately responded to initial pharmacological interventions: increase the frequency of appointments using outcome monitoring with a validated outcome measure	When reviewing drug treatment for a person with depression whose symptoms have not adequately responded to initial pharmacological interventions: be aware that using a single antidepressant rather than combination medication or augmentation (see recommendations 1.8.1.5 to 1.8.1.9) is usually associated with a lower side-effect burden	When reviewing drug treatment for a person with depression whose symptoms have not adequately responded to initial pharmacological interventions: consider reintroducing previous treatments that have been inadequately delivered or adhered to, including increasing the dose	When reviewing drug treatment for a person with depression whose symptoms have not adequately responded to initial pharmacological interventions: consider switching to an alternative antidepressant.	
non-steroidal anti-inflammatory drugs	0	1.0	2	In particular, consider prescribing a gastroprotective drug in older people who are taking non-steroidal anti-inflammatory drugs (NSAIDs) or aspirin.	In particular, consider prescribing a gastroprotective drug in older people who are taking non-steroidal anti-inflammatory drugs (NSAIDs) or aspirin.	
persistent subthreshold depressivesymptoms	0	1.0	8	Group-based CBT for people with persistent subthreshold depressivesymptoms or mild to moderate depression should: be based on a structured model such as 'Coping with Depression'	Group-based CBT for people with persistent subthreshold depressivesymptoms or mild to moderate depression should: be delivered by two trained and competent practitioners	Group-based CBT for people with persistent subthreshold depressivesymptoms or mild to moderate depression should: consist of 10 to 12 meetings of eight to ten participants	Group-based CBT for people with persistent subthreshold depressivesymptoms or mild to moderate depression should: normally take place over 12 to 16 weeks, including follow-up.	Group-based CBT for people with persistent subthreshold depressivesymptoms or mild to moderate depression should: be based on a structured model such as 'Coping with Depression'	Group-based CBT for people with persistent subthreshold depressivesymptoms or mild to moderate depression should: be delivered by two trained and competent practitioners	Group-based CBT for people with persistent subthreshold depressivesymptoms or mild to moderate depression should: consist of 10 to 12 meetings of eight to ten participants	Group-based CBT for people with persistent subthreshold depressivesymptoms or mild to moderate depression should: normally take place over 12 to 16 weeks, including follow-up.	
persistent subthreshold depressive	0	0.7581	20	For people with persistent subthreshold depressive symptoms or mild to moderate depression, consider offering one or more of the following interventions, guided by the person's preference: individual guided self-help based on the principles of cognitive behavioural therapy	For people with persistent subthreshold depressive symptoms or mild to moderate depression, consider offering one or more of the following interventions, guided by the person's preference: computerised cognitive behavioural therapy	For people with persistent subthreshold depressive symptoms or mild to moderate depression, consider offering one or more of the following interventions, guided by the person's preference: a structured group physical activity programme.	Group-based CBT for people with persistent subthreshold depressivesymptoms or mild to moderate depression should: be based on a structured model such as 'Coping with Depression'	Group-based CBT for people with persistent subthreshold depressivesymptoms or mild to moderate depression should: be delivered by two trained and competent practitioners	Group-based CBT for people with persistent subthreshold depressivesymptoms or mild to moderate depression should: consist of 10 to 12 meetings of eight to ten participants	Group-based CBT for people with persistent subthreshold depressivesymptoms or mild to moderate depression should: normally take place over 12 to 16 weeks, including follow-up.	Do not use antidepressants routinely to treat persistent subthreshold depressive symptoms or mild depression because the risk–benefit ratio is poor, but consider them for people with: a past history of moderate or severe depression	Do not use antidepressants routinely to treat persistent subthreshold depressive symptoms or mild depression because the risk–benefit ratio is poor, but consider them for people with:initial presentation of subthreshold depressive symptoms that have been present for a long period (typically at least 2 years)	Do not use antidepressants routinely to treat persistent subthreshold depressive symptoms or mild depression because the risk–benefit ratio is poor, but consider them for people with: subthreshold depressive symptoms or mild depression that persist(s) after other interventions.	For people with persistent subthreshold depressive symptoms or mild to moderate depression, consider offering one or more of the following interventions, guided by the person's preference: individual guided self-help based on the principles of cognitive behavioural therapy	For people with persistent subthreshold depressive symptoms or mild to moderate depression, consider offering one or more of the following interventions, guided by the person's preference: computerised cognitive behavioural therapy	For people with persistent subthreshold depressive symptoms or mild to moderate depression, consider offering one or more of the following interventions, guided by the person's preference: a structured group physical activity programme.	Group-based CBT for people with persistent subthreshold depressivesymptoms or mild to moderate depression should: be based on a structured model such as 'Coping with Depression'	Group-based CBT for people with persistent subthreshold depressivesymptoms or mild to moderate depression should: be delivered by two trained and competent practitioners	Group-based CBT for people with persistent subthreshold depressivesymptoms or mild to moderate depression should: consist of 10 to 12 meetings of eight to ten participants	Group-based CBT for people with persistent subthreshold depressivesymptoms or mild to moderate depression should: normally take place over 12 to 16 weeks, including follow-up.	Do not use antidepressants routinely to treat persistent subthreshold depressive symptoms or mild depression because the risk–benefit ratio is poor, but consider them for people with: a past history of moderate or severe depression	Do not use antidepressants routinely to treat persistent subthreshold depressive symptoms or mild depression because the risk–benefit ratio is poor, but consider them for people with:initial presentation of subthreshold depressive symptoms that have been present for a long period (typically at least 2 years)	Do not use antidepressants routinely to treat persistent subthreshold depressive symptoms or mild depression because the risk–benefit ratio is poor, but consider them for people with: subthreshold depressive symptoms or mild depression that persist(s) after other interventions.	
general physical health	0	0.7285	2	When prescribing antidepressants for older people: prescribe at an age-appropriate dose taking into account the effect of general physical health and concomitant medication on pharmacokinetics and pharmacodynamics	When prescribing antidepressants for older people: prescribe at an age-appropriate dose taking into account the effect of general physical health and concomitant medication on pharmacokinetics and pharmacodynamics	
subthreshold depressive symptoms	0	0.7241	20	For people who, in the judgement of the practitioner, may recover with no formal intervention, or people with mild depression who do not want an intervention, or people with subthreshold depressive symptoms who request an intervention: discuss the presenting problem(s) and any concerns that the person may have about them	For people who, in the judgement of the practitioner, may recover with no formal intervention, or people with mild depression who do not want an intervention, or people with subthreshold depressive symptoms who request an intervention: provide information about the nature and course of depression	For people who, in the judgement of the practitioner, may recover with no formal intervention, or people with mild depression who do not want an intervention, or people with subthreshold depressive symptoms who request an intervention: arrange a further assessment, normally within 2 weeks	For people who, in the judgement of the practitioner, may recover with no formal intervention, or people with mild depression who do not want an intervention, or people with subthreshold depressive symptoms who request an intervention: make contact if the person does not attend follow-up appointments.	For people with persistent subthreshold depressive symptoms or mild to moderate depression, consider offering one or more of the following interventions, guided by the person's preference: individual guided self-help based on the principles of cognitive behavioural therapy	For people with persistent subthreshold depressive symptoms or mild to moderate depression, consider offering one or more of the following interventions, guided by the person's preference: computerised cognitive behavioural therapy	For people with persistent subthreshold depressive symptoms or mild to moderate depression, consider offering one or more of the following interventions, guided by the person's preference: a structured group physical activity programme.	Do not use antidepressants routinely to treat persistent subthreshold depressive symptoms or mild depression because the risk–benefit ratio is poor, but consider them for people with: a past history of moderate or severe depression	Do not use antidepressants routinely to treat persistent subthreshold depressive symptoms or mild depression because the risk–benefit ratio is poor, but consider them for people with:initial presentation of subthreshold depressive symptoms that have been present for a long period (typically at least 2 years)	Do not use antidepressants routinely to treat persistent subthreshold depressive symptoms or mild depression because the risk–benefit ratio is poor, but consider them for people with: subthreshold depressive symptoms or mild depression that persist(s) after other interventions.	For people who, in the judgement of the practitioner, may recover with no formal intervention, or people with mild depression who do not want an intervention, or people with subthreshold depressive symptoms who request an intervention: discuss the presenting problem(s) and any concerns that the person may have about them	For people who, in the judgement of the practitioner, may recover with no formal intervention, or people with mild depression who do not want an intervention, or people with subthreshold depressive symptoms who request an intervention: provide information about the nature and course of depression	For people who, in the judgement of the practitioner, may recover with no formal intervention, or people with mild depression who do not want an intervention, or people with subthreshold depressive symptoms who request an intervention: arrange a further assessment, normally within 2 weeks	For people who, in the judgement of the practitioner, may recover with no formal intervention, or people with mild depression who do not want an intervention, or people with subthreshold depressive symptoms who request an intervention: make contact if the person does not attend follow-up appointments.	For people with persistent subthreshold depressive symptoms or mild to moderate depression, consider offering one or more of the following interventions, guided by the person's preference: individual guided self-help based on the principles of cognitive behavioural therapy	For people with persistent subthreshold depressive symptoms or mild to moderate depression, consider offering one or more of the following interventions, guided by the person's preference: computerised cognitive behavioural therapy	For people with persistent subthreshold depressive symptoms or mild to moderate depression, consider offering one or more of the following interventions, guided by the person's preference: a structured group physical activity programme.	Do not use antidepressants routinely to treat persistent subthreshold depressive symptoms or mild depression because the risk–benefit ratio is poor, but consider them for people with: a past history of moderate or severe depression	Do not use antidepressants routinely to treat persistent subthreshold depressive symptoms or mild depression because the risk–benefit ratio is poor, but consider them for people with:initial presentation of subthreshold depressive symptoms that have been present for a long period (typically at least 2 years)	Do not use antidepressants routinely to treat persistent subthreshold depressive symptoms or mild depression because the risk–benefit ratio is poor, but consider them for people with: subthreshold depressive symptoms or mild depression that persist(s) after other interventions.	
mental health act	0	0.7108	4	This is especially important when a person has severe depression or is subject to the Mental Health Act.	For people with recurrent severe depression or depression with psychotic symptoms and for those who have been treated under the Mental Health Act, consider developing advance decisions and advance statements collaboratively with the person.	This is especially important when a person has severe depression or is subject to the Mental Health Act.	For people with recurrent severe depression or depression with psychotic symptoms and for those who have been treated under the Mental Health Act, consider developing advance decisions and advance statements collaboratively with the person.	
cognitive behavioural therapy	0	0.6667	4	For people with persistent subthreshold depressive symptoms or mild to moderate depression, consider offering one or more of the following interventions, guided by the person's preference: individual guided self-help based on the principles of cognitive behavioural therapy	For people with persistent subthreshold depressive symptoms or mild to moderate depression, consider offering one or more of the following interventions, guided by the person's preference: computerised cognitive behavioural therapy	For people with persistent subthreshold depressive symptoms or mild to moderate depression, consider offering one or more of the following interventions, guided by the person's preference: individual guided self-help based on the principles of cognitive behavioural therapy	For people with persistent subthreshold depressive symptoms or mild to moderate depression, consider offering one or more of the following interventions, guided by the person's preference: computerised cognitive behavioural therapy	
recurrent severe depression	0	0.5	2	For people with recurrent severe depression or depression with psychotic symptoms and for those who have been treated under the Mental Health Act, consider developing advance decisions and advance statements collaboratively with the person.	For people with recurrent severe depression or depression with psychotic symptoms and for those who have been treated under the Mental Health Act, consider developing advance decisions and advance statements collaboratively with the person.	
comprehensive written information	0	0.3643	2	When working with people with depression and their families or carers: ensure that comprehensive written information is available in the appropriate language and in audio format if possible	When working with people with depression and their families or carers: ensure that comprehensive written information is available in the appropriate language and in audio format if possible	
group physical activity	0	0.3333	2	For people with persistent subthreshold depressive symptoms or mild to moderate depression, consider offering one or more of the following interventions, guided by the person's preference: a structured group physical activity programme.	For people with persistent subthreshold depressive symptoms or mild to moderate depression, consider offering one or more of the following interventions, guided by the person's preference: a structured group physical activity programme.	
physical activity programme	0	0.3333	2	For people with persistent subthreshold depressive symptoms or mild to moderate depression, consider offering one or more of the following interventions, guided by the person's preference: a structured group physical activity programme.	For people with persistent subthreshold depressive symptoms or mild to moderate depression, consider offering one or more of the following interventions, guided by the person's preference: a structured group physical activity programme.	
structured group physical	0	0.3333	2	For people with persistent subthreshold depressive symptoms or mild to moderate depression, consider offering one or more of the following interventions, guided by the person's preference: a structured group physical activity programme.	For people with persistent subthreshold depressive symptoms or mild to moderate depression, consider offering one or more of the following interventions, guided by the person's preference: a structured group physical activity programme.	
sleep offer people	0	0.2857	0	
participants group-based cbt	0	0.25	0	
potential adverse effects	0	0.25	2	The choice of intervention should be influenced by the likelihood of adherence to treatment and any potential adverse effects	The choice of intervention should be influenced by the likelihood of adherence to treatment and any potential adverse effects	
practitioners group-based cbt	0	0.25	0	
relevant anxiety disorder	0	0.25	2	When the person has an anxiety disorder and comorbid depression or depressive symptoms, consult the NICE guideline for the relevant anxiety disorder (see find guidance) and consider treating the anxiety disorder first (since effective treatment of the anxiety disorder will often improve the depression or the depressive symptoms).	When the person has an anxiety disorder and comorbid depression or depressive symptoms, consult the NICE guideline for the relevant anxiety disorder (see find guidance) and consider treating the anxiety disorder first (since effective treatment of the anxiety disorder will often improve the depression or the depressive symptoms).	
chronic physical health	0	0.2	2	For people with severe depression and those with moderate depression and complex problems, consider: providing collaborative care if the depression is in the context of a chronic physical health problem with associated functional impairment	For people with severe depression and those with moderate depression and complex problems, consider: providing collaborative care if the depression is in the context of a chronic physical health problem with associated functional impairment	
comorbid mental health	0	0.2	2	In addition to assessing symptoms and associated functional impairment, consider how the following factors may have affected the development, course and severity of a person's depression: any history of depression and comorbid mental health or physical disorders	In addition to assessing symptoms and associated functional impairment, consider how the following factors may have affected the development, course and severity of a person's depression: any history of depression and comorbid mental health or physical disorders	
mental health services	1	0.2	4	Page 14of 44 1.3.9 When adults with type 2 diabetes are admitted to hospital as inpatients or to any other care setting, implement a meal planning system that provides consistency in the carbohydrate content of meals and snacks. 1.3.10 For recommendations on lifestyle advice, see the NICE guidelines on: preventing excess weight gain, weight management, obesity, physical activity, smoking: brief interventions and referrals, stop smoking services, smoking: harm reduction, and smoking: acute, maternity and mental health services. 1.3.11 For recommendations on bariatric surgery for people with recent-onset type 2 diabetes, see the section on bariatric surgery for people with recent-onset type 2 diabetes in the NICE guideline on obesity. 1.4 Blood pressure management 1.4.1 Measure blood pressure at least annually in an adult with type 2 diabetes without previously diagnosed hypertension or renal disease.	Page 14of 44 1.3.9 When adults with type 2 diabetes are admitted to hospital as inpatients or to any other care setting, implement a meal planning system that provides consistency in the carbohydrate content of meals and snacks. 1.3.10 For recommendations on lifestyle advice, see the NICE guidelines on: preventing excess weight gain, weight management, obesity, physical activity, smoking: brief interventions and referrals, stop smoking services, smoking: harm reduction, and smoking: acute, maternity and mental health services. 1.3.11 For recommendations on bariatric surgery for people with recent-onset type 2 diabetes, see the section on bariatric surgery for people with recent-onset type 2 diabetes in the NICE guideline on obesity. 1.4 Blood pressure management 1.4.1 Measure blood pressure at least annually in an adult with type 2 diabetes without previously diagnosed hypertension or renal disease.	For people with severe depression and those with moderate depression and complex problems, consider: referring to specialist mental health services for a programme of coordinated multiprofessional care	For people with severe depression and those with moderate depression and complex problems, consider: referring to specialist mental health services for a programme of coordinated multiprofessional care	
physical health problem	0	0.2	2	For people with severe depression and those with moderate depression and complex problems, consider: providing collaborative care if the depression is in the context of a chronic physical health problem with associated functional impairment	For people with severe depression and those with moderate depression and complex problems, consider: providing collaborative care if the depression is in the context of a chronic physical health problem with associated functional impairment	
specialist mental health	0	0.2	2	For people with severe depression and those with moderate depression and complex problems, consider: referring to specialist mental health services for a programme of coordinated multiprofessional care	For people with severe depression and those with moderate depression and complex problems, consider: referring to specialist mental health services for a programme of coordinated multiprofessional care	
regular physical exercise	0	0.1429	2	Offer people with depression advice on sleep hygiene if needed, including: taking regular physical exercise.	Offer people with depression advice on sleep hygiene if needed, including: taking regular physical exercise.	
wake times offer	0	0.1429	0	
