initial drug treatment1.6.19 offer standard-release	0	0.3333	2	Initial drug treatment1.6.19 Offer standard-release metformin as the initial drug treatment for adults with type 2 diabetes. 1.6.20 Gradually increase the dose of standard-release metformin over several weeks to minimise the risk of gastrointestinal side effects in adults with type 2 diabetes. 1.6.21 If an adult with type 2 diabetes experiences gastrointestinal side effects with standard-release metformin, consider a trial of modified-release metformin..	Initial drug treatment1.6.19 Offer standard-release metformin as the initial drug treatment for adults with type 2 diabetes. 1.6.20 Gradually increase the dose of standard-release metformin over several weeks to minimise the risk of gastrointestinal side effects in adults with type 2 diabetes. 1.6.21 If an adult with type 2 diabetes experiences gastrointestinal side effects with standard-release metformin, consider a trial of modified-release metformin..	
management 1.4.1 measure blood	0	0.3333	2	Page 14of 44 1.3.9 When adults with type 2 diabetes are admitted to hospital as inpatients or to any other care setting, implement a meal planning system that provides consistency in the carbohydrate content of meals and snacks. 1.3.10 For recommendations on lifestyle advice, see the NICE guidelines on: preventing excess weight gain, weight management, obesity, physical activity, smoking: brief interventions and referrals, stop smoking services, smoking: harm reduction, and smoking: acute, maternity and mental health services. 1.3.11 For recommendations on bariatric surgery for people with recent-onset type 2 diabetes, see the section on bariatric surgery for people with recent-onset type 2 diabetes in the NICE guideline on obesity. 1.4 Blood pressure management 1.4.1 Measure blood pressure at least annually in an adult with type 2 diabetes without previously diagnosed hypertension or renal disease.	Page 14of 44 1.3.9 When adults with type 2 diabetes are admitted to hospital as inpatients or to any other care setting, implement a meal planning system that provides consistency in the carbohydrate content of meals and snacks. 1.3.10 For recommendations on lifestyle advice, see the NICE guidelines on: preventing excess weight gain, weight management, obesity, physical activity, smoking: brief interventions and referrals, stop smoking services, smoking: harm reduction, and smoking: acute, maternity and mental health services. 1.3.11 For recommendations on bariatric surgery for people with recent-onset type 2 diabetes, see the section on bariatric surgery for people with recent-onset type 2 diabetes in the NICE guideline on obesity. 1.4 Blood pressure management 1.4.1 Measure blood pressure at least annually in an adult with type 2 diabetes without previously diagnosed hypertension or renal disease.	
pressure management 1.4.1 measure	0	0.3333	2	Page 14of 44 1.3.9 When adults with type 2 diabetes are admitted to hospital as inpatients or to any other care setting, implement a meal planning system that provides consistency in the carbohydrate content of meals and snacks. 1.3.10 For recommendations on lifestyle advice, see the NICE guidelines on: preventing excess weight gain, weight management, obesity, physical activity, smoking: brief interventions and referrals, stop smoking services, smoking: harm reduction, and smoking: acute, maternity and mental health services. 1.3.11 For recommendations on bariatric surgery for people with recent-onset type 2 diabetes, see the section on bariatric surgery for people with recent-onset type 2 diabetes in the NICE guideline on obesity. 1.4 Blood pressure management 1.4.1 Measure blood pressure at least annually in an adult with type 2 diabetes without previously diagnosed hypertension or renal disease.	Page 14of 44 1.3.9 When adults with type 2 diabetes are admitted to hospital as inpatients or to any other care setting, implement a meal planning system that provides consistency in the carbohydrate content of meals and snacks. 1.3.10 For recommendations on lifestyle advice, see the NICE guidelines on: preventing excess weight gain, weight management, obesity, physical activity, smoking: brief interventions and referrals, stop smoking services, smoking: harm reduction, and smoking: acute, maternity and mental health services. 1.3.11 For recommendations on bariatric surgery for people with recent-onset type 2 diabetes, see the section on bariatric surgery for people with recent-onset type 2 diabetes in the NICE guideline on obesity. 1.4 Blood pressure management 1.4.1 Measure blood pressure at least annually in an adult with type 2 diabetes without previously diagnosed hypertension or renal disease.	
treatment1.6.19 offer standard-release metformin	0	0.3333	2	Initial drug treatment1.6.19 Offer standard-release metformin as the initial drug treatment for adults with type 2 diabetes. 1.6.20 Gradually increase the dose of standard-release metformin over several weeks to minimise the risk of gastrointestinal side effects in adults with type 2 diabetes. 1.6.21 If an adult with type 2 diabetes experiences gastrointestinal side effects with standard-release metformin, consider a trial of modified-release metformin..	Initial drug treatment1.6.19 Offer standard-release metformin as the initial drug treatment for adults with type 2 diabetes. 1.6.20 Gradually increase the dose of standard-release metformin over several weeks to minimise the risk of gastrointestinal side effects in adults with type 2 diabetes. 1.6.21 If an adult with type 2 diabetes experiences gastrointestinal side effects with standard-release metformin, consider a trial of modified-release metformin..	
insulin glargine if:the person	0	0.3152	2	Consider, as an alternative to NPH insulin, using insulin detemir or insulin glargine if:the person needs assistance from a carer or healthcare professional to inject insulin, and use of insulin detemir or insulin glargine would reduce the frequency of injections from twice to once daily or the person's lifestyle is restricted by recurrent symptomatic hypoglycaemic episodes or the person would otherwise need twice-daily NPH insulin injections in combination with oral glucose-lowering drugs..	Consider, as an alternative to NPH insulin, using insulin detemir or insulin glargine if:the person needs assistance from a carer or healthcare professional to inject insulin, and use of insulin detemir or insulin glargine would reduce the frequency of injections from twice to once daily or the person's lifestyle is restricted by recurrent symptomatic hypoglycaemic episodes or the person would otherwise need twice-daily NPH insulin injections in combination with oral glucose-lowering drugs..	
tight blood glucose control	0	0.3104	2	Page 18of 44 on a case-by-case basis, with particular consideration for people who are older or frail, for adults with type 2 diabetes: who are unlikely to achieve longer-term risk-reduction benefits, for example, people with a reduced life expectancy for whom tight blood glucose control poses a high risk of the consequences of hypoglycaemia, for example, people who are at risk of falling, people who have impaired awareness of hypoglycaemia, and people who drive or operate machinery as part of their job for whom intensive management would not be appropriate, for example, people with significant comorbidities. 1.6.10 If adults with type 2 diabetes achieve an HbA1c level that is lower than their target and they are not experiencing hypoglycaemia, encourage them to maintain it.	Page 18of 44 on a case-by-case basis, with particular consideration for people who are older or frail, for adults with type 2 diabetes: who are unlikely to achieve longer-term risk-reduction benefits, for example, people with a reduced life expectancy for whom tight blood glucose control poses a high risk of the consequences of hypoglycaemia, for example, people who are at risk of falling, people who have impaired awareness of hypoglycaemia, and people who drive or operate machinery as part of their job for whom intensive management would not be appropriate, for example, people with significant comorbidities. 1.6.10 If adults with type 2 diabetes achieve an HbA1c level that is lower than their target and they are not experiencing hypoglycaemia, encourage them to maintain it.	
pre-mixed biphasic insulin preparation	0	0.1697	2	Page 26of 44 who need help from a carer or healthcare professional to administer insulin injections and for whom switching to one of the long-acting insulin analogues would reduce the number of daily injections. 1.6.36 Monitor adults with type 2 diabetes who are on a basal insulin regimen (NPH insulin, insulin detemir or insulin glargine ) for the need for short-acting insulin before meals (or a pre-mixed biphasic insulin preparation). 1.6.37 Monitor adults with type 2 diabetes who are on pre-mixed (biphasic) insulin for the need for a further injection of short-acting insulin before meals or for a change to a basal bolus regimen with NPH insulin or insulin detemir or insulin glargine , if blood glucose control remains inadequate..	Page 26of 44 who need help from a carer or healthcare professional to administer insulin injections and for whom switching to one of the long-acting insulin analogues would reduce the number of daily injections. 1.6.36 Monitor adults with type 2 diabetes who are on a basal insulin regimen (NPH insulin, insulin detemir or insulin glargine ) for the need for short-acting insulin before meals (or a pre-mixed biphasic insulin preparation). 1.6.37 Monitor adults with type 2 diabetes who are on pre-mixed (biphasic) insulin for the need for a further injection of short-acting insulin before meals or for a change to a basal bolus regimen with NPH insulin or insulin detemir or insulin glargine , if blood glucose control remains inadequate..	
erectile dysfunction1.7.13 offer men	0	0.0	2	Erectile dysfunction1.7.13 Offer men with type 2 diabetes the opportunity to discuss erectile dysfunction as part of their annual review. 1.7.14 Assess, educate and support men with type 2 diabetes who have problematic erectile dysfunction, addressing contributory factors such as cardiovascular disease as well as possible treatment options. 1.7.15 Consider a phosphodiesterase-5 inhibitor to treat problematic ere	Erectile dysfunction1.7.13 Offer men with type 2 diabetes the opportunity to discuss erectile dysfunction as part of their annual review. 1.7.14 Assess, educate and support men with type 2 diabetes who have problematic erectile dysfunction, addressing contributory factors such as cardiovascular disease as well as possible treatment options. 1.7.15 Consider a phosphodiesterase-5 inhibitor to treat problematic ere	
