comparaison directe	0	0.6263	4	En l'absence de données bibliographiques sur la comparaison directe des différentes stratégies thérapeutiques, les recommandations ne peuvent pas être élaborées selon un critère d'efficience2.	L'analyse de la littérature a souligné le faible niveau de preuve des données (effectif faible, suivi insuffisant, critères inadaptés) concernant :   la validation du taux d'HbA1c comme critère de substitution à des critères finaux de morbi-mortalité dans le diabète de type 2 ;   l'effet des différents traitements sur la morbi-mortalité du diabète de type 2 (micro-angiopathie, événement cardio-vasculaire, mortalité liée au diabète) ;   la balance bénéfice risque des différents médicaments antidiabétiques en comparaison directe (en particulier inhibiteurs DPP-4 vs sulfamides) ;   des comparaisons directes entre les différentes stratégies, en particulier une stratégie classique (schéma metformine puis sulfamide puis insuline) vs une stratégie visant à limiter les hypoglycémies et la prise de poids (metformine puis inhibiteurs DPP-4 puis analogues du GLP-1), éventuellement en fonction du profil des patients ;   des données dans les sous-groupes de patients diabétiques tels que les personnes âgées, les patients atteints de comorbidités, les femmes enceintes ;   la modélisation de l'efficience :  de différentes stratégies thérapeutiques, dont les mesures hygiéno-diététiques,  pour certaines populations, dont les patients nouvellement diagnostiqués et les patients pour lesquels certains traitements sont contre-indiqués ;   la mesure de la qualité de vie associée aux hypoglycémies11, à la prise de poids et au traitement par insuline afin d'estimer la pondération de la durée de vie liée à ces états de santé dans une étude d'efficience.	En l'absence de données bibliographiques sur la comparaison directe des différentes stratégies thérapeutiques, les recommandations ne peuvent pas être élaborées selon un critère d'efficience2.	L'analyse de la littérature a souligné le faible niveau de preuve des données (effectif faible, suivi insuffisant, critères inadaptés) concernant :   la validation du taux d'HbA1c comme critère de substitution à des critères finaux de morbi-mortalité dans le diabète de type 2 ;   l'effet des différents traitements sur la morbi-mortalité du diabète de type 2 (micro-angiopathie, événement cardio-vasculaire, mortalité liée au diabète) ;   la balance bénéfice risque des différents médicaments antidiabétiques en comparaison directe (en particulier inhibiteurs DPP-4 vs sulfamides) ;   des comparaisons directes entre les différentes stratégies, en particulier une stratégie classique (schéma metformine puis sulfamide puis insuline) vs une stratégie visant à limiter les hypoglycémies et la prise de poids (metformine puis inhibiteurs DPP-4 puis analogues du GLP-1), éventuellement en fonction du profil des patients ;   des données dans les sous-groupes de patients diabétiques tels que les personnes âgées, les patients atteints de comorbidités, les femmes enceintes ;   la modélisation de l'efficience :  de différentes stratégies thérapeutiques, dont les mesures hygiéno-diététiques,  pour certaines populations, dont les patients nouvellement diagnostiqués et les patients pour lesquels certains traitements sont contre-indiqués ;   la mesure de la qualité de vie associée aux hypoglycémies11, à la prise de poids et au traitement par insuline afin d'estimer la pondération de la durée de vie liée à ces états de santé dans une étude d'efficience.	
stratégies thérapeutiques	0	0.6263	4	En l'absence de données bibliographiques sur la comparaison directe des différentes stratégies thérapeutiques, les recommandations ne peuvent pas être élaborées selon un critère d'efficience2.	L'analyse de la littérature a souligné le faible niveau de preuve des données (effectif faible, suivi insuffisant, critères inadaptés) concernant :   la validation du taux d'HbA1c comme critère de substitution à des critères finaux de morbi-mortalité dans le diabète de type 2 ;   l'effet des différents traitements sur la morbi-mortalité du diabète de type 2 (micro-angiopathie, événement cardio-vasculaire, mortalité liée au diabète) ;   la balance bénéfice risque des différents médicaments antidiabétiques en comparaison directe (en particulier inhibiteurs DPP-4 vs sulfamides) ;   des comparaisons directes entre les différentes stratégies, en particulier une stratégie classique (schéma metformine puis sulfamide puis insuline) vs une stratégie visant à limiter les hypoglycémies et la prise de poids (metformine puis inhibiteurs DPP-4 puis analogues du GLP-1), éventuellement en fonction du profil des patients ;   des données dans les sous-groupes de patients diabétiques tels que les personnes âgées, les patients atteints de comorbidités, les femmes enceintes ;   la modélisation de l'efficience :  de différentes stratégies thérapeutiques, dont les mesures hygiéno-diététiques,  pour certaines populations, dont les patients nouvellement diagnostiqués et les patients pour lesquels certains traitements sont contre-indiqués ;   la mesure de la qualité de vie associée aux hypoglycémies11, à la prise de poids et au traitement par insuline afin d'estimer la pondération de la durée de vie liée à ces états de santé dans une étude d'efficience.	En l'absence de données bibliographiques sur la comparaison directe des différentes stratégies thérapeutiques, les recommandations ne peuvent pas être élaborées selon un critère d'efficience2.	L'analyse de la littérature a souligné le faible niveau de preuve des données (effectif faible, suivi insuffisant, critères inadaptés) concernant :   la validation du taux d'HbA1c comme critère de substitution à des critères finaux de morbi-mortalité dans le diabète de type 2 ;   l'effet des différents traitements sur la morbi-mortalité du diabète de type 2 (micro-angiopathie, événement cardio-vasculaire, mortalité liée au diabète) ;   la balance bénéfice risque des différents médicaments antidiabétiques en comparaison directe (en particulier inhibiteurs DPP-4 vs sulfamides) ;   des comparaisons directes entre les différentes stratégies, en particulier une stratégie classique (schéma metformine puis sulfamide puis insuline) vs une stratégie visant à limiter les hypoglycémies et la prise de poids (metformine puis inhibiteurs DPP-4 puis analogues du GLP-1), éventuellement en fonction du profil des patients ;   des données dans les sous-groupes de patients diabétiques tels que les personnes âgées, les patients atteints de comorbidités, les femmes enceintes ;   la modélisation de l'efficience :  de différentes stratégies thérapeutiques, dont les mesures hygiéno-diététiques,  pour certaines populations, dont les patients nouvellement diagnostiqués et les patients pour lesquels certains traitements sont contre-indiqués ;   la mesure de la qualité de vie associée aux hypoglycémies11, à la prise de poids et au traitement par insuline afin d'estimer la pondération de la durée de vie liée à ces états de santé dans une étude d'efficience.	
stratégie médicamenteuse	0	0.62	10	La HAS a inscrit à son programme de travail 2009 l'élaboration de recommandations de bonne pratique sur la stratégie médicamenteuse du contrôle glycémique du diabète de type 2 en intégrant un critère d'efficience sur saisine de la Direction de la sécurité sociale (DSS) et la Caisse nationale de l'assurance maladie des travailleurs salariés (Cnamts).	Cette recommandation vise à définir :  des objectifs glycémiques cibles ;  une stratégie médicamenteuse du contrôle glycémique ;  la place de l'autosurveillance glycémique.	Cette recommandation n'aborde le thème du diabète de type 2 que dans le champ du contrôle glycémique (fixation d'objectifs glycémiques, stratégie médicamenteuse et place de l'autosurveillance glycémique).	Le schéma général de la stratégie médicamenteuse du contrôle glycémique ne peut envisager tous les cas particuliers.	Pour cette recommandation, le taux d'HbA1c comme critère intermédiaire a été retenu afin de situer la place des nouvelles molécules dans la stratégie médicamenteuse en l'absence de données de morbi-mortalité pour ces molécules.	La HAS a inscrit à son programme de travail 2009 l'élaboration de recommandations de bonne pratique sur la stratégie médicamenteuse du contrôle glycémique du diabète de type 2 en intégrant un critère d'efficience sur saisine de la Direction de la sécurité sociale (DSS) et la Caisse nationale de l'assurance maladie des travailleurs salariés (Cnamts).	Cette recommandation vise à définir :  des objectifs glycémiques cibles ;  une stratégie médicamenteuse du contrôle glycémique ;  la place de l'autosurveillance glycémique.	Cette recommandation n'aborde le thème du diabète de type 2 que dans le champ du contrôle glycémique (fixation d'objectifs glycémiques, stratégie médicamenteuse et place de l'autosurveillance glycémique).	Le schéma général de la stratégie médicamenteuse du contrôle glycémique ne peut envisager tous les cas particuliers.	Pour cette recommandation, le taux d'HbA1c comme critère intermédiaire a été retenu afin de situer la place des nouvelles molécules dans la stratégie médicamenteuse en l'absence de données de morbi-mortalité pour ces molécules.	
objectifs glycémiques	0	0.5955	10	Cette recommandation vise à définir :  des objectifs glycémiques cibles ;  une stratégie médicamenteuse du contrôle glycémique ;  la place de l'autosurveillance glycémique.	Cette recommandation n'aborde le thème du diabète de type 2 que dans le champ du contrôle glycémique (fixation d'objectifs glycémiques, stratégie médicamenteuse et place de l'autosurveillance glycémique).	Cette section aborde les objectifs glycémiques optimaux pour prévenir les risques liés à l'hyperglycémie et aux effets indésirables des traitements chez les patients diabétiques de type 2 (cas général) et dans quatre sous-populations particulières : les sujets âgés, les personnes ayant des antécédents cardio-vasculaires, les insuffisants rénaux chroniques et les femmes enceintes ou envisageant de l'être.	L'instauration d'une insulinothérapie nécessite la définition d'objectifs glycémiques clairs, la réalisation d'une autosurveillance glycémique, l'adaptation des doses 7 En l'absence de données sur l'association de ces monothérapies avec des analogues du GLP-1 et d'AMM, ces associations ne peuvent pas être envisagées8 Lors de la rédaction de la recommandation, seule la sitagliptine est autorisée et remboursable par l'Assurance maladie en trithérapie9 Lors de la rédaction de la recommandation, seul l'exénatide est autorisé en association avec l'insuline, et n'est pas remboursable par l'Assurance maladie dans cette indication.	HAS Service des bonnes pratiques professionnelles Service évaluation économique et santé publique janvier 2013 17 d'insuline afin d'atteindre les objectifs glycémiques, la connaissance des moyens de prévenir et de corriger les hypoglycémies et la réalisation adéquate de l'injection d'insuline.	Cette recommandation vise à définir :  des objectifs glycémiques cibles ;  une stratégie médicamenteuse du contrôle glycémique ;  la place de l'autosurveillance glycémique.	Cette recommandation n'aborde le thème du diabète de type 2 que dans le champ du contrôle glycémique (fixation d'objectifs glycémiques, stratégie médicamenteuse et place de l'autosurveillance glycémique).	Cette section aborde les objectifs glycémiques optimaux pour prévenir les risques liés à l'hyperglycémie et aux effets indésirables des traitements chez les patients diabétiques de type 2 (cas général) et dans quatre sous-populations particulières : les sujets âgés, les personnes ayant des antécédents cardio-vasculaires, les insuffisants rénaux chroniques et les femmes enceintes ou envisageant de l'être.	L'instauration d'une insulinothérapie nécessite la définition d'objectifs glycémiques clairs, la réalisation d'une autosurveillance glycémique, l'adaptation des doses 7 En l'absence de données sur l'association de ces monothérapies avec des analogues du GLP-1 et d'AMM, ces associations ne peuvent pas être envisagées8 Lors de la rédaction de la recommandation, seule la sitagliptine est autorisée et remboursable par l'Assurance maladie en trithérapie9 Lors de la rédaction de la recommandation, seul l'exénatide est autorisé en association avec l'insuline, et n'est pas remboursable par l'Assurance maladie dans cette indication.	HAS Service des bonnes pratiques professionnelles Service évaluation économique et santé publique janvier 2013 17 d'insuline afin d'atteindre les objectifs glycémiques, la connaissance des moyens de prévenir et de corriger les hypoglycémies et la réalisation adéquate de l'injection d'insuline.	
complications macrovasculaires	0	0.5863	2	Recommandation 2c   avec une comorbidité grave avérée et ou une espérance de vie limitée ( 5 ans),   OU avec des complications macrovasculaires évoluées,   OU ayant une longue durée d'évolution du diabète ( 10 ans) et pour lesquels la cible de 7 pour cent s'avère difficile à atteindre car l'intensification médicamenteuse provoque des hypoglycémies sévères,.	Recommandation 2c   avec une comorbidité grave avérée et ou une espérance de vie limitée ( 5 ans),   OU avec des complications macrovasculaires évoluées,   OU ayant une longue durée d'évolution du diabète ( 10 ans) et pour lesquels la cible de 7 pour cent s'avère difficile à atteindre car l'intensification médicamenteuse provoque des hypoglycémies sévères,.	
glycémies inférieures	0	0.5863	2	Des glycémies inférieures à 0,95 g l à jeun et 1,20 g l en post-prandial à 2 heures et un taux d'HbA1c inférieur à 6,5 pour cent, sous réserve d'être atteints sans hypoglycémie sévère, sont recommandés.	Des glycémies inférieures à 0,95 g l à jeun et 1,20 g l en post-prandial à 2 heures et un taux d'HbA1c inférieur à 6,5 pour cent, sous réserve d'être atteints sans hypoglycémie sévère, sont recommandés.	
glycémiques clairs	0	0.5863	2	L'instauration d'une insulinothérapie nécessite la définition d'objectifs glycémiques clairs, la réalisation d'une autosurveillance glycémique, l'adaptation des doses 7 En l'absence de données sur l'association de ces monothérapies avec des analogues du GLP-1 et d'AMM, ces associations ne peuvent pas être envisagées8 Lors de la rédaction de la recommandation, seule la sitagliptine est autorisée et remboursable par l'Assurance maladie en trithérapie9 Lors de la rédaction de la recommandation, seul l'exénatide est autorisé en association avec l'insuline, et n'est pas remboursable par l'Assurance maladie dans cette indication.	L'instauration d'une insulinothérapie nécessite la définition d'objectifs glycémiques clairs, la réalisation d'une autosurveillance glycémique, l'adaptation des doses 7 En l'absence de données sur l'association de ces monothérapies avec des analogues du GLP-1 et d'AMM, ces associations ne peuvent pas être envisagées8 Lors de la rédaction de la recommandation, seule la sitagliptine est autorisée et remboursable par l'Assurance maladie en trithérapie9 Lors de la rédaction de la recommandation, seul l'exénatide est autorisé en association avec l'insuline, et n'est pas remboursable par l'Assurance maladie dans cette indication.	
hypoglycémies sévères	0	0.5863	2	Recommandation 2c   avec une comorbidité grave avérée et ou une espérance de vie limitée ( 5 ans),   OU avec des complications macrovasculaires évoluées,   OU ayant une longue durée d'évolution du diabète ( 10 ans) et pour lesquels la cible de 7 pour cent s'avère difficile à atteindre car l'intensification médicamenteuse provoque des hypoglycémies sévères,.	Recommandation 2c   avec une comorbidité grave avérée et ou une espérance de vie limitée ( 5 ans),   OU avec des complications macrovasculaires évoluées,   OU ayant une longue durée d'évolution du diabète ( 10 ans) et pour lesquels la cible de 7 pour cent s'avère difficile à atteindre car l'intensification médicamenteuse provoque des hypoglycémies sévères,.	
intensification médicamenteuse	0	0.5863	2	Recommandation 2c   avec une comorbidité grave avérée et ou une espérance de vie limitée ( 5 ans),   OU avec des complications macrovasculaires évoluées,   OU ayant une longue durée d'évolution du diabète ( 10 ans) et pour lesquels la cible de 7 pour cent s'avère difficile à atteindre car l'intensification médicamenteuse provoque des hypoglycémies sévères,.	Recommandation 2c   avec une comorbidité grave avérée et ou une espérance de vie limitée ( 5 ans),   OU avec des complications macrovasculaires évoluées,   OU ayant une longue durée d'évolution du diabète ( 10 ans) et pour lesquels la cible de 7 pour cent s'avère difficile à atteindre car l'intensification médicamenteuse provoque des hypoglycémies sévères,.	
cible thérapeutique	0	0.5859	2	Recommandation 1 convient :   d'expliquer le choix de l'objectif et de s'accorder avec le patient dans le cadre d'une éducation thérapeutique ;   d'encourager la personne à atteindre et maintenir son objectif individualisé ;   de mobiliser les moyens thérapeutiques recommandés pour atteindre la cible d'HbA1c, notamment les mesures hygiéno-diététiques ;   de réévaluer l'objectif et ou les moyens :  si les effets secondaires (dont les hypoglycémies et la prise de poids) ou les efforts fournis altèrent sensiblement la qualité de vie,  si le profil clinique du patient se modifie ;   d'informer la personne ayant une HbA1c au-delà de l'objectif fixé qu'une diminution de l'HbA1c vers sa cible thérapeutique s'accompagne de bénéfices pour sa santé.	Recommandation 1 convient :   d'expliquer le choix de l'objectif et de s'accorder avec le patient dans le cadre d'une éducation thérapeutique ;   d'encourager la personne à atteindre et maintenir son objectif individualisé ;   de mobiliser les moyens thérapeutiques recommandés pour atteindre la cible d'HbA1c, notamment les mesures hygiéno-diététiques ;   de réévaluer l'objectif et ou les moyens :  si les effets secondaires (dont les hypoglycémies et la prise de poids) ou les efforts fournis altèrent sensiblement la qualité de vie,  si le profil clinique du patient se modifie ;   d'informer la personne ayant une HbA1c au-delà de l'objectif fixé qu'une diminution de l'HbA1c vers sa cible thérapeutique s'accompagne de bénéfices pour sa santé.	
moyens thérapeutiques	0	0.5859	2	Recommandation 1 convient :   d'expliquer le choix de l'objectif et de s'accorder avec le patient dans le cadre d'une éducation thérapeutique ;   d'encourager la personne à atteindre et maintenir son objectif individualisé ;   de mobiliser les moyens thérapeutiques recommandés pour atteindre la cible d'HbA1c, notamment les mesures hygiéno-diététiques ;   de réévaluer l'objectif et ou les moyens :  si les effets secondaires (dont les hypoglycémies et la prise de poids) ou les efforts fournis altèrent sensiblement la qualité de vie,  si le profil clinique du patient se modifie ;   d'informer la personne ayant une HbA1c au-delà de l'objectif fixé qu'une diminution de l'HbA1c vers sa cible thérapeutique s'accompagne de bénéfices pour sa santé.	Recommandation 1 convient :   d'expliquer le choix de l'objectif et de s'accorder avec le patient dans le cadre d'une éducation thérapeutique ;   d'encourager la personne à atteindre et maintenir son objectif individualisé ;   de mobiliser les moyens thérapeutiques recommandés pour atteindre la cible d'HbA1c, notamment les mesures hygiéno-diététiques ;   de réévaluer l'objectif et ou les moyens :  si les effets secondaires (dont les hypoglycémies et la prise de poids) ou les efforts fournis altèrent sensiblement la qualité de vie,  si le profil clinique du patient se modifie ;   d'informer la personne ayant une HbA1c au-delà de l'objectif fixé qu'une diminution de l'HbA1c vers sa cible thérapeutique s'accompagne de bénéfices pour sa santé.	
objectif individualisé	0	0.5859	2	Recommandation 1 convient :   d'expliquer le choix de l'objectif et de s'accorder avec le patient dans le cadre d'une éducation thérapeutique ;   d'encourager la personne à atteindre et maintenir son objectif individualisé ;   de mobiliser les moyens thérapeutiques recommandés pour atteindre la cible d'HbA1c, notamment les mesures hygiéno-diététiques ;   de réévaluer l'objectif et ou les moyens :  si les effets secondaires (dont les hypoglycémies et la prise de poids) ou les efforts fournis altèrent sensiblement la qualité de vie,  si le profil clinique du patient se modifie ;   d'informer la personne ayant une HbA1c au-delà de l'objectif fixé qu'une diminution de l'HbA1c vers sa cible thérapeutique s'accompagne de bénéfices pour sa santé.	Recommandation 1 convient :   d'expliquer le choix de l'objectif et de s'accorder avec le patient dans le cadre d'une éducation thérapeutique ;   d'encourager la personne à atteindre et maintenir son objectif individualisé ;   de mobiliser les moyens thérapeutiques recommandés pour atteindre la cible d'HbA1c, notamment les mesures hygiéno-diététiques ;   de réévaluer l'objectif et ou les moyens :  si les effets secondaires (dont les hypoglycémies et la prise de poids) ou les efforts fournis altèrent sensiblement la qualité de vie,  si le profil clinique du patient se modifie ;   d'informer la personne ayant une HbA1c au-delà de l'objectif fixé qu'une diminution de l'HbA1c vers sa cible thérapeutique s'accompagne de bénéfices pour sa santé.	
