mmol mol	0	1.6525	3	For adults with type 2 diabetes managed either by lifestyle and diet, or by lifestyle and diet combined with a single drug not associated with hypoglycaemia, support the person to aim for an HbA1c level of 48 mmol mol(6.5percent).	For adults on a drug associated with hypoglycaemia, support the person to aim for an HbA1c level of 53 mmol mol (7.0percent).	In adults with type 2 diabetes, if HbA1c levels are not adequately controlled by a single drug and rise to 58 mmol mol (7.5percent) or higher: reinforce advice about diet, lifestyle and adherence to drug treatment and support the person to aim for an HbA1c level of 53 mmol mol (7.0percent) and intensify drug treatment.	
low hba1c level	0	1.6	2	Be aware that there are other possible reasons for a low HbA1c level, for example, deteriorating renal function or sudden weight loss.	Be aware that there are other possible reasons for a low HbA1c level, for example, deteriorating renal function or sudden weight loss.	
mmhg	0	1.6	2	Add medications if lifestyle advice does not reduce blood pressure to below 140 80 mmHg (below 130 80 mmHg if there is kidney, eye or cerebrovascular damage).	Monitor blood pressure every 1–2 months, and intensify therapy if the person is already on antihypertensive drug treatment, until the blood pressure is consistently below 140 80 mmHg (below 130 80 mmHg if there is kidney, eye or cerebrovascular damage).	
sudden weight loss	0	1.6	2	Be aware that there are other possible reasons for a low HbA1c level, for example, deteriorating renal function or sudden weight loss.	Be aware that there are other possible reasons for a low HbA1c level, for example, deteriorating renal function or sudden weight loss.	
foot problems	0	1.5204	1	For guidance on preventing and managing foot problems in adults with type 2 diabetes, see the NICE guideline on diabetic foot problems.	
group education	0	1.5204	1	Offer group education programmes as the preferred option. Provide an alternative of equal standard for a person unable or unwilling to participate in group education.	
kidney disease	1	1.5204	1	For guidance on managing kidney disease in adults with type 2 diabetes, see the NICE guideline on chronic kidney disease in adults.	
low hba1c	0	1.5204	2	Be aware that there are other possible reasons for a low HbA1c level, for example, deteriorating renal function or sudden weight loss.	Be aware that there are other possible reasons for a low HbA1c level, for example, deteriorating renal function or sudden weight loss.	
renal function	0	1.5204	2	Be aware that there are other possible reasons for a low HbA1c level, for example, deteriorating renal function or sudden weight loss.	Be aware that there are other possible reasons for a low HbA1c level, for example, deteriorating renal function or sudden weight loss.	
sudden weight	0	1.5204	2	Be aware that there are other possible reasons for a low HbA1c level, for example, deteriorating renal function or sudden weight loss.	Be aware that there are other possible reasons for a low HbA1c level, for example, deteriorating renal function or sudden weight loss.	
mol	0	1.5	7	For adults with type 2 diabetes managed either by lifestyle and diet, or by lifestyle and diet combined with a single drug not associated with hypoglycaemia, support the person to aim for an HbA1c level of 48 mmol mol(6.5percent).	For adults on a drug associated with hypoglycaemia, support the person to aim for an HbA1c level of 53 mmol mol (7.0percent).	In adults with type 2 diabetes, if HbA1c levels are not adequately controlled by a single drug and rise to 58 mmol mol (7.5percent) or higher: reinforce advice about diet, lifestyle and adherence to drug treatment and support the person to aim for an HbA1c level of 53 mmol mol (7.0percent) and intensify drug treatment.	Depending on the findings, follow structured eye screening by: routine review in 1 year or earlier review or referral to an ophthalmologist.	Arrange emergency review by an ophthalmologist for: sudden loss of vision rubeosis iridis pre-retinal or vitreous haemorrhage retinal detachment.	Arrange rapid review by an ophthalmologist for new vessel formation.	Refer to an ophthalmologist in accordance with the National Screening Committee criteria and timelines if any of these features are present: referable maculopathy: exudate or retinal thickening within 1 disc diameter of the centre of the fovea circinate or group of exudates within the macula (the macula is defined here as a circle centred on the fovea, with a diameter the distance between the temporal border of the optic disc and the fovea) any microaneurysm or haemorrhage within 1 disc diameter of the centre of the fovea, only if associated with deterioration of best visual acuity to 6 12 or worse. referable pre-proliferative retinopathy (if cotton wool spots are present, look carefully for the following features, but cotton wool spots themselves do not define pre-proliferative retinopathy): any venous beading any venous reduplication any intraretinal microvascular abnormalities multiple deep, round or blot haemorrhages. any large, sudden unexplained drop in visual acuity.	
smoking	1	1.5	1	For recommendations on lifestyle advice, see the NICE guidelines on: preventing excess weight gain, weight management, obesity, physical activity, smoking: brief interventions and referrals, stop smoking services, smoking: harm reduction, and smoking: acute, maternity and mental health services.	
initial body weight loss target	0	1.4421	1	For adults with type 2 diabetes who are overweight, set an initial body weight loss target of 5–10percent.	
ace inhibitor	0	1.435	4	The first-line antihypertensive drug treatment for a person of African or Caribbean family origin should be an ACE inhibitor plus either a diuretic or a generic calcium-channel blocker.	For a person with continuing intolerance to an ACE inhibitor (other than renal deterioration or hyperkalaemia), substitute an angiotensin II-receptor antagonist for the ACE inhibitor.	Do not combine an ACE inhibitor with an angiotensin II-receptor antagonist to treat hypertension.	If the person's blood pressure is not reduced to the individually agreed target with triple therapy, add an alpha-blocker, a beta-blocker or a potassium-sparing diuretic (the last with caution if the person is already taking an ACE inhibitor or an angiotensin II-receptor antagonist).	
blood glucose levels	0	1.4296	2	Do not routinely offer self-monitoring of blood glucose levels for adults with type 2 diabetes unless: the person is on insulin or there is evidence of hypoglycaemic episodes or the person is on oral medication that may increase their risk of hypoglycaemia while driving or operating machinery or the person is pregnant, or is planning to become pregnant.	Consider short-term self-monitoring of blood glucose levels in adults with type 2 diabetes (and review treatment as necessary): when starting treatment with oral or intravenous corticosteroids or to confirm suspected hypoglycaemia.	
caribbean family origin	0	1.4296	2	Exceptions to this are people of African or Caribbean family origin, or women for whom there is a possibility of becoming pregnant.	The first-line antihypertensive drug treatment for a person of African or Caribbean family origin should be an ACE inhibitor plus either a diuretic or a generic calcium-channel blocker.	
problematic erectile dysfunction	0	1.4296	2	Assess, educate and support men with type 2 diabetes who have problematic erectile dysfunction, addressing contributory factors such as cardiovascular disease as well as possible treatment options.	Consider a phosphodiesterase-5 inhibitor to treat problematic erectile dysfunction in men with type 2 diabetes, initially choosing the drug with the lowest acquisition cost and taking into account any contraindications.	
insulin	0	1.4259	2	Reducing the risk of hypoglycaemia should be a particular aim for a person using insulin or an insulin secretagogue.	Do not routinely offer self-monitoring of blood glucose levels for adults with type 2 diabetes unless: the person is on insulin or there is evidence of hypoglycaemic episodes or the person is on oral medication that may increase their risk of hypoglycaemia while driving or operating machinery or the person is pregnant, or is planning to become pregnant.	
weight loss	0	1.4071	4	For adults with type 2 diabetes who are overweight, set an initial body weight loss target of 5–10percent.	Remember that lesser degrees of weight loss may still be of benefit, and that larger degrees of weight loss in the longer term will have advantageous metabolic impact.	Be aware that there are other possible reasons for a low HbA1c level, for example, deteriorating renal function or sudden weight loss.	Be aware that there are other possible reasons for a low HbA1c level, for example, deteriorating renal function or sudden weight loss.	
body weight loss target	0	1.3979	1	For adults with type 2 diabetes who are overweight, set an initial body weight loss target of 5–10percent.	
contributory sympathetic nervous system	0	1.3979	1	Think about the possibility of contributory sympathetic nervous system damage for adults with type 2 diabetes who lose the warning signs of hypoglycaemia.	
digital retinal photography programme	0	1.3979	1	Use a quality-assured digital retinal photography programme using appropriately trained staff.	
erratic blood glucose control	0	1.3979	1	Think about a diagnosis of gastroparesis in adults with type 2 diabetes with erratic blood glucose control or unexplained gastric bloating or vomiting, taking into account possible alternative diagnoses.	
initial body weight loss	0	1.3979	1	For adults with type 2 diabetes who are overweight, set an initial body weight loss target of 5–10percent.	
local eye screening service	0	1.3979	1	On diagnosis, GPs should immediately refer adults with type 2 diabetes to the local eye screening service.	
painful diabetic peripheral neuropathy	0	1.3979	1	For guidance on managing painful diabetic peripheral neuropathy in adults with type 2 diabetes, see the NICE guideline on neuropathic pain in adults.	
perform visual acuity testing	0	1.3979	1	Perform visual acuity testing as a routine part of eye screening programmes.	
quality-assured digital retinal photography	0	1.3979	1	Use a quality-assured digital retinal photography programme using appropriately trained staff.	
sympathetic nervous system damage	0	1.3979	1	Think about the possibility of contributory sympathetic nervous system damage for adults with type 2 diabetes who lose the warning signs of hypoglycaemia.	
vitreous haemorrhage retinal detachment	0	1.3979	1	Arrange emergency review by an ophthalmologist for: sudden loss of vision rubeosis iridis pre-retinal or vitreous haemorrhage retinal detachment.	
adverse effects	0	1.3657	2	Check for possible adverse effects of antihypertensive drug treatment – including the risks from unnecessarily low blood pressure.	Encourage them to achieve the target and maintain it unless any resulting adverse effects (including hypoglycaemia), or their efforts to achievetheir target, impair their quality of life.	
cardiovascular disease	0	1.3657	2	Do not offer antiplatelet therapy (aspirin or clopidogrel) for adults with type 2 diabetes without cardiovascular disease.	Assess, educate and support men with type 2 diabetes who have problematic erectile dysfunction, addressing contributory factors such as cardiovascular disease as well as possible treatment options.	
caribbean family	0	1.3657	2	Exceptions to this are people of African or Caribbean family origin, or women for whom there is a possibility of becoming pregnant.	The first-line antihypertensive drug treatment for a person of African or Caribbean family origin should be an ACE inhibitor plus either a diuretic or a generic calcium-channel blocker.	
diabetes care	0	1.3657	2	Adopt an individualised approach to diabetes care that is tailored to the needs and circumstances of adults with type 2 diabetes, taking into account their personal preferences, comorbidities, risks from polypharmacy, and their ability to benefit from long-term interventions because of reduced life expectancy.	Explain to people and their carers that structured education is an integral part of diabetes care.	
dietary advice	0	1.3657	2	Provide dietary advice in a form sensitive to the person's needs, culture and beliefs, being sensitive to their willingness to change and the effects on their quality of life.	Integrate dietary advice with a personalised diabetes management plan, including other aspects of lifestyle modification, such as increasing physical activity and losing weight.	
family origin	0	1.3657	2	Exceptions to this are people of African or Caribbean family origin, or women for whom there is a possibility of becoming pregnant.	The first-line antihypertensive drug treatment for a person of African or Caribbean family origin should be an ACE inhibitor plus either a diuretic or a generic calcium-channel blocker.	
glucose levels	0	1.3657	2	Do not routinely offer self-monitoring of blood glucose levels for adults with type 2 diabetes unless: the person is on insulin or there is evidence of hypoglycaemic episodes or the person is on oral medication that may increase their risk of hypoglycaemia while driving or operating machinery or the person is pregnant, or is planning to become pregnant.	Consider short-term self-monitoring of blood glucose levels in adults with type 2 diabetes (and review treatment as necessary): when starting treatment with oral or intravenous corticosteroids or to confirm suspected hypoglycaemia.	
phosphodiesterase-5 inhibitor	0	1.3657	2	Consider a phosphodiesterase-5 inhibitor to treat problematic erectile dysfunction in men with type 2 diabetes, initially choosing the drug with the lowest acquisition cost and taking into account any contraindications.	Following discussion, refer men with type 2 diabetes to a service offering other medical, surgical or psychological management of erectile dysfunction if treatment (including a phosphodiesterase-5 inhibitor, as appropriate) has been unsuccessful.	
problematic erectile	0	1.3657	2	Assess, educate and support men with type 2 diabetes who have problematic erectile dysfunction, addressing contributory factors such as cardiovascular disease as well as possible treatment options.	Consider a phosphodiesterase-5 inhibitor to treat problematic erectile dysfunction in men with type 2 diabetes, initially choosing the drug with the lowest acquisition cost and taking into account any contraindications.	
blood glucose	0	1.3459	3	Do not routinely offer self-monitoring of blood glucose levels for adults with type 2 diabetes unless: the person is on insulin or there is evidence of hypoglycaemic episodes or the person is on oral medication that may increase their risk of hypoglycaemia while driving or operating machinery or the person is pregnant, or is planning to become pregnant.	Consider short-term self-monitoring of blood glucose levels in adults with type 2 diabetes (and review treatment as necessary): when starting treatment with oral or intravenous corticosteroids or to confirm suspected hypoglycaemia.	Think about a diagnosis of gastroparesis in adults with type 2 diabetes with erratic blood glucose control or unexplained gastric bloating or vomiting, taking into account possible alternative diagnoses.	
reasons	0	1.339	3	Be aware that there are other possible reasons for a low HbA1c level, for example, deteriorating renal function or sudden weight loss.	Be aware that there are other possible reasons for a low HbA1c level, for example, deteriorating renal function or sudden weight loss.	Explain the reasons for, and success of, eye screening systems to adults with type 2 diabetes, so that attendance is not reduced by lack of knowledge or fear of outcome.	
antihypertensive drug treatments	0	1.3333	1	When using tricyclic drugs and antihypertensive drug treatments in adults with type 2 diabetes who have autonomic neuropathy, be aware of the increased likelihood of side effects such as orthostatic hypotension.	
arrange emergency review	0	1.3333	1	Arrange emergency review by an ophthalmologist for: sudden loss of vision rubeosis iridis pre-retinal or vitreous haemorrhage retinal detachment.	
arrange rapid review	0	1.3333	1	Arrange rapid review by an ophthalmologist for new vessel formation.	
autonomic neuropathy symptoms	0	1.3333	1	In managing autonomic neuropathy symptoms, include specific interventions indicated by the manifestations (for example, for abnormal sweating or nocturnal diarrhoea).	
blood glucose control	0	1.3333	1	Think about a diagnosis of gastroparesis in adults with type 2 diabetes with erratic blood glucose control or unexplained gastric bloating or vomiting, taking into account possible alternative diagnoses.	
blood pressure control	0	1.3333	1	For an adult with type 2 diabetes on antihypertensive drug treatment when diabetes is diagnosed, review blood pressure control and medications used.	
blood pressure target	0	1.3333	1	Monitor the blood pressure of a person who has attained and consistently remained at his or her blood pressure target every 4–6 months.	
body weight loss	0	1.3333	1	For adults with type 2 diabetes who are overweight, set an initial body weight loss target of 5–10percent.	
current drug treatment	0	1.3333	1	Make changes only if there is poor control or if current drug treatment is not appropriate because of microvascular complications or metabolic problems.	
degrees	0	1.3333	1	Remember that lesser degrees of weight loss may still be of benefit, and that larger degrees of weight loss in the longer term will have advantageous metabolic impact.	
diabetes management plan	0	1.3333	1	Integrate dietary advice with a personalised diabetes management plan, including other aspects of lifestyle modification, such as increasing physical activity and losing weight.	
diabetic peripheral neuropathy	0	1.3333	1	For guidance on managing painful diabetic peripheral neuropathy in adults with type 2 diabetes, see the NICE guideline on neuropathic pain in adults.	
digital retinal photography	0	1.3333	1	Use a quality-assured digital retinal photography programme using appropriately trained staff.	
erratic blood glucose	0	1.3333	1	Think about a diagnosis of gastroparesis in adults with type 2 diabetes with erratic blood glucose control or unexplained gastric bloating or vomiting, taking into account possible alternative diagnoses.	
excess energy intake	0	1.3333	1	Advise adults with type 2 diabetes that limited substitution of sucrose-containing foods for other carbohydrate in the meal plan is allowable, but that they should take care to avoid excess energy intake.	
eye screening programmes	0	1.3333	1	Perform visual acuity testing as a routine part of eye screening programmes.	
eye screening service	0	1.3333	1	On diagnosis, GPs should immediately refer adults with type 2 diabetes to the local eye screening service.	
eye screening systems	0	1.3333	1	Explain the reasons for, and success of, eye screening systems to adults with type 2 diabetes, so that attendance is not reduced by lack of knowledge or fear of outcome.	
foot	0	1.3333	1	For guidance on preventing and managing foot problems in adults with type 2 diabetes, see the NICE guideline on diabetic foot problems.	
function	0	1.3333	6	Be aware that there are other possible reasons for a low HbA1c level, for example, deteriorating renal function or sudden weight loss.	Be aware that there are other possible reasons for a low HbA1c level, for example, deteriorating renal function or sudden weight loss.	Offer men with type 2 diabetes the opportunity to discuss erectile dysfunction as part of their annual review.	Assess, educate and support men with type 2 diabetes who have problematic erectile dysfunction, addressing contributory factors such as cardiovascular disease as well as possible treatment options.	Consider a phosphodiesterase-5 inhibitor to treat problematic erectile dysfunction in men with type 2 diabetes, initially choosing the drug with the lowest acquisition cost and taking into account any contraindications.	Following discussion, refer men with type 2 diabetes to a service offering other medical, surgical or psychological management of erectile dysfunction if treatment (including a phosphodiesterase-5 inhibitor, as appropriate) has been unsuccessful.	
generic angiotensin-converting enzyme	0	1.3333	1	First-line antihypertensive drug treatment should be a once-daily, generic angiotensin-converting enzyme (ACE) inhibitor.	
generic calcium-channel blocker	0	1.3333	1	The first-line antihypertensive drug treatment for a person of African or Caribbean family origin should be an ACE inhibitor plus either a diuretic or a generic calcium-channel blocker.	
haemorrhage retinal detachment	0	1.3333	1	Arrange emergency review by an ophthalmologist for: sudden loss of vision rubeosis iridis pre-retinal or vitreous haemorrhage retinal detachment.	
healthy balanced eating	0	1.3333	1	Emphasise advice on healthy balanced eating that is applicable to the general population when providing advice to adults with type 2 diabetes.	
individual hba1c target	0	1.3333	1	Involve adults with type 2 diabetes in decisions about their individual HbA1c target.	
initial body weight	0	1.3333	1	For adults with type 2 diabetes who are overweight, set an initial body weight loss target of 5–10percent.	
integrate dietary advice	0	1.3333	1	Integrate dietary advice with a personalised diabetes management plan, including other aspects of lifestyle modification, such as increasing physical activity and losing weight.	
investigate unexplained discrepancies	0	1.3333	1	Investigate unexplained discrepancies between HbA1c and other glucose measurements.	
local eye screening	0	1.3333	1	On diagnosis, GPs should immediately refer adults with type 2 diabetes to the local eye screening service.	
low blood pressure	0	1.3333	1	Check for possible adverse effects of antihypertensive drug treatment – including the risks from unnecessarily low blood pressure.	
low-fat dairy products	0	1.3333	1	Encourage high-fibre, low-glycaemic-index sources of carbohydrate in the diet, such as fruit, vegetables, wholegrains and pulses; include low-fat dairy products and oily fish; and control the intake of foods containing saturated and trans fatty acids.	
meal planning system	0	1.3333	1	When adults with type 2 diabetes are admitted to hospital as inpatients or to any other care setting, implement a meal planning system that provides consistency in the carbohydrate content of meals and snacks.	
measure blood pressure	0	1.3333	1	Measure blood pressure at least annually in an adult with type 2 diabetes without previously diagnosed hypertension or renal disease.	
nervous system damage	0	1.3333	1	Think about the possibility of contributory sympathetic nervous system damage for adults with type 2 diabetes who lose the warning signs of hypoglycaemia.	
ongoing nutritional advice	0	1.3333	1	Provide individualised and ongoing nutritional advice from a healthcare professional with specific expertise and competencies in nutrition.	
perform visual acuity	0	1.3333	1	Perform visual acuity testing as a routine part of eye screening programmes.	
preventive lifestyle advice	0	1.3333	1	Offer and reinforce preventive lifestyle advice.	
retinal photography programme	0	1.3333	1	Use a quality-assured digital retinal photography programme using appropriately trained staff.	
structured eye screening	0	1.3333	2	Arrange repeat structured eye screening annually.	Depending on the findings, follow structured eye screening by: routine review in 1 year or earlier review or referral to an ophthalmologist.	
sympathetic nervous system	0	1.3333	1	Think about the possibility of contributory sympathetic nervous system damage for adults with type 2 diabetes who lose the warning signs of hypoglycaemia.	
unexplained bladder-emptying problems	0	1.3333	1	Investigate the possibility of autonomic neuropathy affecting the bladder in adults with type 2 diabetes who have unexplained bladder-emptying problems.	
vision rubeosis iridis	0	1.3333	1	Arrange emergency review by an ophthalmologist for: sudden loss of vision rubeosis iridis pre-retinal or vitreous haemorrhage retinal detachment.	
visual acuity testing	0	1.3333	1	Perform visual acuity testing as a routine part of eye screening programmes.	
vitreous haemorrhage retinal	0	1.3333	1	Arrange emergency review by an ophthalmologist for: sudden loss of vision rubeosis iridis pre-retinal or vitreous haemorrhage retinal detachment.	
weight loss target	0	1.3333	1	For adults with type 2 diabetes who are overweight, set an initial body weight loss target of 5–10percent.	
mmol	0	1.3275	3	For adults with type 2 diabetes managed either by lifestyle and diet, or by lifestyle and diet combined with a single drug not associated with hypoglycaemia, support the person to aim for an HbA1c level of 48 mmol mol(6.5percent).	For adults on a drug associated with hypoglycaemia, support the person to aim for an HbA1c level of 53 mmol mol (7.0percent).	In adults with type 2 diabetes, if HbA1c levels are not adequately controlled by a single drug and rise to 58 mmol mol (7.5percent) or higher: reinforce advice about diet, lifestyle and adherence to drug treatment and support the person to aim for an HbA1c level of 53 mmol mol (7.0percent) and intensify drug treatment.	
