self-monitoring	0	1.2128	2	Do not routinely offer self-monitoring of blood glucose levels for adults with type 2 diabetes unless: the person is on insulin or there is evidence of hypoglycaemic episodes or the person is on oral medication that may increase their risk of hypoglycaemia while driving or operating machinery or the person is pregnant, or is planning to become pregnant.	Consider short-term self-monitoring of blood glucose levels in adults with type 2 diabetes (and review treatment as necessary): when starting treatment with oral or intravenous corticosteroids or to confirm suspected hypoglycaemia.	
service	0	1.2128	4	For recommendations on lifestyle advice, see the NICE guidelines on: preventing excess weight gain, weight management, obesity, physical activity, smoking: brief interventions and referrals, stop smoking services, smoking: harm reduction, and smoking: acute, maternity and mental health services.	If gastroparesis is suspected, consider referral to specialist services if: the differential diagnosis is in doubt or persistent or severe vomiting occurs.	Following discussion, refer men with type 2 diabetes to a service offering other medical, surgical or psychological management of erectile dysfunction if treatment (including a phosphodiesterase-5 inhibitor, as appropriate) has been unsuccessful.	On diagnosis, GPs should immediately refer adults with type 2 diabetes to the local eye screening service.	
specialist	0	1.2128	2	Seek advice from a team with specialist expertise in diabetes or clinical biochemistry.	If gastroparesis is suspected, consider referral to specialist services if: the differential diagnosis is in doubt or persistent or severe vomiting occurs.	
system	0	1.2128	3	When adults with type 2 diabetes are admitted to hospital as inpatients or to any other care setting, implement a meal planning system that provides consistency in the carbohydrate content of meals and snacks.	Think about the possibility of contributory sympathetic nervous system damage for adults with type 2 diabetes who lose the warning signs of hypoglycaemia.	Explain the reasons for, and success of, eye screening systems to adults with type 2 diabetes, so that attendance is not reduced by lack of knowledge or fear of outcome.	
services	0	1.1977	2	For recommendations on lifestyle advice, see the NICE guidelines on: preventing excess weight gain, weight management, obesity, physical activity, smoking: brief interventions and referrals, stop smoking services, smoking: harm reduction, and smoking: acute, maternity and mental health services.	If gastroparesis is suspected, consider referral to specialist services if: the differential diagnosis is in doubt or persistent or severe vomiting occurs.	
target	0	1.1938	9	For adults with type 2 diabetes who are overweight, set an initial body weight loss target of 5–10percent.	If the person's blood pressure is not reduced to the individually agreed target with first-line therapy, add a calcium-channel blocker or a diuretic (usually a thiazide or thiazide-related diuretic).	Add the other drug (that is, the calcium-channel blocker or diuretic) if the target is not reached with dual therapy.	If the person's blood pressure is not reduced to the individually agreed target with triple therapy, add an alpha-blocker, a beta-blocker or a potassium-sparing diuretic (the last with caution if the person is already taking an ACE inhibitor or an angiotensin II-receptor antagonist).	Monitor the blood pressure of a person who has attained and consistently remained at his or her blood pressure target every 4–6 months.	Involve adults with type 2 diabetes in decisions about their individual HbA1c target.	Encourage them to achieve the target and maintain it unless any resulting adverse effects (including hypoglycaemia), or their efforts to achievetheir target, impair their quality of life.	If adults with type 2 diabetes achieve an HbA1c level that is lower than their target and they are not experiencing hypoglycaemia, encourage them to maintain it.	If adults with type 2 diabetes achieve an HbA1c level that is lower than their target and they are not experiencing hypoglycaemia, encourage them to maintain it.	
months	0	1.1819	3	Monitor blood pressure every 1–2 months, and intensify therapy if the person is already on antihypertensive drug treatment, until the blood pressure is consistently below 140 80 mmHg (below 130 80 mmHg if there is kidney, eye or cerebrovascular damage).	Monitor the blood pressure of a person who has attained and consistently remained at his or her blood pressure target every 4–6 months.	Perform screening as soon as possible and no later than 3 months from referral.	
account	1	1.175	5	Adopt an individualised approach to diabetes care that is tailored to the needs and circumstances of adults with type 2 diabetes, taking into account their personal preferences, comorbidities, risks from polypharmacy, and their ability to benefit from long-term interventions because of reduced life expectancy.	Take into account any disabilities, including visual impairment, when planning and delivering care for adults with type 2 diabetes.	Think about a diagnosis of gastroparesis in adults with type 2 diabetes with erratic blood glucose control or unexplained gastric bloating or vomiting, taking into account possible alternative diagnoses.	the strongest evidence for effectiveness is for domperidone11, but prescribers must take into account its safety profile, in particular its cardiac risk and potential interactions with other medicines.	Consider a phosphodiesterase-5 inhibitor to treat problematic erectile dysfunction in men with type 2 diabetes, initially choosing the drug with the lowest acquisition cost and taking into account any contraindications.	
neuropathy	0	1.175	5	For guidance on managing painful diabetic peripheral neuropathy in adults with type 2 diabetes, see the NICE guideline on neuropathic pain in adults.	Think about the possibility of autonomic neuropathy affecting the gut in adults with type 2 diabetes who have unexplained diarrhoea that happens particularly at night.	When using tricyclic drugs and antihypertensive drug treatments in adults with type 2 diabetes who have autonomic neuropathy, be aware of the increased likelihood of side effects such as orthostatic hypotension.	Investigate the possibility of autonomic neuropathy affecting the bladder in adults with type 2 diabetes who have unexplained bladder-emptying problems.	In managing autonomic neuropathy symptoms, include specific interventions indicated by the manifestations (for example, for abnormal sweating or nocturnal diarrhoea).	
angiotensin	1	1.1717	4	First-line antihypertensive drug treatment should be a once-daily, generic angiotensin-converting enzyme (ACE) inhibitor.	For a person with continuing intolerance to an ACE inhibitor (other than renal deterioration or hyperkalaemia), substitute an angiotensin II-receptor antagonist for the ACE inhibitor.	Do not combine an ACE inhibitor with an angiotensin II-receptor antagonist to treat hypertension.	If the person's blood pressure is not reduced to the individually agreed target with triple therapy, add an alpha-blocker, a beta-blocker or a potassium-sparing diuretic (the last with caution if the person is already taking an ACE inhibitor or an angiotensin II-receptor antagonist).	
antagonist	0	1.1717	3	For a person with continuing intolerance to an ACE inhibitor (other than renal deterioration or hyperkalaemia), substitute an angiotensin II-receptor antagonist for the ACE inhibitor.	Do not combine an ACE inhibitor with an angiotensin II-receptor antagonist to treat hypertension.	If the person's blood pressure is not reduced to the individually agreed target with triple therapy, add an alpha-blocker, a beta-blocker or a potassium-sparing diuretic (the last with caution if the person is already taking an ACE inhibitor or an angiotensin II-receptor antagonist).	
discussion	0	1.1717	4	A calcium-channel blocker should be the first-line antihypertensive drug treatment for a woman for whom, after an informed discussion, it is agreed there is a possibility of her becoming pregnant	Following discussion, refer men with type 2 diabetes to a service offering other medical, surgical or psychological management of erectile dysfunction if treatment (including a phosphodiesterase-5 inhibitor, as appropriate) has been unsuccessful.	Use mydriasis with tropicamide when photographing the retina, after prior informed agreement following discussion of the advantages and disadvantages.	Discussions should include precautions for driving.	
ii-receptor	0	1.1717	3	For a person with continuing intolerance to an ACE inhibitor (other than renal deterioration or hyperkalaemia), substitute an angiotensin II-receptor antagonist for the ACE inhibitor.	Do not combine an ACE inhibitor with an angiotensin II-receptor antagonist to treat hypertension.	If the person's blood pressure is not reduced to the individually agreed target with triple therapy, add an alpha-blocker, a beta-blocker or a potassium-sparing diuretic (the last with caution if the person is already taking an ACE inhibitor or an angiotensin II-receptor antagonist).	
education	0	1.1667	7	Offer structured education to adults with type 2 diabetes and or their family members or carers (as appropriate) at and around the time of diagnosis, with annual reinforcement and review.	Explain to people and their carers that structured education is an integral part of diabetes care.	Ensure that any structured education programme for adults with type 2 diabetes includes the following components: It is evidence-based, and suits the needs of the person. It has specific aims and learning objectives, and supports the person and their family members and carers in developing attitudes, beliefs, knowledge and skills to self-manage diabetes. It has a structured curriculum that is theory-driven, evidence-based and resource-effective, has supporting materials, and is written down. It is delivered by trained educators who have an understanding of educational theory appropriate to the age and needs of the person, and who are trained and competent to deliver the principles and content of the programme. It is quality assured, and reviewed by trained, competent, independent assessors who measure it against criteria that ensure consistency. The outcomes are audited regularly.	Ensure the patient-education programme provides the necessary resources to support the educators, and that educators are properly trained and given time to develop and maintain their skills.	Offer group education programmes as the preferred option. Provide an alternative of equal standard for a person unable or unwilling to participate in group education.	Ensure that the patient-education programmes available meet the cultural, linguistic, cognitive and literacy needs within the local area.	Ensure that all members of the diabetes healthcare team are familiar with the patient-education programmes available locally, that these programmes are integrated with the rest of the care pathway, and that adults with type 2 diabetes and their family members or carers (as appropriate) have the opportunity to contribute to the design and provision of local programmes.	
review	1	1.1661	9	Reassess the person's needs and circumstances at each review and think about whether to stop any medicines that are not effective.	Offer structured education to adults with type 2 diabetes and or their family members or carers (as appropriate) at and around the time of diagnosis, with annual reinforcement and review.	Ensure that any structured education programme for adults with type 2 diabetes includes the following components: It is evidence-based, and suits the needs of the person. It has specific aims and learning objectives, and supports the person and their family members and carers in developing attitudes, beliefs, knowledge and skills to self-manage diabetes. It has a structured curriculum that is theory-driven, evidence-based and resource-effective, has supporting materials, and is written down. It is delivered by trained educators who have an understanding of educational theory appropriate to the age and needs of the person, and who are trained and competent to deliver the principles and content of the programme. It is quality assured, and reviewed by trained, competent, independent assessors who measure it against criteria that ensure consistency. The outcomes are audited regularly.	For an adult with type 2 diabetes on antihypertensive drug treatment when diabetes is diagnosed, review blood pressure control and medications used.	Consider short-term self-monitoring of blood glucose levels in adults with type 2 diabetes (and review treatment as necessary): when starting treatment with oral or intravenous corticosteroids or to confirm suspected hypoglycaemia.	Offer men with type 2 diabetes the opportunity to discuss erectile dysfunction as part of their annual review.	Depending on the findings, follow structured eye screening by: routine review in 1 year or earlier review or referral to an ophthalmologist.	Arrange emergency review by an ophthalmologist for: sudden loss of vision rubeosis iridis pre-retinal or vitreous haemorrhage retinal detachment.	Arrange rapid review by an ophthalmologist for new vessel formation.	
blocker	0	1.1625	5	The first-line antihypertensive drug treatment for a person of African or Caribbean family origin should be an ACE inhibitor plus either a diuretic or a generic calcium-channel blocker.	A calcium-channel blocker should be the first-line antihypertensive drug treatment for a woman for whom, after an informed discussion, it is agreed there is a possibility of her becoming pregnant	If the person's blood pressure is not reduced to the individually agreed target with first-line therapy, add a calcium-channel blocker or a diuretic (usually a thiazide or thiazide-related diuretic).	Add the other drug (that is, the calcium-channel blocker or diuretic) if the target is not reached with dual therapy.	If the person's blood pressure is not reduced to the individually agreed target with triple therapy, add an alpha-blocker, a beta-blocker or a potassium-sparing diuretic (the last with caution if the person is already taking an ACE inhibitor or an angiotensin II-receptor antagonist).	
calcium-channel	0	1.1625	4	The first-line antihypertensive drug treatment for a person of African or Caribbean family origin should be an ACE inhibitor plus either a diuretic or a generic calcium-channel blocker.	A calcium-channel blocker should be the first-line antihypertensive drug treatment for a woman for whom, after an informed discussion, it is agreed there is a possibility of her becoming pregnant	If the person's blood pressure is not reduced to the individually agreed target with first-line therapy, add a calcium-channel blocker or a diuretic (usually a thiazide or thiazide-related diuretic).	Add the other drug (that is, the calcium-channel blocker or diuretic) if the target is not reached with dual therapy.	
first-line	0	1.1625	4	First-line antihypertensive drug treatment should be a once-daily, generic angiotensin-converting enzyme (ACE) inhibitor.	The first-line antihypertensive drug treatment for a person of African or Caribbean family origin should be an ACE inhibitor plus either a diuretic or a generic calcium-channel blocker.	A calcium-channel blocker should be the first-line antihypertensive drug treatment for a woman for whom, after an informed discussion, it is agreed there is a possibility of her becoming pregnant	If the person's blood pressure is not reduced to the individually agreed target with first-line therapy, add a calcium-channel blocker or a diuretic (usually a thiazide or thiazide-related diuretic).	
weight	0	1.1558	6	Integrate dietary advice with a personalised diabetes management plan, including other aspects of lifestyle modification, such as increasing physical activity and losing weight.	For adults with type 2 diabetes who are overweight, set an initial body weight loss target of 5–10percent.	Remember that lesser degrees of weight loss may still be of benefit, and that larger degrees of weight loss in the longer term will have advantageous metabolic impact.	For recommendations on lifestyle advice, see the NICE guidelines on: preventing excess weight gain, weight management, obesity, physical activity, smoking: brief interventions and referrals, stop smoking services, smoking: harm reduction, and smoking: acute, maternity and mental health services.	Be aware that there are other possible reasons for a low HbA1c level, for example, deteriorating renal function or sudden weight loss.	Be aware that there are other possible reasons for a low HbA1c level, for example, deteriorating renal function or sudden weight loss.	
risk	0	1.1523	5	Adopt an individualised approach to diabetes care that is tailored to the needs and circumstances of adults with type 2 diabetes, taking into account their personal preferences, comorbidities, risks from polypharmacy, and their ability to benefit from long-term interventions because of reduced life expectancy.	Reducing the risk of hypoglycaemia should be a particular aim for a person using insulin or an insulin secretagogue.	Check for possible adverse effects of antihypertensive drug treatment – including the risks from unnecessarily low blood pressure.	Do not routinely offer self-monitoring of blood glucose levels for adults with type 2 diabetes unless: the person is on insulin or there is evidence of hypoglycaemic episodes or the person is on oral medication that may increase their risk of hypoglycaemia while driving or operating machinery or the person is pregnant, or is planning to become pregnant.	the strongest evidence for effectiveness is for domperidone11, but prescribers must take into account its safety profile, in particular its cardiac risk and potential interactions with other medicines.	
inhibitor	1	1.1424	7	First-line antihypertensive drug treatment should be a once-daily, generic angiotensin-converting enzyme (ACE) inhibitor.	The first-line antihypertensive drug treatment for a person of African or Caribbean family origin should be an ACE inhibitor plus either a diuretic or a generic calcium-channel blocker.	For a person with continuing intolerance to an ACE inhibitor (other than renal deterioration or hyperkalaemia), substitute an angiotensin II-receptor antagonist for the ACE inhibitor.	Do not combine an ACE inhibitor with an angiotensin II-receptor antagonist to treat hypertension.	If the person's blood pressure is not reduced to the individually agreed target with triple therapy, add an alpha-blocker, a beta-blocker or a potassium-sparing diuretic (the last with caution if the person is already taking an ACE inhibitor or an angiotensin II-receptor antagonist).	Consider a phosphodiesterase-5 inhibitor to treat problematic erectile dysfunction in men with type 2 diabetes, initially choosing the drug with the lowest acquisition cost and taking into account any contraindications.	Following discussion, refer men with type 2 diabetes to a service offering other medical, surgical or psychological management of erectile dysfunction if treatment (including a phosphodiesterase-5 inhibitor, as appropriate) has been unsuccessful.	
quality	1	1.1343	4	Ensure that any structured education programme for adults with type 2 diabetes includes the following components: It is evidence-based, and suits the needs of the person. It has specific aims and learning objectives, and supports the person and their family members and carers in developing attitudes, beliefs, knowledge and skills to self-manage diabetes. It has a structured curriculum that is theory-driven, evidence-based and resource-effective, has supporting materials, and is written down. It is delivered by trained educators who have an understanding of educational theory appropriate to the age and needs of the person, and who are trained and competent to deliver the principles and content of the programme. It is quality assured, and reviewed by trained, competent, independent assessors who measure it against criteria that ensure consistency. The outcomes are audited regularly.	Provide dietary advice in a form sensitive to the person's needs, culture and beliefs, being sensitive to their willingness to change and the effects on their quality of life.	Encourage them to achieve the target and maintain it unless any resulting adverse effects (including hypoglycaemia), or their efforts to achievetheir target, impair their quality of life.	Use a quality-assured digital retinal photography programme using appropriately trained staff.	
possibility	0	1.1303	5	Exceptions to this are people of African or Caribbean family origin, or women for whom there is a possibility of becoming pregnant.	A calcium-channel blocker should be the first-line antihypertensive drug treatment for a woman for whom, after an informed discussion, it is agreed there is a possibility of her becoming pregnant	Think about the possibility of contributory sympathetic nervous system damage for adults with type 2 diabetes who lose the warning signs of hypoglycaemia.	Think about the possibility of autonomic neuropathy affecting the gut in adults with type 2 diabetes who have unexplained diarrhoea that happens particularly at night.	Investigate the possibility of autonomic neuropathy affecting the bladder in adults with type 2 diabetes who have unexplained bladder-emptying problems.	
levels	0	1.1175	3	In adults with type 2 diabetes, if HbA1c levels are not adequately controlled by a single drug and rise to 58 mmol mol (7.5percent) or higher: reinforce advice about diet, lifestyle and adherence to drug treatment and support the person to aim for an HbA1c level of 53 mmol mol (7.0percent) and intensify drug treatment.	Do not routinely offer self-monitoring of blood glucose levels for adults with type 2 diabetes unless: the person is on insulin or there is evidence of hypoglycaemic episodes or the person is on oral medication that may increase their risk of hypoglycaemia while driving or operating machinery or the person is pregnant, or is planning to become pregnant.	Consider short-term self-monitoring of blood glucose levels in adults with type 2 diabetes (and review treatment as necessary): when starting treatment with oral or intravenous corticosteroids or to confirm suspected hypoglycaemia.	
offer	0	1.1121	7	Offer structured education to adults with type 2 diabetes and or their family members or carers (as appropriate) at and around the time of diagnosis, with annual reinforcement and review.	Offer group education programmes as the preferred option. Provide an alternative of equal standard for a person unable or unwilling to participate in group education.	Offer and reinforce preventive lifestyle advice.	Do not offer antiplatelet therapy (aspirin or clopidogrel) for adults with type 2 diabetes without cardiovascular disease.	Do not routinely offer self-monitoring of blood glucose levels for adults with type 2 diabetes unless: the person is on insulin or there is evidence of hypoglycaemic episodes or the person is on oral medication that may increase their risk of hypoglycaemia while driving or operating machinery or the person is pregnant, or is planning to become pregnant.	Offer men with type 2 diabetes the opportunity to discuss erectile dysfunction as part of their annual review.	Following discussion, refer men with type 2 diabetes to a service offering other medical, surgical or psychological management of erectile dysfunction if treatment (including a phosphodiesterase-5 inhibitor, as appropriate) has been unsuccessful.	
needs	1	1.1073	5	Adopt an individualised approach to diabetes care that is tailored to the needs and circumstances of adults with type 2 diabetes, taking into account their personal preferences, comorbidities, risks from polypharmacy, and their ability to benefit from long-term interventions because of reduced life expectancy.	Reassess the person's needs and circumstances at each review and think about whether to stop any medicines that are not effective.	Ensure that any structured education programme for adults with type 2 diabetes includes the following components: It is evidence-based, and suits the needs of the person. It has specific aims and learning objectives, and supports the person and their family members and carers in developing attitudes, beliefs, knowledge and skills to self-manage diabetes. It has a structured curriculum that is theory-driven, evidence-based and resource-effective, has supporting materials, and is written down. It is delivered by trained educators who have an understanding of educational theory appropriate to the age and needs of the person, and who are trained and competent to deliver the principles and content of the programme. It is quality assured, and reviewed by trained, competent, independent assessors who measure it against criteria that ensure consistency. The outcomes are audited regularly.	Ensure that the patient-education programmes available meet the cultural, linguistic, cognitive and literacy needs within the local area.	Provide dietary advice in a form sensitive to the person's needs, culture and beliefs, being sensitive to their willingness to change and the effects on their quality of life.	
