healthcare	1	0.9467	18	DVLA guidance (At a glance guide to the current medical standards of fitness to drive) management of hypoglycaemia management of acute changes in plasma glucose control support from an appropriately trained and experienced healthcare professional.	Last updated May 2017 who need help from a carer or healthcare professional to administer insulin injections and for whom switching to one of the long-acting insulin analogues would reduce the number of daily injections.	Medicines and Healthcare products Regulatory Agency (MHRA) guidance (2017) warned that canagliflozin may increase the risk of lower-limb amputation (mainly toes) in people with type 2 diabetes	Medicines and Healthcare products Regulatory Agency (MHRA) guidance (2011) notes that cases of cardiac failure have been reported when pioglitazone was used in combination with insulin, especially in patients with risk factors for the development of cardiac failure	Medicines and Healthcare products Regulatory Agency (MHRA) guidance (2014) notes that domperidone is associated with a small increased risk of serious cardiac side effects	DVLA guidance (At a glance guide to the current medical standards of fitness to drive) management of hypoglycaemia management of acute changes in plasma glucose control support from an appropriately trained and experienced healthcare professional.	Last updated May 2017 who need help from a carer or healthcare professional to administer insulin injections and for whom switching to one of the long-acting insulin analogues would reduce the number of daily injections.	Medicines and Healthcare products Regulatory Agency (MHRA) guidance (2017) warned that canagliflozin may increase the risk of lower-limb amputation (mainly toes) in people with type 2 diabetes	Medicines and Healthcare products Regulatory Agency (MHRA) guidance (2011) notes that cases of cardiac failure have been reported when pioglitazone was used in combination with insulin, especially in patients with risk factors for the development of cardiac failure	Medicines and Healthcare products Regulatory Agency (MHRA) guidance (2014) notes that domperidone is associated with a small increased risk of serious cardiac side effects	Medicines and Healthcare products Regulatory Agency (MHRA) guidance (2011) advises that 'prescribers should review the safety and efficacy of pioglitazone in individuals after 3–6 months of treatment to ensure that only patients who are deriving benefit continue to be treated'.	Ensure that all members of the diabetes healthcare team are familiar with the patient-education programmes available locally, that these programmes are integrated with the rest of the care pathway, and that adults with type 2 diabetes and their family members or carers (as appropriate) have the opportunity to contribute to the design and provision of local programmes.	Provide individualised and ongoing nutritional advice from a healthcare professional with specific expertise and competencies in nutrition.	Last updated May 2017 safety (see Medicines and Healthcare products Regulatory Agency MHRA guidance) and tolerability of the drug treatment(s) the person's individual clinical circumstances, for example, comorbidities, risks from polypharmacy the person's individual preferences and needs the licensed indications or combinations available cost (if 2 drugs in the same class are appropriate, choose the option with the lowest acquisition cost).	Consider, as an alternative to NPH insulin, using insulin detemir or insulin glargine if: the person needs assistance from a carer or healthcare professional to inject insulin, and use of insulin detemir or insulin glargine would reduce the frequency of injections from twice to once daily or the person's lifestyle is restricted by recurrent symptomatic hypoglycaemic episodes or the person would otherwise need twice-daily NPH insulin injections in combination with oral glucose-lowering drugs.	Medicines and Healthcare products Regulatory Agency (MHRA) guidance (2011) advises that 'prescribers should review the safety and efficacy of pioglitazone in individuals after 3–6 months of treatment to ensure that only patients who are deriving benefit continue to be treated'.	Medicines and Healthcare products Regulatory Agency (MHRA) guidance (2016) warned that serious, life-threatening, and fatal cases of diabetic ketoacidosis have been reported rarely in people taking an SGLT-2 inhibitor (a substantial proportion of the cases concerned off-label use in people with type 1 diabetes, which is not recommended)	The MHRA advised that healthcare professionals should test for raised ketones in people with ketoacidosis symptoms who are receiving an SGLT-2 inhibitor, even if their plasma glucose levels are near-normal.	
target	0	0.9451	20	If the person's blood pressure is not reduced to the individually agreed target with first-line therapy, add a calcium-channel blocker or a diuretic (usually a thiazide or thiazide-related diuretic)	Add the other drug (that is, the calcium-channel blocker or diuretic) if the target is not reached with dual therapy 2009, amended 2015	If the person's blood pressure is not reduced to the individually agreed target with triple therapy, add an alpha-blocker, a beta-blocker or a potassium-sparing diuretic (the last with caution if the person is already taking an ACE inhibitor or an angiotensin II-receptor antagonist).	Monitor the blood pressure of a person who has attained and consistently remained at his or her blood pressure target every 4–6 months	Targets	If the person's blood pressure is not reduced to the individually agreed target with first-line therapy, add a calcium-channel blocker or a diuretic (usually a thiazide or thiazide-related diuretic)	Add the other drug (that is, the calcium-channel blocker or diuretic) if the target is not reached with dual therapy 2009, amended 2015	If the person's blood pressure is not reduced to the individually agreed target with triple therapy, add an alpha-blocker, a beta-blocker or a potassium-sparing diuretic (the last with caution if the person is already taking an ACE inhibitor or an angiotensin II-receptor antagonist).	Monitor the blood pressure of a person who has attained and consistently remained at his or her blood pressure target every 4–6 months	Targets	For adults with type 2 diabetes who are overweight, set an initial body weight loss target of 5–10percent	HbA1c measurement and targets	Involve adults with type 2 diabetes in decisions about their individual HbA1c target	Encourage them to achieve the target and maintain it unless any resulting adverse effects (including hypoglycaemia), or their efforts to achieve their target, impair their quality of life.	Offer lifestyle advice and drug treatment to support adults with type 2 diabetes to achieve and maintain their HbA1c target (see section )	Consider relaxing the target HbA1c level (see recommendations and )	If adults with type 2 diabetes achieve an HbA1c level that is lower than their target and they are not experiencing hypoglycaemia, encourage them to maintain it	For guidance on HbA1c targets for women with type 2 diabetes who are pregnant or planning to become pregnant, see the NICE guideline on diabetes in pregnancy.	When starting insulin therapy in adults with type 2 diabetes, use a structured programme employing active insulin dose titration that encompasses: injection technique, including rotating injection sites and avoiding repeated injections at the same point within sites continuing telephone support self-monitoring dose titration to target levels dietary understanding	Consider switching to insulin detemir or insulin glargine from NPH insulin in adults with type 2 diabetes: who do not reach their target HbA1c because of significant hypoglycaemia or who experience significant hypoglycaemia on NPH insulin irrespective of the level of	
gain	0	0.9441	3	It is quality assured, and reviewed by trained, competent, independent assessors who measure it against criteria that ensure consistency.	For recommendations on lifestyle advice, see the NICE guidelines on: preventing excess weight gain, weight management, obesity, physical activity, smoking: brief interventions and referrals, stop smoking services, smoking: harm reduction, and smoking: acute, maternity and mental health services.	It advises that if the combination is used, people should be observed for signs and symptoms of heart failure, weight gain, and oedema	
control	1	0.9403	18	If HbA1c monitoring is invalid because of disturbed erythrocyte turnover or abnormal haemoglobin type, estimate trends in blood glucose control using one	Last updated May 2017 of the following: quality-controlled plasma glucose profiles total glycated haemoglobin estimation (if abnormal haemoglobins) fructosamine estimation.	DVLA guidance (At a glance guide to the current medical standards of fitness to drive) management of hypoglycaemia management of acute changes in plasma glucose control support from an appropriately trained and experienced healthcare professional.	If HbA1c monitoring is invalid because of disturbed erythrocyte turnover or abnormal haemoglobin type, estimate trends in blood glucose control using one	Last updated May 2017 of the following: quality-controlled plasma glucose profiles total glycated haemoglobin estimation (if abnormal haemoglobins) fructosamine estimation.	DVLA guidance (At a glance guide to the current medical standards of fitness to drive) management of hypoglycaemia management of acute changes in plasma glucose control support from an appropriately trained and experienced healthcare professional.	Encourage high-fibre, low-glycaemic-index sources of carbohydrate in the diet, such as fruit, vegetables, wholegrains and pulses; include low-fat dairy products and oily fish; and control the intake of foods containing saturated and trans fatty acids.	For an adult with type 2 diabetes on antihypertensive drug treatment when diabetes is diagnosed, review blood pressure control and medications used.	Make changes only if there is poor control or if current drug treatment is not appropriate because of microvascular complications or metabolic problems.	In adults with type 2 diabetes, if HbA1c levels are not adequately controlled by a single drug and rise to 58 mmol mol ( percent) or higher: reinforce advice about diet, lifestyle and adherence to drug treatment and support the person to aim for an HbA1c level of 53 mmol mol ( percent) and intensify drug treatment.	Last updated May 2017 on a case-by-case basis, with particular consideration for people who are older or frail, for adults with type 2 diabetes: who are unlikely to achieve longer-term risk-reduction benefits, for example, people with a reduced life expectancy for whom tight blood glucose control poses a high risk of the consequences of hypoglycaemia, for example, people who are at risk of falling, people who have impaired awareness of hypoglycaemia, and people who drive or operate machinery as part of their job for whom intensive management would not be appropriate, for example, people with significant comorbidities.	If an adult with type 2 diabetes is symptomatically hyperglycaemic, consider insulin (see recommendations – ) or a sulfonylurea, and review treatment when blood glucose control has been achieved.	In adults with type 2 diabetes, if initial drug treatment with metformin has not continued to control HbA1c to below the person's individually agreed threshold for intensification, consider dual therapy with: metformin and a DPP-4 inhibitor or metformin and pioglitazone or metformin and a sulfonylurea.	In adults with type 2 diabetes, if metformin is contraindicated or not tolerated and initial drug treatment has not continued to control HbA1c to below the person's individually agreed threshold for intensification, consider dual therapy with: a DPP-4 inhibitor and pioglitazone or a DPP-4 inhibitor and a sulfonylurea or pioglitazone and a sulfonylurea.	In adults with type 2 diabetes, if dual therapy with metformin and another oral drug (see recommendation ) has not continued to control HbA1c to below the person's individually agreed threshold for intensification, consider either: triple therapy with: metformin, a DPP-4 inhibitor and a sulfonylurea or metformin, pioglitazone and a sulfonylurea or starting insulin-based treatment (see recommendations – ).	In adults with type 2 diabetes, if metformin is contraindicated or not tolerated, and if dual therapy with 2 oral drugs (see recommendation ) has not continued to control HbA1c to below the person's individually agreed threshold for intensification, consider insulin-based treatment (see recommendations – ).	Monitor adults with type 2 diabetes who are on pre-mixed (biphasic) insulin for the need for a further injection of short-acting insulin before meals or for a change to a basal bolus regimen with NPH insulin or insulin detemir or insulin glargine , if blood glucose control remains inadequate.	Think about a diagnosis of gastroparesis in adults with type 2 diabetes with erratic blood glucose control or unexplained gastric bloating or vomiting, taking into account possible alternative diagnoses 2009, amended 2015	
information	0	0.9372	5	For more information about supporting adherence, see the NICE guideline on medicines adherence.	See the General Medical Council's Prescribing guidance: prescribing unlicensed medicines for further information.	For more information about supporting adherence, see the NICE guideline on medicines adherence.	See the General Medical Council's Prescribing guidance: prescribing unlicensed medicines for further information.	For more information, see the NICE guideline on diabetes in pregnancy.	
medication	1	0.9372	4	Add medications if lifestyle advice does not reduce blood pressure to below 140 80 mmHg (below 130 80 mmHg if there is kidney, eye or cerebrovascular damage).	Add medications if lifestyle advice does not reduce blood pressure to below 140 80 mmHg (below 130 80 mmHg if there is kidney, eye or cerebrovascular damage).	For an adult with type 2 diabetes on antihypertensive drug treatment when diabetes is diagnosed, review blood pressure control and medications used.	Do not routinely offer self-monitoring of blood glucose levels for adults with type 2 diabetes unless: the person is on insulin or there is evidence of hypoglycaemic episodes or the person is on oral medication that may increase their risk of hypoglycaemia while driving or operating machinery or	
damage	0	0.933	7	Last updated May 2017 pressure is confirmed as being consistently above 140 80 mmHg (or above 130 80 mmHg if there is kidney, eye or cerebrovascular damage).	Add medications if lifestyle advice does not reduce blood pressure to below 140 80 mmHg (below 130 80 mmHg if there is kidney, eye or cerebrovascular damage).	Last updated May 2017 pressure is confirmed as being consistently above 140 80 mmHg (or above 130 80 mmHg if there is kidney, eye or cerebrovascular damage).	Add medications if lifestyle advice does not reduce blood pressure to below 140 80 mmHg (below 130 80 mmHg if there is kidney, eye or cerebrovascular damage).	Repeat blood pressure measurements within: 1 month if blood pressure is higher than 150 90 mmHg 2 months if blood pressure is higher than 140 80 mmHg 2 months if blood pressure is higher than 130 80 mmHg and there is kidney, eye or cerebrovascular damage.	Monitor blood pressure every 1–2 months, and intensify therapy if the person is already on antihypertensive drug treatment, until the blood pressure is consistently below 140 80 mmHg (below 130 80 mmHg if there is kidney, eye or cerebrovascular damage).	Think about the possibility of contributory sympathetic nervous system damage for adults with type 2 diabetes who lose the warning signs of hypoglycaemia. 2009, amended 2015	
class	0	0.9259	4	At the time of publication (March 2017) evidence did not show an increased risk for dapagliflozin and empagliflozin, but the MHRA advised that the risk may be a class effect.	At the time of publication (March 2017) evidence did not show an increased risk for dapagliflozin and empagliflozin, but the MHRA advised that the risk may be a class effect.	Recommendations in this section that cover dipeptidyl peptidase-4 (DPP-4) inhibitors, glucagon-like peptide-1 (GLP-1) mimetics and sulfonylureas refer to each of these groups of drugs at a class level.	Last updated May 2017 safety (see Medicines and Healthcare products Regulatory Agency MHRA guidance) and tolerability of the drug treatment(s) the person's individual clinical circumstances, for example, comorbidities, risks from polypharmacy the person's individual preferences and needs the licensed indications or combinations available cost (if 2 drugs in the same class are appropriate, choose the option with the lowest acquisition cost).	
options	0	0.9259	2	For adults with type 2 diabetes, discuss the benefits and risks of drug treatment, and the options available	Assess, educate and support men with type 2 diabetes who have problematic erectile dysfunction, addressing contributory factors such as cardiovascular disease as well as possible treatment options.	
tolerability	0	0.9259	2	Last updated May 2017 safety (see Medicines and Healthcare products Regulatory Agency MHRA guidance) and tolerability of the drug treatment(s) the person's individual clinical circumstances, for example, comorbidities, risks from polypharmacy the person's individual preferences and needs the licensed indications or combinations available cost (if 2 drugs in the same class are appropriate, choose the option with the lowest acquisition cost).	Be aware that the drugs in dual therapy should be introduced in a stepwise manner, checking for tolerability and effectiveness of each drug.	
offer	0	0.9229	19	Offer group education programmes as the preferred option	Offer NPH insulin injected once or twice daily according to need.	Offer group education programmes as the preferred option	Offer NPH insulin injected once or twice daily according to need.	However, discuss with any person for whom repaglinide is being considered, that there is no licensed non-metformin-based combination containing repaglinide that can be offered at first intensification.	The wording used in the recommendations in this guideline (for example, words such as 'offer' and 'consider') denotes the certainty with which the recommendation is made (the strength of the recommendation)	Offer structured education to adults with type 2 diabetes and or their family members or carers (as appropriate) at and around the time of diagnosis, with	Offer and reinforce preventive lifestyle advice.	Do not offer antiplatelet therapy (aspirin or clopidogrel) for adults with type 2 diabetes without cardiovascular disease.	Offer lifestyle advice and drug treatment to support adults with type 2 diabetes to achieve and maintain their HbA1c target (see section )	Take the Driver and Vehicle Licensing Agency (DVLA) At a glance guide to the current medical standards of fitness to drive into account when offering self-monitoring of blood glucose levels for adults with type 2 diabetes.	Do not routinely offer self-monitoring of blood glucose levels for adults with type 2 diabetes unless: the person is on insulin or there is evidence of hypoglycaemic episodes or the person is on oral medication that may increase their risk of hypoglycaemia while driving or operating machinery or	Offer standard-release metformin as the initial drug treatment for adults with type 2 diabetes.	In adults with type 2 diabetes, do not offer or continue pioglitazone if they have any of the following: heart failure or history of heart failure	In adults with type 2 diabetes, only offer a GLP-1 mimetic in combination with insulin with specialist care advice and ongoing support from a consultant-led multidisciplinary team .	When starting insulin therapy in adults with type 2 diabetes, continue to offer metformin for people without contraindications or intolerance	Offer men with type 2 diabetes the opportunity to discuss erectile dysfunction as part of their annual review.	Following discussion, refer men with type 2 diabetes to a service offering other medical, surgical or psychological management of erectile dysfunction if treatment (including a phosphodiesterase-5 inhibitor, as appropriate) has been unsuccessful.	However, discuss with any person for whom repaglinide is being considered, that there is no licensed non-metformin-based combination containing repaglinide that can be offered at first intensification.	
part	1	0.92	16	When prescribing pioglitazone, exercise particular caution if the person is at high risk of the adverse effects of the drug	Last updated May 2017 take into account its safety profile, in particular its cardiac risk and potential interactions with other medicines.	Perform visual acuity testing as a routine part of eye screening programmes.	When prescribing pioglitazone, exercise particular caution if the person is at high risk of the adverse effects of the drug	When prescribing pioglitazone, exercise particular caution if the person is at high risk of the adverse effects of the drug	Last updated May 2017 take into account its safety profile, in particular its cardiac risk and potential interactions with other medicines.	Perform visual acuity testing as a routine part of eye screening programmes.	When prescribing pioglitazone, exercise particular caution if the person is at high risk of the adverse effects of the drug	Explain to people and their carers that structured education is an integral part of diabetes care.	Provide an alternative of equal standard for a person unable or unwilling to participate in group education.	Reducing the risk of hypoglycaemia should be a particular aim for a person using insulin or an insulin secretagogue.	Last updated May 2017 on a case-by-case basis, with particular consideration for people who are older or frail, for adults with type 2 diabetes: who are unlikely to achieve longer-term risk-reduction benefits, for example, people with a reduced life expectancy for whom tight blood glucose control poses a high risk of the consequences of hypoglycaemia, for example, people who are at risk of falling, people who have impaired awareness of hypoglycaemia, and people who drive or operate machinery as part of their job for whom intensive management would not be appropriate, for example, people with significant comorbidities.	Consider starting both NPH and short-acting insulin (particularly if the person's	Think about the possibility of autonomic neuropathy affecting the gut in adults with type 2 diabetes who have unexplained diarrhoea that happens particularly at night 2009, amended 2015	Offer men with type 2 diabetes the opportunity to discuss erectile dysfunction as part of their annual review.	The MHRA advises that prescribers should take into account the overall safety profile of domperidone, and in particular its cardiac risk and potential interactions with other medicines (such as erythromycin), if there is a clinical need to use it at doses or durations greater than those authorised	
