mhra	0	1.0	1	For treating vomiting caused by gastroparesis in adults with type 2 diabetes: consider alternating use of erythomycin12 and metoclopramide13 consider domperidone11 only in exceptional circumstances (if domperidone is the only effective treatment) and in accordance with MHRA guidance.	
modification	0	1.0	1	Integrate dietary advice with a personalised diabetes management plan, including other aspects of lifestyle modification, such as increasing physical activity and losing weight.	
multimorbidity	0	1.0	1	Such an approach is especially important in the context of multimorbidity.	
mydriasis	0	1.0	1	Use mydriasis with tropicamide when photographing the retina, after prior informed agreement following discussion of the advantages and disadvantages.	
night	0	1.0	1	Think about the possibility of autonomic neuropathy affecting the gut in adults with type 2 diabetes who have unexplained diarrhoea that happens particularly at night.	
nutrition	0	1.0	1	Provide individualised and ongoing nutritional advice from a healthcare professional with specific expertise and competencies in nutrition.	
once-daily	0	1.0	1	First-line antihypertensive drug treatment should be a once-daily, generic angiotensin-converting enzyme (ACE) inhibitor.	
options	0	1.0	1	Assess, educate and support men with type 2 diabetes who have problematic erectile dysfunction, addressing contributory factors such as cardiovascular disease as well as possible treatment options.	
outcome	0	1.0	2	Ensure that any structured education programme for adults with type 2 diabetes includes the following components: It is evidence-based, and suits the needs of the person. It has specific aims and learning objectives, and supports the person and their family members and carers in developing attitudes, beliefs, knowledge and skills to self-manage diabetes. It has a structured curriculum that is theory-driven, evidence-based and resource-effective, has supporting materials, and is written down. It is delivered by trained educators who have an understanding of educational theory appropriate to the age and needs of the person, and who are trained and competent to deliver the principles and content of the programme. It is quality assured, and reviewed by trained, competent, independent assessors who measure it against criteria that ensure consistency. The outcomes are audited regularly.	Explain the reasons for, and success of, eye screening systems to adults with type 2 diabetes, so that attendance is not reduced by lack of knowledge or fear of outcome.	
pain	0	1.0	1	For guidance on managing painful diabetic peripheral neuropathy in adults with type 2 diabetes, see the NICE guideline on neuropathic pain in adults.	
patterns	0	1.0	1	Individualise recommendations for carbohydrate and alcohol intake, and meal patterns.	
photography	0	1.0	1	Use a quality-assured digital retinal photography programme using appropriately trained staff.	
planning	0	1.0	3	Take into account any disabilities, including visual impairment, when planning and delivering care for adults with type 2 diabetes.	When adults with type 2 diabetes are admitted to hospital as inpatients or to any other care setting, implement a meal planning system that provides consistency in the carbohydrate content of meals and snacks.	Do not routinely offer self-monitoring of blood glucose levels for adults with type 2 diabetes unless: the person is on insulin or there is evidence of hypoglycaemic episodes or the person is on oral medication that may increase their risk of hypoglycaemia while driving or operating machinery or the person is pregnant, or is planning to become pregnant.	
polypharmacy	0	1.0	1	Adopt an individualised approach to diabetes care that is tailored to the needs and circumstances of adults with type 2 diabetes, taking into account their personal preferences, comorbidities, risks from polypharmacy, and their ability to benefit from long-term interventions because of reduced life expectancy.	
population	0	1.0	1	Emphasise advice on healthy balanced eating that is applicable to the general population when providing advice to adults with type 2 diabetes.	
potassium-sparing	0	1.0	1	If the person's blood pressure is not reduced to the individually agreed target with triple therapy, add an alpha-blocker, a beta-blocker or a potassium-sparing diuretic (the last with caution if the person is already taking an ACE inhibitor or an angiotensin II-receptor antagonist).	
precautions	0	1.0	1	Discussions should include precautions for driving.	
preferences	1	1.0	1	Adopt an individualised approach to diabetes care that is tailored to the needs and circumstances of adults with type 2 diabetes, taking into account their personal preferences, comorbidities, risks from polypharmacy, and their ability to benefit from long-term interventions because of reduced life expectancy.	
prescribers	0	1.0	1	the strongest evidence for effectiveness is for domperidone11, but prescribers must take into account its safety profile, in particular its cardiac risk and potential interactions with other medicines.	
products	1	1.0	1	Encourage high-fibre, low-glycaemic-index sources of carbohydrate in the diet, such as fruit, vegetables, wholegrains and pulses; include low-fat dairy products and oily fish; and control the intake of foods containing saturated and trans fatty acids.	
profile	1	1.0	1	the strongest evidence for effectiveness is for domperidone11, but prescribers must take into account its safety profile, in particular its cardiac risk and potential interactions with other medicines.	
pulses	0	1.0	1	Encourage high-fibre, low-glycaemic-index sources of carbohydrate in the diet, such as fruit, vegetables, wholegrains and pulses; include low-fat dairy products and oily fish; and control the intake of foods containing saturated and trans fatty acids.	
reassess	0	1.0	1	Reassess the person's needs and circumstances at each review and think about whether to stop any medicines that are not effective.	
reinforcement	0	1.0	1	Offer structured education to adults with type 2 diabetes and or their family members or carers (as appropriate) at and around the time of diagnosis, with annual reinforcement and review.	
retina	0	1.0	4	Use mydriasis with tropicamide when photographing the retina, after prior informed agreement following discussion of the advantages and disadvantages.	Use a quality-assured digital retinal photography programme using appropriately trained staff.	Arrange emergency review by an ophthalmologist for: sudden loss of vision rubeosis iridis pre-retinal or vitreous haemorrhage retinal detachment.	Refer to an ophthalmologist in accordance with the National Screening Committee criteria and timelines if any of these features are present: referable maculopathy: exudate or retinal thickening within 1 disc diameter of the centre of the fovea circinate or group of exudates within the macula (the macula is defined here as a circle centred on the fovea, with a diameter the distance between the temporal border of the optic disc and the fovea) any microaneurysm or haemorrhage within 1 disc diameter of the centre of the fovea, only if associated with deterioration of best visual acuity to 6 12 or worse. referable pre-proliferative retinopathy (if cotton wool spots are present, look carefully for the following features, but cotton wool spots themselves do not define pre-proliferative retinopathy): any venous beading any venous reduplication any intraretinal microvascular abnormalities multiple deep, round or blot haemorrhages. any large, sudden unexplained drop in visual acuity.	
rubeosis	0	1.0	1	Arrange emergency review by an ophthalmologist for: sudden loss of vision rubeosis iridis pre-retinal or vitreous haemorrhage retinal detachment.	
safety	1	1.0	1	the strongest evidence for effectiveness is for domperidone11, but prescribers must take into account its safety profile, in particular its cardiac risk and potential interactions with other medicines.	
seek	0	1.0	1	Seek advice from a team with specialist expertise in diabetes or clinical biochemistry.	
side	1	1.0	5	Consider short-term self-monitoring of blood glucose levels in adults with type 2 diabetes (and review treatment as necessary): when starting treatment with oral or intravenous corticosteroids or to confirm suspected hypoglycaemia.	For treating vomiting caused by gastroparesis in adults with type 2 diabetes: consider alternating use of erythomycin12 and metoclopramide13 consider domperidone11 only in exceptional circumstances (if domperidone is the only effective treatment) and in accordance with MHRA guidance.	If gastroparesis is suspected, consider referral to specialist services if: the differential diagnosis is in doubt or persistent or severe vomiting occurs.	When using tricyclic drugs and antihypertensive drug treatments in adults with type 2 diabetes who have autonomic neuropathy, be aware of the increased likelihood of side effects such as orthostatic hypotension.	Consider a phosphodiesterase-5 inhibitor to treat problematic erectile dysfunction in men with type 2 diabetes, initially choosing the drug with the lowest acquisition cost and taking into account any contraindications.	
signs	0	1.0	1	Think about the possibility of contributory sympathetic nervous system damage for adults with type 2 diabetes who lose the warning signs of hypoglycaemia.	
snacks	0	1.0	1	When adults with type 2 diabetes are admitted to hospital as inpatients or to any other care setting, implement a meal planning system that provides consistency in the carbohydrate content of meals and snacks.	
sources	0	1.0	2	Ensure the patient-education programme provides the necessary resources to support the educators, and that educators are properly trained and given time to develop and maintain their skills.	Encourage high-fibre, low-glycaemic-index sources of carbohydrate in the diet, such as fruit, vegetables, wholegrains and pulses; include low-fat dairy products and oily fish; and control the intake of foods containing saturated and trans fatty acids.	
staff	0	1.0	1	Use a quality-assured digital retinal photography programme using appropriately trained staff.	
standardisation	1	1.0	1	Use methods to measure HbA1c that have been calibrated according to International Federation of Clinical Chemistry (IFCC) standardisation.	
substitution	0	1.0	1	Advise adults with type 2 diabetes that limited substitution of sucrose-containing foods for other carbohydrate in the meal plan is allowable, but that they should take care to avoid excess energy intake.	
success	0	1.0	2	Following discussion, refer men with type 2 diabetes to a service offering other medical, surgical or psychological management of erectile dysfunction if treatment (including a phosphodiesterase-5 inhibitor, as appropriate) has been unsuccessful.	Explain the reasons for, and success of, eye screening systems to adults with type 2 diabetes, so that attendance is not reduced by lack of knowledge or fear of outcome.	
sucrose-containing	0	1.0	1	Advise adults with type 2 diabetes that limited substitution of sucrose-containing foods for other carbohydrate in the meal plan is allowable, but that they should take care to avoid excess energy intake.	
symptoms	0	1.0	1	In managing autonomic neuropathy symptoms, include specific interventions indicated by the manifestations (for example, for abnormal sweating or nocturnal diarrhoea).	
systems	1	1.0	1	Explain the reasons for, and success of, eye screening systems to adults with type 2 diabetes, so that attendance is not reduced by lack of knowledge or fear of outcome.	
testing	1	1.0	1	Perform visual acuity testing as a routine part of eye screening programmes.	
thiazide	1	1.0	1	If the person's blood pressure is not reduced to the individually agreed target with first-line therapy, add a calcium-channel blocker or a diuretic (usually a thiazide or thiazide-related diuretic).	
trans	0	1.0	1	Encourage high-fibre, low-glycaemic-index sources of carbohydrate in the diet, such as fruit, vegetables, wholegrains and pulses; include low-fat dairy products and oily fish; and control the intake of foods containing saturated and trans fatty acids.	
treatments	0	1.0	1	When using tricyclic drugs and antihypertensive drug treatments in adults with type 2 diabetes who have autonomic neuropathy, be aware of the increased likelihood of side effects such as orthostatic hypotension.	
tropicamide	1	1.0	1	Use mydriasis with tropicamide when photographing the retina, after prior informed agreement following discussion of the advantages and disadvantages.	
vegetables	0	1.0	1	Encourage high-fibre, low-glycaemic-index sources of carbohydrate in the diet, such as fruit, vegetables, wholegrains and pulses; include low-fat dairy products and oily fish; and control the intake of foods containing saturated and trans fatty acids.	
vessel	0	1.0	1	Arrange rapid review by an ophthalmologist for new vessel formation.	
vision	0	1.0	2	Ensure that all members of the diabetes healthcare team are familiar with the patient-education programmes available locally, that these programmes are integrated with the rest of the care pathway, and that adults with type 2 diabetes and their family members or carers (as appropriate) have the opportunity to contribute to the design and provision of local programmes.	Arrange emergency review by an ophthalmologist for: sudden loss of vision rubeosis iridis pre-retinal or vitreous haemorrhage retinal detachment.	
wholegrains	0	1.0	1	Encourage high-fibre, low-glycaemic-index sources of carbohydrate in the diet, such as fruit, vegetables, wholegrains and pulses; include low-fat dairy products and oily fish; and control the intake of foods containing saturated and trans fatty acids.	
willingness	0	1.0	1	Provide dietary advice in a form sensitive to the person's needs, culture and beliefs, being sensitive to their willingness to change and the effects on their quality of life.	
women	1	1.0	1	Exceptions to this are people of African or Caribbean family origin, or women for whom there is a possibility of becoming pregnant.	
year	0	1.0	1	Depending on the findings, follow structured eye screening by: routine review in 1 year or earlier review or referral to an ophthalmologist.	
antihypertensive	0	0.9975	7	For an adult with type 2 diabetes on antihypertensive drug treatment when diabetes is diagnosed, review blood pressure control and medications used.	Monitor blood pressure every 1–2 months, and intensify therapy if the person is already on antihypertensive drug treatment, until the blood pressure is consistently below 140 80 mmHg (below 130 80 mmHg if there is kidney, eye or cerebrovascular damage).	First-line antihypertensive drug treatment should be a once-daily, generic angiotensin-converting enzyme (ACE) inhibitor.	The first-line antihypertensive drug treatment for a person of African or Caribbean family origin should be an ACE inhibitor plus either a diuretic or a generic calcium-channel blocker.	A calcium-channel blocker should be the first-line antihypertensive drug treatment for a woman for whom, after an informed discussion, it is agreed there is a possibility of her becoming pregnant	Check for possible adverse effects of antihypertensive drug treatment – including the risks from unnecessarily low blood pressure.	When using tricyclic drugs and antihypertensive drug treatments in adults with type 2 diabetes who have autonomic neuropathy, be aware of the increased likelihood of side effects such as orthostatic hypotension.	
ensure	0	0.9868	4	Ensure that any structured education programme for adults with type 2 diabetes includes the following components: It is evidence-based, and suits the needs of the person. It has specific aims and learning objectives, and supports the person and their family members and carers in developing attitudes, beliefs, knowledge and skills to self-manage diabetes. It has a structured curriculum that is theory-driven, evidence-based and resource-effective, has supporting materials, and is written down. It is delivered by trained educators who have an understanding of educational theory appropriate to the age and needs of the person, and who are trained and competent to deliver the principles and content of the programme. It is quality assured, and reviewed by trained, competent, independent assessors who measure it against criteria that ensure consistency. The outcomes are audited regularly.	Ensure the patient-education programme provides the necessary resources to support the educators, and that educators are properly trained and given time to develop and maintain their skills.	Ensure that the patient-education programmes available meet the cultural, linguistic, cognitive and literacy needs within the local area.	Ensure that all members of the diabetes healthcare team are familiar with the patient-education programmes available locally, that these programmes are integrated with the rest of the care pathway, and that adults with type 2 diabetes and their family members or carers (as appropriate) have the opportunity to contribute to the design and provision of local programmes.	
eye	1	0.9856	7	Add medications if lifestyle advice does not reduce blood pressure to below 140 80 mmHg (below 130 80 mmHg if there is kidney, eye or cerebrovascular damage).	Monitor blood pressure every 1–2 months, and intensify therapy if the person is already on antihypertensive drug treatment, until the blood pressure is consistently below 140 80 mmHg (below 130 80 mmHg if there is kidney, eye or cerebrovascular damage).	On diagnosis, GPs should immediately refer adults with type 2 diabetes to the local eye screening service.	Arrange repeat structured eye screening annually.	Explain the reasons for, and success of, eye screening systems to adults with type 2 diabetes, so that attendance is not reduced by lack of knowledge or fear of outcome.	Perform visual acuity testing as a routine part of eye screening programmes.	Depending on the findings, follow structured eye screening by: routine review in 1 year or earlier review or referral to an ophthalmologist.	
guideline	0	0.9642	4	For recommendations on lifestyle advice, see the NICE guidelines on: preventing excess weight gain, weight management, obesity, physical activity, smoking: brief interventions and referrals, stop smoking services, smoking: harm reduction, and smoking: acute, maternity and mental health services.	For guidance on managing painful diabetic peripheral neuropathy in adults with type 2 diabetes, see the NICE guideline on neuropathic pain in adults.	For guidance on preventing and managing foot problems in adults with type 2 diabetes, see the NICE guideline on diabetic foot problems.	For guidance on managing kidney disease in adults with type 2 diabetes, see the NICE guideline on chronic kidney disease in adults.	
lifestyle	0	0.9634	6	Integrate dietary advice with a personalised diabetes management plan, including other aspects of lifestyle modification, such as increasing physical activity and losing weight.	For recommendations on lifestyle advice, see the NICE guidelines on: preventing excess weight gain, weight management, obesity, physical activity, smoking: brief interventions and referrals, stop smoking services, smoking: harm reduction, and smoking: acute, maternity and mental health services.	Offer and reinforce preventive lifestyle advice.	Add medications if lifestyle advice does not reduce blood pressure to below 140 80 mmHg (below 130 80 mmHg if there is kidney, eye or cerebrovascular damage).	For adults with type 2 diabetes managed either by lifestyle and diet, or by lifestyle and diet combined with a single drug not associated with hypoglycaemia, support the person to aim for an HbA1c level of 48 mmol mol(6.5percent).	In adults with type 2 diabetes, if HbA1c levels are not adequately controlled by a single drug and rise to 58 mmol mol (7.5percent) or higher: reinforce advice about diet, lifestyle and adherence to drug treatment and support the person to aim for an HbA1c level of 53 mmol mol (7.0percent) and intensify drug treatment.	
screening	1	0.9627	7	On diagnosis, GPs should immediately refer adults with type 2 diabetes to the local eye screening service.	Perform screening as soon as possible and no later than 3 months from referral.	Arrange repeat structured eye screening annually.	Explain the reasons for, and success of, eye screening systems to adults with type 2 diabetes, so that attendance is not reduced by lack of knowledge or fear of outcome.	Perform visual acuity testing as a routine part of eye screening programmes.	Depending on the findings, follow structured eye screening by: routine review in 1 year or earlier review or referral to an ophthalmologist.	Refer to an ophthalmologist in accordance with the National Screening Committee criteria and timelines if any of these features are present: referable maculopathy: exudate or retinal thickening within 1 disc diameter of the centre of the fovea circinate or group of exudates within the macula (the macula is defined here as a circle centred on the fovea, with a diameter the distance between the temporal border of the optic disc and the fovea) any microaneurysm or haemorrhage within 1 disc diameter of the centre of the fovea, only if associated with deterioration of best visual acuity to 6 12 or worse. referable pre-proliferative retinopathy (if cotton wool spots are present, look carefully for the following features, but cotton wool spots themselves do not define pre-proliferative retinopathy): any venous beading any venous reduplication any intraretinal microvascular abnormalities multiple deep, round or blot haemorrhages. any large, sudden unexplained drop in visual acuity.	
ophthalmologist	0	0.9498	4	Depending on the findings, follow structured eye screening by: routine review in 1 year or earlier review or referral to an ophthalmologist.	Arrange emergency review by an ophthalmologist for: sudden loss of vision rubeosis iridis pre-retinal or vitreous haemorrhage retinal detachment.	Arrange rapid review by an ophthalmologist for new vessel formation.	Refer to an ophthalmologist in accordance with the National Screening Committee criteria and timelines if any of these features are present: referable maculopathy: exudate or retinal thickening within 1 disc diameter of the centre of the fovea circinate or group of exudates within the macula (the macula is defined here as a circle centred on the fovea, with a diameter the distance between the temporal border of the optic disc and the fovea) any microaneurysm or haemorrhage within 1 disc diameter of the centre of the fovea, only if associated with deterioration of best visual acuity to 6 12 or worse. referable pre-proliferative retinopathy (if cotton wool spots are present, look carefully for the following features, but cotton wool spots themselves do not define pre-proliferative retinopathy): any venous beading any venous reduplication any intraretinal microvascular abnormalities multiple deep, round or blot haemorrhages. any large, sudden unexplained drop in visual acuity.	
skills	0	0.9369	2	Ensure that any structured education programme for adults with type 2 diabetes includes the following components: It is evidence-based, and suits the needs of the person. It has specific aims and learning objectives, and supports the person and their family members and carers in developing attitudes, beliefs, knowledge and skills to self-manage diabetes. It has a structured curriculum that is theory-driven, evidence-based and resource-effective, has supporting materials, and is written down. It is delivered by trained educators who have an understanding of educational theory appropriate to the age and needs of the person, and who are trained and competent to deliver the principles and content of the programme. It is quality assured, and reviewed by trained, competent, independent assessors who measure it against criteria that ensure consistency. The outcomes are audited regularly.	Ensure the patient-education programme provides the necessary resources to support the educators, and that educators are properly trained and given time to develop and maintain their skills.	
