side	1	1.1953	25	Medicines and Healthcare products Regulatory Agency (MHRA) guidance (2014) notes that domperidone is associated with a small increased risk of serious cardiac side effects	Medicines and Healthcare products Regulatory Agency (MHRA) guidance (2014) notes that domperidone is associated with a small increased risk of serious cardiac side effects	However, discuss with any person for whom repaglinide is being considered, that there is no licensed non-metformin-based combination containing repaglinide that can be offered at first intensification.	The wording used in the recommendations in this guideline (for example, words such as 'offer' and 'consider') denotes the certainty with which the recommendation is made (the strength of the recommendation)	Consider relaxing the target HbA1c level (see recommendations and )	Last updated May 2017 on a case-by-case basis, with particular consideration for people who are older or frail, for adults with type 2 diabetes: who are unlikely to achieve longer-term risk-reduction benefits, for example, people with a reduced life expectancy for whom tight blood glucose control poses a high risk of the consequences of hypoglycaemia, for example, people who are at risk of falling, people who have impaired awareness of hypoglycaemia, and people who drive or operate machinery as part of their job for whom intensive management would not be appropriate, for example, people with significant comorbidities.	Consider short-term self-monitoring of blood glucose levels in adults with type 2 diabetes (and review treatment as necessary): when starting treatment with oral or intravenous corticosteroids or to confirm suspected hypoglycaemia.	If an adult with type 2 diabetes is symptomatically hyperglycaemic, consider insulin (see recommendations – ) or a sulfonylurea, and review treatment when blood glucose control has been achieved.	Gradually increase the dose of standard-release metformin over several weeks to minimise the risk of gastrointestinal side effects in adults with type 2 diabetes.	If an adult with type 2 diabetes experiences gastrointestinal side effects with standard-release metformin, consider a trial of modified-release metformin.	In adults with type 2 diabetes, if metformin is contraindicated or not tolerated, consider initial drug treatment with: a dipeptidyl peptidase-4 (DPP-4) inhibitor or pioglitazone or a sulfonylurea.	In adults with type 2 diabetes, if initial drug treatment with metformin has not continued to control HbA1c to below the person's individually agreed threshold for intensification, consider dual therapy with: metformin and a DPP-4 inhibitor or metformin and pioglitazone or metformin and a sulfonylurea.	In adults with type 2 diabetes, if metformin is contraindicated or not tolerated and initial drug treatment has not continued to control HbA1c to below the person's individually agreed threshold for intensification, consider dual therapy with: a DPP-4 inhibitor and pioglitazone or a DPP-4 inhibitor and a sulfonylurea or pioglitazone and a sulfonylurea.	In adults with type 2 diabetes, if dual therapy with metformin and another oral drug (see recommendation ) has not continued to control HbA1c to below the person's individually agreed threshold for intensification, consider either: triple therapy with: metformin, a DPP-4 inhibitor and a sulfonylurea or metformin, pioglitazone and a sulfonylurea or starting insulin-based treatment (see recommendations – ).	If triple therapy with metformin and 2 other oral drugs (see recommendation ) is not effective, not tolerated or contraindicated, consider combination therapy with metformin, a sulfonylurea and a glucagon-like peptide-1 (GLP-1) mimetic for adults with type 2 diabetes who: have a BMI of 35 kg m2 or higher (adjust accordingly for people from black, Asian and other minority ethnic groups) and specific psychological or other medical problems associated with obesity or have a BMI lower than 35 kg m2and: for whom insulin therapy would have significant occupational implications or weight loss would benefit other significant obesity-related comorbidities.	In adults with type 2 diabetes, if metformin is contraindicated or not tolerated, and if dual therapy with 2 oral drugs (see recommendation ) has not continued to control HbA1c to below the person's individually agreed threshold for intensification, consider insulin-based treatment (see recommendations – ).	Consider starting both NPH and short-acting insulin (particularly if the person's	Consider, as an alternative to NPH insulin, using insulin detemir or insulin glargine if: the person needs assistance from a carer or healthcare professional to inject insulin, and use of insulin detemir or insulin glargine would reduce the frequency of injections from twice to once daily or the person's lifestyle is restricted by recurrent symptomatic hypoglycaemic episodes or the person would otherwise need twice-daily NPH insulin injections in combination with oral glucose-lowering drugs.	Consider pre-mixed (biphasic) preparations that include short-acting insulin analogues, rather than pre-mixed (biphasic) preparations that include short-acting human insulin preparations, if: a person prefers injecting insulin immediately before a meal or hypoglycaemia is a problem or blood glucose levels rise markedly after meals.	Consider switching to insulin detemir or insulin glargine from NPH insulin in adults with type 2 diabetes: who do not reach their target HbA1c because of significant hypoglycaemia or who experience significant hypoglycaemia on NPH insulin irrespective of the level of	For treating vomiting caused by gastroparesis in adults with type 2 diabetes: consider alternating use of erythomycin and metoclopramide consider domperidone only in exceptional circumstances (if domperidone is the only effective treatment) and in accordance with MHRA guidance.	If gastroparesis is suspected, consider referral to specialist services if: the differential diagnosis is in doubt or persistent or severe vomiting occurs.	When using tricyclic drugs and antihypertensive drug treatments in adults with type 2 diabetes who have autonomic neuropathy, be aware of the increased likelihood of side effects such as orthostatic hypotension.	Consider a phosphodiesterase-5 inhibitor to treat problematic erectile dysfunction in men with type 2 diabetes, initially choosing the drug with the lowest acquisition cost and taking into account any contraindications.	However, discuss with any person for whom repaglinide is being considered, that there is no licensed non-metformin-based combination containing repaglinide that can be offered at first intensification.	
quality	1	1.1947	8	Last updated May 2017 of the following: quality-controlled plasma glucose profiles total glycated haemoglobin estimation (if abnormal haemoglobins) fructosamine estimation.	Use a quality-assured digital retinal photography programme using appropriately trained staff.	Last updated May 2017 of the following: quality-controlled plasma glucose profiles total glycated haemoglobin estimation (if abnormal haemoglobins) fructosamine estimation.	Use a quality-assured digital retinal photography programme using appropriately trained staff.	It is quality assured, and reviewed by trained, competent, independent assessors who measure it against criteria that ensure consistency.	Provide dietary advice in a form sensitive to the person's needs, culture and beliefs, being sensitive to their willingness to change and the effects on their quality of life.	Encourage them to achieve the target and maintain it unless any resulting adverse effects (including hypoglycaemia), or their efforts to achieve their target, impair their quality of life.	The assessment should include: the person's self-monitoring skills the quality and frequency of testing checking that the person knows how to interpret the blood glucose results and what action to take the impact on the person's quality of life the continued benefit to the person the equipment used.	
problems	0	1.189	6	Diabetic foot problems	Diabetic foot problems	Make changes only if there is poor control or if current drug treatment is not appropriate because of microvascular complications or metabolic problems.	If triple therapy with metformin and 2 other oral drugs (see recommendation ) is not effective, not tolerated or contraindicated, consider combination therapy with metformin, a sulfonylurea and a glucagon-like peptide-1 (GLP-1) mimetic for adults with type 2 diabetes who: have a BMI of 35 kg m2 or higher (adjust accordingly for people from black, Asian and other minority ethnic groups) and specific psychological or other medical problems associated with obesity or have a BMI lower than 35 kg m2and: for whom insulin therapy would have significant occupational implications or weight loss would benefit other significant obesity-related comorbidities.	Investigate the possibility of autonomic neuropathy affecting the bladder in adults with type 2 diabetes who have unexplained bladder-emptying problems.	For guidance on preventing and managing foot problems in adults with type 2 diabetes, see the NICE guideline on diabetic foot problems.	
pregnancy	1	1.1821	2	For guidance on HbA1c targets for women with type 2 diabetes who are pregnant or planning to become pregnant, see the NICE guideline on diabetes in pregnancy.	For more information, see the NICE guideline on diabetes in pregnancy.	
dose	0	1.1774	6	Domperidone is now contraindicated in certain groups in whom the risk of cardiac effects is higher; its marketing authorisations have also been restricted to its use in the relief of nausea and vomiting only, at the lowest effective dose and for the shortest possible time (usually not more than 1 week): see the	Domperidone is now contraindicated in certain groups in whom the risk of cardiac effects is higher; its marketing authorisations have also been restricted to its use in the relief of nausea and vomiting only, at the lowest effective dose and for the shortest possible time (usually not more than 1 week): see the	Gradually increase the dose of standard-release metformin over several weeks to minimise the risk of gastrointestinal side effects in adults with type 2 diabetes.	In adults with type 2 diabetes, review the dose of metformin if the estimated glomerular filtration rate (eGFR) is below 45 ml minute m2:	When starting insulin therapy in adults with type 2 diabetes, use a structured programme employing active insulin dose titration that encompasses: injection technique, including rotating injection sites and avoiding repeated injections at the same point within sites continuing telephone support self-monitoring dose titration to target levels dietary understanding	The MHRA advises that prescribers should take into account the overall safety profile of domperidone, and in particular its cardiac risk and potential interactions with other medicines (such as erythromycin), if there is a clinical need to use it at doses or durations greater than those authorised	
prescribers	0	1.1765	4	Medicines and Healthcare products Regulatory Agency (MHRA) guidance (2011) advises that 'prescribers should review the safety and efficacy of pioglitazone in individuals after 3–6 months of treatment to ensure that only patients who are deriving benefit continue to be treated'.	For adults with type 2 diabetes who have vomiting caused by gastroparesis, explain that: there is not strong evidence that any available antiemetic therapy is effective some people have had benefit with domperidone , erythromycin or metoclopramide . the strongest evidence for effectiveness is for domperidone , but prescribers must	Medicines and Healthcare products Regulatory Agency (MHRA) guidance (2011) advises that 'prescribers should review the safety and efficacy of pioglitazone in individuals after 3–6 months of treatment to ensure that only patients who are deriving benefit continue to be treated'.	The MHRA advises that prescribers should take into account the overall safety profile of domperidone, and in particular its cardiac risk and potential interactions with other medicines (such as erythromycin), if there is a clinical need to use it at doses or durations greater than those authorised	
risk	1	1.1506	33	When prescribing pioglitazone, exercise particular caution if the person is at high risk of the adverse effects of the drug	Pioglitazone is associated with an increased risk of heart failure, bladder cancer and bone fracture	Last updated May 2017 take into account its safety profile, in particular its cardiac risk and potential interactions with other medicines.	When prescribing pioglitazone, exercise particular caution if the person is at high risk of the adverse effects of the drug	Pioglitazone is associated with an increased risk of heart failure, bladder cancer and bone fracture	Medicines and Healthcare products Regulatory Agency (MHRA) guidance (2017) warned that canagliflozin may increase the risk of lower-limb amputation (mainly toes) in people with type 2 diabetes	At the time of publication (March 2017) evidence did not show an increased risk for dapagliflozin and empagliflozin, but the MHRA advised that the risk may be a class effect.	Medicines and Healthcare products Regulatory Agency (MHRA) guidance (2011) notes that cases of cardiac failure have been reported when pioglitazone was used in combination with insulin, especially in patients with risk factors for the development of cardiac failure	Medicines and Healthcare products Regulatory Agency (MHRA) guidance (2014) notes that domperidone is associated with a small increased risk of serious cardiac side effects	Domperidone is now contraindicated in certain groups in whom the risk of cardiac effects is higher; its marketing authorisations have also been restricted to its use in the relief of nausea and vomiting only, at the lowest effective dose and for the shortest possible time (usually not more than 1 week): see the	When prescribing pioglitazone, exercise particular caution if the person is at high risk of the adverse effects of the drug	Pioglitazone is associated with an increased risk of heart failure, bladder cancer and bone fracture	Last updated May 2017 take into account its safety profile, in particular its cardiac risk and potential interactions with other medicines.	When prescribing pioglitazone, exercise particular caution if the person is at high risk of the adverse effects of the drug	Pioglitazone is associated with an increased risk of heart failure, bladder cancer and bone fracture	Medicines and Healthcare products Regulatory Agency (MHRA) guidance (2017) warned that canagliflozin may increase the risk of lower-limb amputation (mainly toes) in people with type 2 diabetes	At the time of publication (March 2017) evidence did not show an increased risk for dapagliflozin and empagliflozin, but the MHRA advised that the risk may be a class effect.	Medicines and Healthcare products Regulatory Agency (MHRA) guidance (2011) notes that cases of cardiac failure have been reported when pioglitazone was used in combination with insulin, especially in patients with risk factors for the development of cardiac failure	Medicines and Healthcare products Regulatory Agency (MHRA) guidance (2014) notes that domperidone is associated with a small increased risk of serious cardiac side effects	Domperidone is now contraindicated in certain groups in whom the risk of cardiac effects is higher; its marketing authorisations have also been restricted to its use in the relief of nausea and vomiting only, at the lowest effective dose and for the shortest possible time (usually not more than 1 week): see the	Known risk factors for these conditions, including increased age, should be carefully evaluated before treatment: see the manufacturers' summaries of product characteristics for details	Adopt an individualised approach to diabetes care that is tailored to the needs and circumstances of adults with type 2 diabetes, taking into account their personal preferences, comorbidities, risks from polypharmacy, and their ability to benefit from long-term interventions because of reduced life expectancy.	Reducing the risk of hypoglycaemia should be a particular aim for a person using insulin or an insulin secretagogue.	Check for possible adverse effects of antihypertensive drug treatment – including the risks from unnecessarily low blood pressure.	Last updated May 2017 on a case-by-case basis, with particular consideration for people who are older or frail, for adults with type 2 diabetes: who are unlikely to achieve longer-term risk-reduction benefits, for example, people with a reduced life expectancy for whom tight blood glucose control poses a high risk of the consequences of hypoglycaemia, for example, people who are at risk of falling, people who have impaired awareness of hypoglycaemia, and people who drive or operate machinery as part of their job for whom intensive management would not be appropriate, for example, people with significant comorbidities.	Do not routinely offer self-monitoring of blood glucose levels for adults with type 2 diabetes unless: the person is on insulin or there is evidence of hypoglycaemic episodes or the person is on oral medication that may increase their risk of hypoglycaemia while driving or operating machinery or	Be aware that adults with type 2 diabetes who have acute intercurrent illness are at risk of worsening hyperglycaemia	For adults with type 2 diabetes, discuss the benefits and risks of drug treatment, and the options available	Last updated May 2017 safety (see Medicines and Healthcare products Regulatory Agency MHRA guidance) and tolerability of the drug treatment(s) the person's individual clinical circumstances, for example, comorbidities, risks from polypharmacy the person's individual preferences and needs the licensed indications or combinations available cost (if 2 drugs in the same class are appropriate, choose the option with the lowest acquisition cost).	Gradually increase the dose of standard-release metformin over several weeks to minimise the risk of gastrointestinal side effects in adults with type 2 diabetes.	Prescribe metformin with caution for those at risk of a sudden deterioration in kidney function and those at risk of eGFR falling below 45 ml minute m2.	Known risk factors for these conditions, including increased age, should be carefully evaluated before treatment: see the manufacturers' summaries of product characteristics for details	The MHRA advises that prescribers should take into account the overall safety profile of domperidone, and in particular its cardiac risk and potential interactions with other medicines (such as erythromycin), if there is a clinical need to use it at doses or durations greater than those authorised	
safety	1	1.1468	6	Last updated May 2017 take into account its safety profile, in particular its cardiac risk and potential interactions with other medicines.	Last updated May 2017 take into account its safety profile, in particular its cardiac risk and potential interactions with other medicines.	Medicines and Healthcare products Regulatory Agency (MHRA) guidance (2011) advises that 'prescribers should review the safety and efficacy of pioglitazone in individuals after 3–6 months of treatment to ensure that only patients who are deriving benefit continue to be treated'.	Last updated May 2017 safety (see Medicines and Healthcare products Regulatory Agency MHRA guidance) and tolerability of the drug treatment(s) the person's individual clinical circumstances, for example, comorbidities, risks from polypharmacy the person's individual preferences and needs the licensed indications or combinations available cost (if 2 drugs in the same class are appropriate, choose the option with the lowest acquisition cost).	Medicines and Healthcare products Regulatory Agency (MHRA) guidance (2011) advises that 'prescribers should review the safety and efficacy of pioglitazone in individuals after 3–6 months of treatment to ensure that only patients who are deriving benefit continue to be treated'.	The MHRA advises that prescribers should take into account the overall safety profile of domperidone, and in particular its cardiac risk and potential interactions with other medicines (such as erythromycin), if there is a clinical need to use it at doses or durations greater than those authorised	
hypertension	1	1.1459	3	Measure blood pressure at least annually in an adult with type 2 diabetes without previously diagnosed hypertension or renal disease	Provide lifestyle advice (see section in this guideline and the lifestyle interventions section in hypertension in adults NICE guideline CG127) if blood	Do not combine an ACE inhibitor with an angiotensin II-receptor antagonist to treat hypertension.	
benefit	0	1.131	10	Remember that lesser degrees of weight loss may still be of benefit, and that larger degrees of weight loss in the longer term will have advantageous metabolic impact.	Remember that lesser degrees of weight loss may still be of benefit, and that larger degrees of weight loss in the longer term will have advantageous metabolic impact.	Medicines and Healthcare products Regulatory Agency (MHRA) guidance (2011) advises that 'prescribers should review the safety and efficacy of pioglitazone in individuals after 3–6 months of treatment to ensure that only patients who are deriving benefit continue to be treated'.	Adopt an individualised approach to diabetes care that is tailored to the needs and circumstances of adults with type 2 diabetes, taking into account their personal preferences, comorbidities, risks from polypharmacy, and their ability to benefit from long-term interventions because of reduced life expectancy.	Last updated May 2017 on a case-by-case basis, with particular consideration for people who are older or frail, for adults with type 2 diabetes: who are unlikely to achieve longer-term risk-reduction benefits, for example, people with a reduced life expectancy for whom tight blood glucose control poses a high risk of the consequences of hypoglycaemia, for example, people who are at risk of falling, people who have impaired awareness of hypoglycaemia, and people who drive or operate machinery as part of their job for whom intensive management would not be appropriate, for example, people with significant comorbidities.	The assessment should include: the person's self-monitoring skills the quality and frequency of testing checking that the person knows how to interpret the blood glucose results and what action to take the impact on the person's quality of life the continued benefit to the person the equipment used.	For adults with type 2 diabetes, discuss the benefits and risks of drug treatment, and the options available	If triple therapy with metformin and 2 other oral drugs (see recommendation ) is not effective, not tolerated or contraindicated, consider combination therapy with metformin, a sulfonylurea and a glucagon-like peptide-1 (GLP-1) mimetic for adults with type 2 diabetes who: have a BMI of 35 kg m2 or higher (adjust accordingly for people from black, Asian and other minority ethnic groups) and specific psychological or other medical problems associated with obesity or have a BMI lower than 35 kg m2and: for whom insulin therapy would have significant occupational implications or weight loss would benefit other significant obesity-related comorbidities.	For adults with type 2 diabetes who have vomiting caused by gastroparesis, explain that: there is not strong evidence that any available antiemetic therapy is effective some people have had benefit with domperidone , erythromycin or metoclopramide . the strongest evidence for effectiveness is for domperidone , but prescribers must	Medicines and Healthcare products Regulatory Agency (MHRA) guidance (2011) advises that 'prescribers should review the safety and efficacy of pioglitazone in individuals after 3–6 months of treatment to ensure that only patients who are deriving benefit continue to be treated'.	
symptoms	0	1.1223	3	In managing autonomic neuropathy symptoms, include specific interventions indicated by the manifestations (for example, for abnormal sweating or nocturnal diarrhoea).	The MHRA advised that healthcare professionals should test for raised ketones in people with ketoacidosis symptoms who are receiving an SGLT-2 inhibitor, even if their plasma glucose levels are near-normal.	It advises that if the combination is used, people should be observed for signs and symptoms of heart failure, weight gain, and oedema	
