rate	1	0.6892	23	Integrate dietary advice with a personalised diabetes management plan, including other aspects of lifestyle modification, such as increasing physical activity and losing weight.	HbA1c is 75 mmol mol  percent or higher), administered either: separately or as a pre-mixed (biphasic) human insulin preparation.	HbA1c reached or who cannot use the device needed to inject NPH insulin but who could administer their own insulin safely and accurately if a switch to one of the long-acting insulin analogues was made or	In several cases, blood glucose levels were only moderately elevated	Integrate dietary advice with a personalised diabetes management plan, including other aspects of lifestyle modification, such as increasing physical activity and losing weight.	HbA1c is 75 mmol mol  percent or higher), administered either: separately or as a pre-mixed (biphasic) human insulin preparation.	HbA1c reached or who cannot use the device needed to inject NPH insulin but who could administer their own insulin safely and accurately if a switch to one of the long-acting insulin analogues was made or	In several cases, blood glucose levels were only moderately elevated	Be aware that, if metformin is contraindicated or not tolerated, repaglinide is both clinically effective and cost effective in adults with type 2 diabetes	Ensure that all members of the diabetes healthcare team are familiar with the patient-education programmes available locally, that these programmes are integrated with the rest of the care pathway, and that adults with type 2 diabetes and their family members or carers (as appropriate) have the opportunity to contribute to the design and provision of local programmes.	Encourage high-fibre, low-glycaemic-index sources of carbohydrate in the diet, such as fruit, vegetables, wholegrains and pulses; include low-fat dairy products and oily fish; and control the intake of foods containing saturated and trans fatty acids.	Individualise recommendations for carbohydrate and alcohol intake, and meal patterns	Advise adults with type 2 diabetes that limited substitution of sucrose-containing foods for other carbohydrate in the meal plan is allowable, but that they should take care to avoid excess energy intake.	When adults with type 2 diabetes are admitted to hospital as inpatients or to any other care setting, implement a meal planning system that provides consistency in the carbohydrate content of meals and snacks.	Use methods to measure HbA1c that have been calibrated according to	Last updated May 2017 on a case-by-case basis, with particular consideration for people who are older or frail, for adults with type 2 diabetes: who are unlikely to achieve longer-term risk-reduction benefits, for example, people with a reduced life expectancy for whom tight blood glucose control poses a high risk of the consequences of hypoglycaemia, for example, people who are at risk of falling, people who have impaired awareness of hypoglycaemia, and people who drive or operate machinery as part of their job for whom intensive management would not be appropriate, for example, people with significant comorbidities.	In adults with type 2 diabetes, review the dose of metformin if the estimated glomerular filtration rate (eGFR) is below 45 ml minute m2:	In adults with type 2 diabetes, if metformin is contraindicated or not tolerated, consider initial drug treatment with: a dipeptidyl peptidase-4 (DPP-4) inhibitor or pioglitazone or a sulfonylurea.	Treatment with sodium–glucose cotransporter 2 (SGLT-2) inhibitors , may be appropriate for some adults with type 2 diabetes if metformin is contraindicated or not tolerated (see NICE's guidance on canagliflozin, dapagliflozin and empagliflozin as monotherapies for treating type 2 diabetes).	In adults with type 2 diabetes, if metformin is contraindicated or not tolerated and initial drug treatment has not continued to control HbA1c to below the person's individually agreed threshold for intensification, consider dual therapy with: a DPP-4 inhibitor and pioglitazone or a DPP-4 inhibitor and a sulfonylurea or pioglitazone and a sulfonylurea.	If triple therapy with metformin and 2 other oral drugs (see recommendation ) is not effective, not tolerated or contraindicated, consider combination therapy with metformin, a sulfonylurea and a glucagon-like peptide-1 (GLP-1) mimetic for adults with type 2 diabetes who: have a BMI of 35 kg m2 or higher (adjust accordingly for people from black, Asian and other minority ethnic groups) and specific psychological or other medical problems associated with obesity or have a BMI lower than 35 kg m2and: for whom insulin therapy would have significant occupational implications or weight loss would benefit other significant obesity-related comorbidities.	In adults with type 2 diabetes, if metformin is contraindicated or not tolerated, and if dual therapy with 2 oral drugs (see recommendation ) has not continued to control HbA1c to below the person's individually agreed threshold for intensification, consider insulin-based treatment (see recommendations – ).	Be aware that, if metformin is contraindicated or not tolerated, repaglinide is both clinically effective and cost effective in adults with type 2 diabetes	
implications	0	0.687	1	If triple therapy with metformin and 2 other oral drugs (see recommendation ) is not effective, not tolerated or contraindicated, consider combination therapy with metformin, a sulfonylurea and a glucagon-like peptide-1 (GLP-1) mimetic for adults with type 2 diabetes who: have a BMI of 35 kg m2 or higher (adjust accordingly for people from black, Asian and other minority ethnic groups) and specific psychological or other medical problems associated with obesity or have a BMI lower than 35 kg m2and: for whom insulin therapy would have significant occupational implications or weight loss would benefit other significant obesity-related comorbidities.	
m2and	0	0.687	1	If triple therapy with metformin and 2 other oral drugs (see recommendation ) is not effective, not tolerated or contraindicated, consider combination therapy with metformin, a sulfonylurea and a glucagon-like peptide-1 (GLP-1) mimetic for adults with type 2 diabetes who: have a BMI of 35 kg m2 or higher (adjust accordingly for people from black, Asian and other minority ethnic groups) and specific psychological or other medical problems associated with obesity or have a BMI lower than 35 kg m2and: for whom insulin therapy would have significant occupational implications or weight loss would benefit other significant obesity-related comorbidities.	
minority	1	0.687	1	If triple therapy with metformin and 2 other oral drugs (see recommendation ) is not effective, not tolerated or contraindicated, consider combination therapy with metformin, a sulfonylurea and a glucagon-like peptide-1 (GLP-1) mimetic for adults with type 2 diabetes who: have a BMI of 35 kg m2 or higher (adjust accordingly for people from black, Asian and other minority ethnic groups) and specific psychological or other medical problems associated with obesity or have a BMI lower than 35 kg m2and: for whom insulin therapy would have significant occupational implications or weight loss would benefit other significant obesity-related comorbidities.	
intolerance	0	0.6866	3	For a person with continuing intolerance to an ACE inhibitor (other than renal deterioration or hyperkalaemia), substitute an angiotensin II-receptor antagonist for the ACE inhibitor.	For a person with continuing intolerance to an ACE inhibitor (other than renal deterioration or hyperkalaemia), substitute an angiotensin II-receptor antagonist for the ACE inhibitor.	When starting insulin therapy in adults with type 2 diabetes, continue to offer metformin for people without contraindications or intolerance	
point	0	0.6866	1	When starting insulin therapy in adults with type 2 diabetes, use a structured programme employing active insulin dose titration that encompasses: injection technique, including rotating injection sites and avoiding repeated injections at the same point within sites continuing telephone support self-monitoring dose titration to target levels dietary understanding	
technique	0	0.6866	1	When starting insulin therapy in adults with type 2 diabetes, use a structured programme employing active insulin dose titration that encompasses: injection technique, including rotating injection sites and avoiding repeated injections at the same point within sites continuing telephone support self-monitoring dose titration to target levels dietary understanding	
telephone	0	0.6866	1	When starting insulin therapy in adults with type 2 diabetes, use a structured programme employing active insulin dose titration that encompasses: injection technique, including rotating injection sites and avoiding repeated injections at the same point within sites continuing telephone support self-monitoring dose titration to target levels dietary understanding	
understanding	0	0.6866	3	It is delivered by trained educators who have an understanding of educational theory appropriate to the age and needs of the person, and who are trained and competent to deliver the principles and content of the programme.	It is delivered by trained educators who have an understanding of educational theory appropriate to the age and needs of the person, and who are trained and competent to deliver the principles and content of the programme.	When starting insulin therapy in adults with type 2 diabetes, use a structured programme employing active insulin dose titration that encompasses: injection technique, including rotating injection sites and avoiding repeated injections at the same point within sites continuing telephone support self-monitoring dose titration to target levels dietary understanding	
glucose	0	0.6848	32	Blood glucose management	If HbA1c monitoring is invalid because of disturbed erythrocyte turnover or abnormal haemoglobin type, estimate trends in blood glucose control using one	Last updated May 2017 of the following: quality-controlled plasma glucose profiles total glycated haemoglobin estimation (if abnormal haemoglobins) fructosamine estimation.	DVLA guidance (At a glance guide to the current medical standards of fitness to drive) management of hypoglycaemia management of acute changes in plasma glucose control support from an appropriately trained and experienced healthcare professional.	In several cases, blood glucose levels were only moderately elevated	Blood glucose management	If HbA1c monitoring is invalid because of disturbed erythrocyte turnover or abnormal haemoglobin type, estimate trends in blood glucose control using one	Last updated May 2017 of the following: quality-controlled plasma glucose profiles total glycated haemoglobin estimation (if abnormal haemoglobins) fructosamine estimation.	DVLA guidance (At a glance guide to the current medical standards of fitness to drive) management of hypoglycaemia management of acute changes in plasma glucose control support from an appropriately trained and experienced healthcare professional.	In several cases, blood glucose levels were only moderately elevated	Treatment with a single non-insulin blood glucose lowering therapy (monotherapy)	Treatment with 2 non-insulin blood glucose lowering therapies in combination (dual therapy)	Treatment with either 3 non-insulin blood glucose lowering therapies in combination (triple therapy) or any treatment combination containing insulin	In adults with type 2 diabetes, measure HbA1c levels at: 3–6-monthly intervals (tailored to individual needs), until the HbA1c is stable on unchanging therapy 6-monthly intervals once the HbA1c level and blood glucose lowering therapy are stable.	Investigate unexplained discrepancies between HbA1c and other glucose measurements	Last updated May 2017 on a case-by-case basis, with particular consideration for people who are older or frail, for adults with type 2 diabetes: who are unlikely to achieve longer-term risk-reduction benefits, for example, people with a reduced life expectancy for whom tight blood glucose control poses a high risk of the consequences of hypoglycaemia, for example, people who are at risk of falling, people who have impaired awareness of hypoglycaemia, and people who drive or operate machinery as part of their job for whom intensive management would not be appropriate, for example, people with significant comorbidities.	Self-monitoring of blood glucose	Take the Driver and Vehicle Licensing Agency (DVLA) At a glance guide to the current medical standards of fitness to drive into account when offering self-monitoring of blood glucose levels for adults with type 2 diabetes.	Do not routinely offer self-monitoring of blood glucose levels for adults with type 2 diabetes unless: the person is on insulin or there is evidence of hypoglycaemic episodes or the person is on oral medication that may increase their risk of hypoglycaemia while driving or operating machinery or	Consider short-term self-monitoring of blood glucose levels in adults with type 2 diabetes (and review treatment as necessary): when starting treatment with oral or intravenous corticosteroids or to confirm suspected hypoglycaemia.	If adults with type 2 diabetes are self-monitoring their blood glucose levels, carry out a structured assessment at least annually	The assessment should include: the person's self-monitoring skills the quality and frequency of testing checking that the person knows how to interpret the blood glucose results and what action to take the impact on the person's quality of life the continued benefit to the person the equipment used.	If an adult with type 2 diabetes is symptomatically hyperglycaemic, consider insulin (see recommendations – ) or a sulfonylurea, and review treatment when blood glucose control has been achieved.	Algorithm for blood glucose lowering therapy in adults with type 2 diabetes	Treatment with sodium–glucose cotransporter 2 (SGLT-2) inhibitors , may be appropriate for some adults with type 2 diabetes if metformin is contraindicated or not tolerated (see NICE's guidance on canagliflozin, dapagliflozin and empagliflozin as monotherapies for treating type 2 diabetes).	Treatment with combinations of medicines including sodium–glucose cotransporter 2 (SGLT-2) inhibitors , may be appropriate for some people with type 2 diabetes; see the NICE guidance on canagliflozin in combination therapy for treating type 2 diabetes, dapagliflozin in combination therapy for treating type 2 diabetes and empagliflozin in combination therapy for treating type 2 diabetes.	Review the continued need for other blood glucose lowering therapies .	Consider, as an alternative to NPH insulin, using insulin detemir or insulin glargine if: the person needs assistance from a carer or healthcare professional to inject insulin, and use of insulin detemir or insulin glargine would reduce the frequency of injections from twice to once daily or the person's lifestyle is restricted by recurrent symptomatic hypoglycaemic episodes or the person would otherwise need twice-daily NPH insulin injections in combination with oral glucose-lowering drugs.	Consider pre-mixed (biphasic) preparations that include short-acting insulin analogues, rather than pre-mixed (biphasic) preparations that include short-acting human insulin preparations, if: a person prefers injecting insulin immediately before a meal or hypoglycaemia is a problem or blood glucose levels rise markedly after meals.	Monitor adults with type 2 diabetes who are on pre-mixed (biphasic) insulin for the need for a further injection of short-acting insulin before meals or for a change to a basal bolus regimen with NPH insulin or insulin detemir or insulin glargine , if blood glucose control remains inadequate.	Think about a diagnosis of gastroparesis in adults with type 2 diabetes with erratic blood glucose control or unexplained gastric bloating or vomiting, taking into account possible alternative diagnoses 2009, amended 2015	The MHRA advised that healthcare professionals should test for raised ketones in people with ketoacidosis symptoms who are receiving an SGLT-2 inhibitor, even if their plasma glucose levels are near-normal.	
detemir	1	0.673	4	Consider, as an alternative to NPH insulin, using insulin detemir or insulin glargine if: the person needs assistance from a carer or healthcare professional to inject insulin, and use of insulin detemir or insulin glargine would reduce the frequency of injections from twice to once daily or the person's lifestyle is restricted by recurrent symptomatic hypoglycaemic episodes or the person would otherwise need twice-daily NPH insulin injections in combination with oral glucose-lowering drugs.	Consider switching to insulin detemir or insulin glargine from NPH insulin in adults with type 2 diabetes: who do not reach their target HbA1c because of significant hypoglycaemia or who experience significant hypoglycaemia on NPH insulin irrespective of the level of	Monitor adults with type 2 diabetes who are on a basal insulin regimen (NPH insulin, insulin detemir or insulin glargine ) for the need for short-acting insulin before meals (or a pre-mixed biphasic insulin preparation).	Monitor adults with type 2 diabetes who are on pre-mixed (biphasic) insulin for the need for a further injection of short-acting insulin before meals or for a change to a basal bolus regimen with NPH insulin or insulin detemir or insulin glargine , if blood glucose control remains inadequate.	
guidance	1	0.6489	32	The following guidance is based on the best available evidence	The full guideline gives details of the methods and the evidence used to develop the guidance.	DVLA guidance (At a glance guide to the current medical standards of fitness to drive) management of hypoglycaemia management of acute changes in plasma glucose control support from an appropriately trained and experienced healthcare professional.	Medicines and Healthcare products Regulatory Agency (MHRA) guidance (2017) warned that canagliflozin may increase the risk of lower-limb amputation (mainly toes) in people with type 2 diabetes	Medicines and Healthcare products Regulatory Agency (MHRA) guidance (2011) notes that cases of cardiac failure have been reported when pioglitazone was used in combination with insulin, especially in patients with risk factors for the development of cardiac failure	Medicines and Healthcare products Regulatory Agency (MHRA) guidance (2014) notes that domperidone is associated with a small increased risk of serious cardiac side effects	MHRA guidance and summaries of product characteristics	See the General Medical Council's Prescribing guidance: prescribing unlicensed medicines for further information.	The following guidance is based on the best available evidence	The full guideline gives details of the methods and the evidence used to develop the guidance.	DVLA guidance (At a glance guide to the current medical standards of fitness to drive) management of hypoglycaemia management of acute changes in plasma glucose control support from an appropriately trained and experienced healthcare professional.	Medicines and Healthcare products Regulatory Agency (MHRA) guidance (2017) warned that canagliflozin may increase the risk of lower-limb amputation (mainly toes) in people with type 2 diabetes	Medicines and Healthcare products Regulatory Agency (MHRA) guidance (2011) notes that cases of cardiac failure have been reported when pioglitazone was used in combination with insulin, especially in patients with risk factors for the development of cardiac failure	Medicines and Healthcare products Regulatory Agency (MHRA) guidance (2014) notes that domperidone is associated with a small increased risk of serious cardiac side effects	MHRA guidance and summaries of product characteristics	See the General Medical Council's Prescribing guidance: prescribing unlicensed medicines for further information.	Medicines and Healthcare products Regulatory Agency (MHRA) guidance (2011) advises that 'prescribers should review the safety and efficacy of pioglitazone in individuals after 3–6 months of treatment to ensure that only patients who are deriving benefit continue to be treated'.	For guidance on the primary and secondary prevention of cardiovascular disease in adults with type 2 diabetes, see the NICE guidelines on cardiovascular disease and myocardial infarction.	For guidance on HbA1c targets for women with type 2 diabetes who are pregnant or planning to become pregnant, see the NICE guideline on diabetes in pregnancy.	Last updated May 2017 safety (see Medicines and Healthcare products Regulatory Agency MHRA guidance) and tolerability of the drug treatment(s) the person's individual clinical circumstances, for example, comorbidities, risks from polypharmacy the person's individual preferences and needs the licensed indications or combinations available cost (if 2 drugs in the same class are appropriate, choose the option with the lowest acquisition cost).	Treatment with sodium–glucose cotransporter 2 (SGLT-2) inhibitors , may be appropriate for some adults with type 2 diabetes if metformin is contraindicated or not tolerated (see NICE's guidance on canagliflozin, dapagliflozin and empagliflozin as monotherapies for treating type 2 diabetes).	Treatment with combinations of medicines including sodium–glucose cotransporter 2 (SGLT-2) inhibitors , may be appropriate for some people with type 2 diabetes; see the NICE guidance on canagliflozin in combination therapy for treating type 2 diabetes, dapagliflozin in combination therapy for treating type 2 diabetes and empagliflozin in combination therapy for treating type 2 diabetes.	Treatment with combinations of medicines including SGLT-2 inhibitors , may be appropriate for some people with type 2 diabetes; see the NICE guidance on canagliflozin in combination therapy for treating type 2 diabetes, dapagliflozin in combination therapy for treating type 2 diabetes, dapagliflozin in triple therapy for treating type 2 diabetes and empagliflozin in combination therapy for treating type 2 diabetes.	Treatment with combinations of medicines including SGLT-2 inhibitors , may be appropriate for some people with type 2 diabetes; see the NICE guidance on canagliflozin in combination therapy for treating type 2 diabetes, dapagliflozin in combination therapy for treating type 2 diabetes and empagliflozin in combination therapy for treating type 2 diabetes.	For guidance on insulin delivery for adults with type 2 diabetes, see the insulin delivery section in the NICE guideline on type 1 diabetes.	For treating vomiting caused by gastroparesis in adults with type 2 diabetes: consider alternating use of erythomycin and metoclopramide consider domperidone only in exceptional circumstances (if domperidone is the only effective treatment) and in accordance with MHRA guidance.	For guidance on managing painful diabetic peripheral neuropathy in adults with type 2 diabetes, see the NICE guideline on neuropathic pain in adults.	For guidance on preventing and managing foot problems in adults with type 2 diabetes, see the NICE guideline on diabetic foot problems.	For guidance on managing kidney disease in adults with type 2 diabetes, see the	Medicines and Healthcare products Regulatory Agency (MHRA) guidance (2011) advises that 'prescribers should review the safety and efficacy of pioglitazone in individuals after 3–6 months of treatment to ensure that only patients who are deriving benefit continue to be treated'.	Medicines and Healthcare products Regulatory Agency (MHRA) guidance (2016) warned that serious, life-threatening, and fatal cases of diabetic ketoacidosis have been reported rarely in people taking an SGLT-2 inhibitor (a substantial proportion of the cases concerned off-label use in people with type 1 diabetes, which is not recommended)	The prescriber should follow relevant professional guidance, taking full responsibility for the decision	
combinations	0	0.6427	4	Last updated May 2017 safety (see Medicines and Healthcare products Regulatory Agency MHRA guidance) and tolerability of the drug treatment(s) the person's individual clinical circumstances, for example, comorbidities, risks from polypharmacy the person's individual preferences and needs the licensed indications or combinations available cost (if 2 drugs in the same class are appropriate, choose the option with the lowest acquisition cost).	Treatment with combinations of medicines including sodium–glucose cotransporter 2 (SGLT-2) inhibitors , may be appropriate for some people with type 2 diabetes; see the NICE guidance on canagliflozin in combination therapy for treating type 2 diabetes, dapagliflozin in combination therapy for treating type 2 diabetes and empagliflozin in combination therapy for treating type 2 diabetes.	Treatment with combinations of medicines including SGLT-2 inhibitors , may be appropriate for some people with type 2 diabetes; see the NICE guidance on canagliflozin in combination therapy for treating type 2 diabetes, dapagliflozin in combination therapy for treating type 2 diabetes, dapagliflozin in triple therapy for treating type 2 diabetes and empagliflozin in combination therapy for treating type 2 diabetes.	Treatment with combinations of medicines including SGLT-2 inhibitors , may be appropriate for some people with type 2 diabetes; see the NICE guidance on canagliflozin in combination therapy for treating type 2 diabetes, dapagliflozin in combination therapy for treating type 2 diabetes and empagliflozin in combination therapy for treating type 2 diabetes.	
