repaglinide	0	1.7143	4	Be aware that, if metformin is contraindicated or not tolerated, repaglinide is both clinically effective and cost effective in adults with type 2 diabetes	However, discuss with any person for whom repaglinide is being considered, that there is no licensed non-metformin-based combination containing repaglinide that can be offered at first intensification.	Be aware that, if metformin is contraindicated or not tolerated, repaglinide is both clinically effective and cost effective in adults with type 2 diabetes	However, discuss with any person for whom repaglinide is being considered, that there is no licensed non-metformin-based combination containing repaglinide that can be offered at first intensification.	
mmhg	0	1.6597	6	Last updated May 2017 pressure is confirmed as being consistently above 140 80 mmHg (or above 130 80 mmHg if there is kidney, eye or cerebrovascular damage).	Add medications if lifestyle advice does not reduce blood pressure to below 140 80 mmHg (below 130 80 mmHg if there is kidney, eye or cerebrovascular damage).	Last updated May 2017 pressure is confirmed as being consistently above 140 80 mmHg (or above 130 80 mmHg if there is kidney, eye or cerebrovascular damage).	Add medications if lifestyle advice does not reduce blood pressure to below 140 80 mmHg (below 130 80 mmHg if there is kidney, eye or cerebrovascular damage).	Repeat blood pressure measurements within: 1 month if blood pressure is higher than 150 90 mmHg 2 months if blood pressure is higher than 140 80 mmHg 2 months if blood pressure is higher than 130 80 mmHg and there is kidney, eye or cerebrovascular damage.	Monitor blood pressure every 1–2 months, and intensify therapy if the person is already on antihypertensive drug treatment, until the blood pressure is consistently below 140 80 mmHg (below 130 80 mmHg if there is kidney, eye or cerebrovascular damage).	
mmol	0	1.5822	7	Only continue GLP-1 mimetic therapy if the person with type 2 diabetes has had a beneficial metabolic response (a reduction of at least 11 mmol mol  percent in	HbA1c is 75 mmol mol  percent or higher), administered either: separately or as a pre-mixed (biphasic) human insulin preparation.	Only continue GLP-1 mimetic therapy if the person with type 2 diabetes has had a beneficial metabolic response (a reduction of at least 11 mmol mol  percent in	HbA1c is 75 mmol mol  percent or higher), administered either: separately or as a pre-mixed (biphasic) human insulin preparation.	For adults with type 2 diabetes managed either by lifestyle and diet, or by lifestyle and diet combined with a single drug not associated with hypoglycaemia, support the person to aim for an HbA1c level of 48 mmol mol ( percent)	For adults on a drug associated with hypoglycaemia, support the person to aim for an HbA1c level of 53 mmol mol ( percent).	In adults with type 2 diabetes, if HbA1c levels are not adequately controlled by a single drug and rise to 58 mmol mol ( percent) or higher: reinforce advice about diet, lifestyle and adherence to drug treatment and support the person to aim for an HbA1c level of 53 mmol mol ( percent) and intensify drug treatment.	
mol	1	1.5822	12	Only continue GLP-1 mimetic therapy if the person with type 2 diabetes has had a beneficial metabolic response (a reduction of at least 11 mmol mol  percent in	HbA1c is 75 mmol mol  percent or higher), administered either: separately or as a pre-mixed (biphasic) human insulin preparation.	Refer to an ophthalmologist in accordance with the National Screening	Only continue GLP-1 mimetic therapy if the person with type 2 diabetes has had a beneficial metabolic response (a reduction of at least 11 mmol mol  percent in	HbA1c is 75 mmol mol  percent or higher), administered either: separately or as a pre-mixed (biphasic) human insulin preparation.	Refer to an ophthalmologist in accordance with the National Screening	For adults with type 2 diabetes managed either by lifestyle and diet, or by lifestyle and diet combined with a single drug not associated with hypoglycaemia, support the person to aim for an HbA1c level of 48 mmol mol ( percent)	For adults on a drug associated with hypoglycaemia, support the person to aim for an HbA1c level of 53 mmol mol ( percent).	In adults with type 2 diabetes, if HbA1c levels are not adequately controlled by a single drug and rise to 58 mmol mol ( percent) or higher: reinforce advice about diet, lifestyle and adherence to drug treatment and support the person to aim for an HbA1c level of 53 mmol mol ( percent) and intensify drug treatment.	Depending on the findings, follow structured eye screening by: routine review in 1 year or earlier review or referral to an ophthalmologist.	Arrange emergency review by an ophthalmologist for: sudden loss of vision rubeosis iridis pre-retinal or vitreous haemorrhage retinal detachment.	Arrange rapid review by an ophthalmologist for new vessel formation.	
percent	0	1.5822	10	Only continue GLP-1 mimetic therapy if the person with type 2 diabetes has had a beneficial metabolic response (a reduction of at least 11 mmol mol  percent in	HbA1c and a weight loss of at least 3percent of initial body weight in 6 months).	HbA1c is 75 mmol mol  percent or higher), administered either: separately or as a pre-mixed (biphasic) human insulin preparation.	Only continue GLP-1 mimetic therapy if the person with type 2 diabetes has had a beneficial metabolic response (a reduction of at least 11 mmol mol  percent in	HbA1c and a weight loss of at least 3percent of initial body weight in 6 months).	HbA1c is 75 mmol mol  percent or higher), administered either: separately or as a pre-mixed (biphasic) human insulin preparation.	For adults with type 2 diabetes who are overweight, set an initial body weight loss target of 5–10percent	For adults with type 2 diabetes managed either by lifestyle and diet, or by lifestyle and diet combined with a single drug not associated with hypoglycaemia, support the person to aim for an HbA1c level of 48 mmol mol ( percent)	For adults on a drug associated with hypoglycaemia, support the person to aim for an HbA1c level of 53 mmol mol ( percent).	In adults with type 2 diabetes, if HbA1c levels are not adequately controlled by a single drug and rise to 58 mmol mol ( percent) or higher: reinforce advice about diet, lifestyle and adherence to drug treatment and support the person to aim for an HbA1c level of 53 mmol mol ( percent) and intensify drug treatment.	
non-insulin	0	1.5	3	Treatment with a single non-insulin blood glucose lowering therapy (monotherapy)	Treatment with 2 non-insulin blood glucose lowering therapies in combination (dual therapy)	Treatment with either 3 non-insulin blood glucose lowering therapies in combination (triple therapy) or any treatment combination containing insulin	
preparations	1	1.5	1	Consider pre-mixed (biphasic) preparations that include short-acting insulin analogues, rather than pre-mixed (biphasic) preparations that include short-acting human insulin preparations, if: a person prefers injecting insulin immediately before a meal or hypoglycaemia is a problem or blood glucose levels rise markedly after meals.	
smoking	1	1.5	1	For recommendations on lifestyle advice, see the NICE guidelines on: preventing excess weight gain, weight management, obesity, physical activity, smoking: brief interventions and referrals, stop smoking services, smoking: harm reduction, and smoking: acute, maternity and mental health services.	
treatment(s)	1	1.5	2	Base the choice of drug treatment(s) on: the effectiveness of the drug treatment(s) in terms of metabolic response	Last updated May 2017 safety (see Medicines and Healthcare products Regulatory Agency MHRA guidance) and tolerability of the drug treatment(s) the person's individual clinical circumstances, for example, comorbidities, risks from polypharmacy the person's individual preferences and needs the licensed indications or combinations available cost (if 2 drugs in the same class are appropriate, choose the option with the lowest acquisition cost).	
pressure	0	1.4621	17	Blood pressure management	Last updated May 2017 pressure is confirmed as being consistently above 140 80 mmHg (or above 130 80 mmHg if there is kidney, eye or cerebrovascular damage).	Add medications if lifestyle advice does not reduce blood pressure to below 140 80 mmHg (below 130 80 mmHg if there is kidney, eye or cerebrovascular damage).	If the person's blood pressure is not reduced to the individually agreed target with first-line therapy, add a calcium-channel blocker or a diuretic (usually a thiazide or thiazide-related diuretic)	If the person's blood pressure is not reduced to the individually agreed target with triple therapy, add an alpha-blocker, a beta-blocker or a potassium-sparing diuretic (the last with caution if the person is already taking an ACE inhibitor or an angiotensin II-receptor antagonist).	Monitor the blood pressure of a person who has attained and consistently remained at his or her blood pressure target every 4–6 months	Blood pressure management	Last updated May 2017 pressure is confirmed as being consistently above 140 80 mmHg (or above 130 80 mmHg if there is kidney, eye or cerebrovascular damage).	Add medications if lifestyle advice does not reduce blood pressure to below 140 80 mmHg (below 130 80 mmHg if there is kidney, eye or cerebrovascular damage).	If the person's blood pressure is not reduced to the individually agreed target with first-line therapy, add a calcium-channel blocker or a diuretic (usually a thiazide or thiazide-related diuretic)	If the person's blood pressure is not reduced to the individually agreed target with triple therapy, add an alpha-blocker, a beta-blocker or a potassium-sparing diuretic (the last with caution if the person is already taking an ACE inhibitor or an angiotensin II-receptor antagonist).	Monitor the blood pressure of a person who has attained and consistently remained at his or her blood pressure target every 4–6 months	Measure blood pressure at least annually in an adult with type 2 diabetes without previously diagnosed hypertension or renal disease	For an adult with type 2 diabetes on antihypertensive drug treatment when diabetes is diagnosed, review blood pressure control and medications used.	Repeat blood pressure measurements within: 1 month if blood pressure is higher than 150 90 mmHg 2 months if blood pressure is higher than 140 80 mmHg 2 months if blood pressure is higher than 130 80 mmHg and there is kidney, eye or cerebrovascular damage.	Monitor blood pressure every 1–2 months, and intensify therapy if the person is already on antihypertensive drug treatment, until the blood pressure is consistently below 140 80 mmHg (below 130 80 mmHg if there is kidney, eye or cerebrovascular damage).	Check for possible adverse effects of antihypertensive drug treatment – including the risks from unnecessarily low blood pressure.	
education	1	1.4425	14	Patient education	It is delivered by trained educators who have an understanding of educational theory appropriate to the age and needs of the person, and who are trained and competent to deliver the principles and content of the programme.	Offer group education programmes as the preferred option	Ensure that the patient-education programmes available meet the cultural, linguistic, cognitive and literacy needs within the local area.	Patient education	It is delivered by trained educators who have an understanding of educational theory appropriate to the age and needs of the person, and who are trained and competent to deliver the principles and content of the programme.	Offer group education programmes as the preferred option	Ensure that the patient-education programmes available meet the cultural, linguistic, cognitive and literacy needs within the local area.	Offer structured education to adults with type 2 diabetes and or their family members or carers (as appropriate) at and around the time of diagnosis, with	Explain to people and their carers that structured education is an integral part of diabetes care.	Ensure that any structured education programme for adults with type 2 diabetes includes the following components:	Ensure the patient-education programme provides the necessary resources to support the educators, and that educators are properly trained and given time to develop and maintain their skills.	Provide an alternative of equal standard for a person unable or unwilling to participate in group education.	Ensure that all members of the diabetes healthcare team are familiar with the patient-education programmes available locally, that these programmes are integrated with the rest of the care pathway, and that adults with type 2 diabetes and their family members or carers (as appropriate) have the opportunity to contribute to the design and provision of local programmes.	
failure	1	1.4383	8	Pioglitazone is associated with an increased risk of heart failure, bladder cancer and bone fracture	Pioglitazone is associated with an increased risk of heart failure, bladder cancer and bone fracture	Medicines and Healthcare products Regulatory Agency (MHRA) guidance (2011) notes that cases of cardiac failure have been reported when pioglitazone was used in combination with insulin, especially in patients with risk factors for the development of cardiac failure	Pioglitazone is associated with an increased risk of heart failure, bladder cancer and bone fracture	Pioglitazone is associated with an increased risk of heart failure, bladder cancer and bone fracture	Medicines and Healthcare products Regulatory Agency (MHRA) guidance (2011) notes that cases of cardiac failure have been reported when pioglitazone was used in combination with insulin, especially in patients with risk factors for the development of cardiac failure	In adults with type 2 diabetes, do not offer or continue pioglitazone if they have any of the following: heart failure or history of heart failure	It advises that if the combination is used, people should be observed for signs and symptoms of heart failure, weight gain, and oedema	
heart	1	1.4383	6	Pioglitazone is associated with an increased risk of heart failure, bladder cancer and bone fracture	Pioglitazone is associated with an increased risk of heart failure, bladder cancer and bone fracture	Pioglitazone is associated with an increased risk of heart failure, bladder cancer and bone fracture	Pioglitazone is associated with an increased risk of heart failure, bladder cancer and bone fracture	In adults with type 2 diabetes, do not offer or continue pioglitazone if they have any of the following: heart failure or history of heart failure	It advises that if the combination is used, people should be observed for signs and symptoms of heart failure, weight gain, and oedema	
factors	0	1.3683	5	Medicines and Healthcare products Regulatory Agency (MHRA) guidance (2011) notes that cases of cardiac failure have been reported when pioglitazone was used in combination with insulin, especially in patients with risk factors for the development of cardiac failure	Medicines and Healthcare products Regulatory Agency (MHRA) guidance (2011) notes that cases of cardiac failure have been reported when pioglitazone was used in combination with insulin, especially in patients with risk factors for the development of cardiac failure	Known risk factors for these conditions, including increased age, should be carefully evaluated before treatment: see the manufacturers' summaries of product characteristics for details	Assess, educate and support men with type 2 diabetes who have problematic erectile dysfunction, addressing contributory factors such as cardiovascular disease as well as possible treatment options.	Known risk factors for these conditions, including increased age, should be carefully evaluated before treatment: see the manufacturers' summaries of product characteristics for details	
disease	1	1.362	10	Diabetic kidney disease	Eye disease	Diabetic kidney disease	Eye disease	Measure blood pressure at least annually in an adult with type 2 diabetes without previously diagnosed hypertension or renal disease	Do not offer antiplatelet therapy (aspirin or clopidogrel) for adults with type 2 diabetes without cardiovascular disease.	For guidance on the primary and secondary prevention of cardiovascular disease in adults with type 2 diabetes, see the NICE guidelines on cardiovascular disease and myocardial infarction.	For guidance on managing kidney disease in adults with type 2 diabetes, see the	NICE guideline on chronic kidney disease in adults.	Assess, educate and support men with type 2 diabetes who have problematic erectile dysfunction, addressing contributory factors such as cardiovascular disease as well as possible treatment options.	
neuropathy	0	1.36	8	Painful diabetic neuropathy	Painful diabetic neuropathy	For guidance on managing painful diabetic peripheral neuropathy in adults with type 2 diabetes, see the NICE guideline on neuropathic pain in adults.	Autonomic neuropathy	Think about the possibility of autonomic neuropathy affecting the gut in adults with type 2 diabetes who have unexplained diarrhoea that happens particularly at night 2009, amended 2015	When using tricyclic drugs and antihypertensive drug treatments in adults with type 2 diabetes who have autonomic neuropathy, be aware of the increased likelihood of side effects such as orthostatic hypotension.	Investigate the possibility of autonomic neuropathy affecting the bladder in adults with type 2 diabetes who have unexplained bladder-emptying problems.	In managing autonomic neuropathy symptoms, include specific interventions indicated by the manifestations (for example, for abnormal sweating or nocturnal diarrhoea).	
