mmhg	0	1.6	2	Add medications if lifestyle advice does not reduce blood pressure to below 140 80 mmHg (below 130 80 mmHg if there is kidney, eye or cerebrovascular damage).	Monitor blood pressure every 1–2 months, and intensify therapy if the person is already on antihypertensive drug treatment, until the blood pressure is consistently below 140 80 mmHg (below 130 80 mmHg if there is kidney, eye or cerebrovascular damage).	
mol	0	1.5	7	For adults with type 2 diabetes managed either by lifestyle and diet, or by lifestyle and diet combined with a single drug not associated with hypoglycaemia, support the person to aim for an HbA1c level of 48 mmol mol(6.5percent).	For adults on a drug associated with hypoglycaemia, support the person to aim for an HbA1c level of 53 mmol mol (7.0percent).	In adults with type 2 diabetes, if HbA1c levels are not adequately controlled by a single drug and rise to 58 mmol mol (7.5percent) or higher: reinforce advice about diet, lifestyle and adherence to drug treatment and support the person to aim for an HbA1c level of 53 mmol mol (7.0percent) and intensify drug treatment.	Depending on the findings, follow structured eye screening by: routine review in 1 year or earlier review or referral to an ophthalmologist.	Arrange emergency review by an ophthalmologist for: sudden loss of vision rubeosis iridis pre-retinal or vitreous haemorrhage retinal detachment.	Arrange rapid review by an ophthalmologist for new vessel formation.	Refer to an ophthalmologist in accordance with the National Screening Committee criteria and timelines if any of these features are present: referable maculopathy: exudate or retinal thickening within 1 disc diameter of the centre of the fovea circinate or group of exudates within the macula (the macula is defined here as a circle centred on the fovea, with a diameter the distance between the temporal border of the optic disc and the fovea) any microaneurysm or haemorrhage within 1 disc diameter of the centre of the fovea, only if associated with deterioration of best visual acuity to 6 12 or worse. referable pre-proliferative retinopathy (if cotton wool spots are present, look carefully for the following features, but cotton wool spots themselves do not define pre-proliferative retinopathy): any venous beading any venous reduplication any intraretinal microvascular abnormalities multiple deep, round or blot haemorrhages. any large, sudden unexplained drop in visual acuity.	
smoking	1	1.5	1	For recommendations on lifestyle advice, see the NICE guidelines on: preventing excess weight gain, weight management, obesity, physical activity, smoking: brief interventions and referrals, stop smoking services, smoking: harm reduction, and smoking: acute, maternity and mental health services.	
insulin	0	1.4259	2	Reducing the risk of hypoglycaemia should be a particular aim for a person using insulin or an insulin secretagogue.	Do not routinely offer self-monitoring of blood glucose levels for adults with type 2 diabetes unless: the person is on insulin or there is evidence of hypoglycaemic episodes or the person is on oral medication that may increase their risk of hypoglycaemia while driving or operating machinery or the person is pregnant, or is planning to become pregnant.	
reasons	0	1.339	3	Be aware that there are other possible reasons for a low HbA1c level, for example, deteriorating renal function or sudden weight loss.	Be aware that there are other possible reasons for a low HbA1c level, for example, deteriorating renal function or sudden weight loss.	Explain the reasons for, and success of, eye screening systems to adults with type 2 diabetes, so that attendance is not reduced by lack of knowledge or fear of outcome.	
degrees	0	1.3333	1	Remember that lesser degrees of weight loss may still be of benefit, and that larger degrees of weight loss in the longer term will have advantageous metabolic impact.	
foot	0	1.3333	1	For guidance on preventing and managing foot problems in adults with type 2 diabetes, see the NICE guideline on diabetic foot problems.	
function	0	1.3333	6	Be aware that there are other possible reasons for a low HbA1c level, for example, deteriorating renal function or sudden weight loss.	Be aware that there are other possible reasons for a low HbA1c level, for example, deteriorating renal function or sudden weight loss.	Offer men with type 2 diabetes the opportunity to discuss erectile dysfunction as part of their annual review.	Assess, educate and support men with type 2 diabetes who have problematic erectile dysfunction, addressing contributory factors such as cardiovascular disease as well as possible treatment options.	Consider a phosphodiesterase-5 inhibitor to treat problematic erectile dysfunction in men with type 2 diabetes, initially choosing the drug with the lowest acquisition cost and taking into account any contraindications.	Following discussion, refer men with type 2 diabetes to a service offering other medical, surgical or psychological management of erectile dysfunction if treatment (including a phosphodiesterase-5 inhibitor, as appropriate) has been unsuccessful.	
mmol	0	1.3275	3	For adults with type 2 diabetes managed either by lifestyle and diet, or by lifestyle and diet combined with a single drug not associated with hypoglycaemia, support the person to aim for an HbA1c level of 48 mmol mol(6.5percent).	For adults on a drug associated with hypoglycaemia, support the person to aim for an HbA1c level of 53 mmol mol (7.0percent).	In adults with type 2 diabetes, if HbA1c levels are not adequately controlled by a single drug and rise to 58 mmol mol (7.5percent) or higher: reinforce advice about diet, lifestyle and adherence to drug treatment and support the person to aim for an HbA1c level of 53 mmol mol (7.0percent) and intensify drug treatment.	
programme	0	1.3127	7	Ensure that any structured education programme for adults with type 2 diabetes includes the following components: It is evidence-based, and suits the needs of the person. It has specific aims and learning objectives, and supports the person and their family members and carers in developing attitudes, beliefs, knowledge and skills to self-manage diabetes. It has a structured curriculum that is theory-driven, evidence-based and resource-effective, has supporting materials, and is written down. It is delivered by trained educators who have an understanding of educational theory appropriate to the age and needs of the person, and who are trained and competent to deliver the principles and content of the programme. It is quality assured, and reviewed by trained, competent, independent assessors who measure it against criteria that ensure consistency. The outcomes are audited regularly.	Ensure the patient-education programme provides the necessary resources to support the educators, and that educators are properly trained and given time to develop and maintain their skills.	Offer group education programmes as the preferred option. Provide an alternative of equal standard for a person unable or unwilling to participate in group education.	Ensure that the patient-education programmes available meet the cultural, linguistic, cognitive and literacy needs within the local area.	Ensure that all members of the diabetes healthcare team are familiar with the patient-education programmes available locally, that these programmes are integrated with the rest of the care pathway, and that adults with type 2 diabetes and their family members or carers (as appropriate) have the opportunity to contribute to the design and provision of local programmes.	Use a quality-assured digital retinal photography programme using appropriately trained staff.	Perform visual acuity testing as a routine part of eye screening programmes.	
problems	0	1.3109	3	Make changes only if there is poor control or if current drug treatment is not appropriate because of microvascular complications or metabolic problems.	Investigate the possibility of autonomic neuropathy affecting the bladder in adults with type 2 diabetes who have unexplained bladder-emptying problems.	For guidance on preventing and managing foot problems in adults with type 2 diabetes, see the NICE guideline on diabetic foot problems.	
members	0	1.2934	3	Offer structured education to adults with type 2 diabetes and or their family members or carers (as appropriate) at and around the time of diagnosis, with annual reinforcement and review.	Ensure that any structured education programme for adults with type 2 diabetes includes the following components: It is evidence-based, and suits the needs of the person. It has specific aims and learning objectives, and supports the person and their family members and carers in developing attitudes, beliefs, knowledge and skills to self-manage diabetes. It has a structured curriculum that is theory-driven, evidence-based and resource-effective, has supporting materials, and is written down. It is delivered by trained educators who have an understanding of educational theory appropriate to the age and needs of the person, and who are trained and competent to deliver the principles and content of the programme. It is quality assured, and reviewed by trained, competent, independent assessors who measure it against criteria that ensure consistency. The outcomes are audited regularly.	Ensure that all members of the diabetes healthcare team are familiar with the patient-education programmes available locally, that these programmes are integrated with the rest of the care pathway, and that adults with type 2 diabetes and their family members or carers (as appropriate) have the opportunity to contribute to the design and provision of local programmes.	
referral	0	1.2914	4	For recommendations on lifestyle advice, see the NICE guidelines on: preventing excess weight gain, weight management, obesity, physical activity, smoking: brief interventions and referrals, stop smoking services, smoking: harm reduction, and smoking: acute, maternity and mental health services.	If gastroparesis is suspected, consider referral to specialist services if: the differential diagnosis is in doubt or persistent or severe vomiting occurs.	Perform screening as soon as possible and no later than 3 months from referral.	Depending on the findings, follow structured eye screening by: routine review in 1 year or earlier review or referral to an ophthalmologist.	
diet	1	1.2755	5	Provide dietary advice in a form sensitive to the person's needs, culture and beliefs, being sensitive to their willingness to change and the effects on their quality of life.	Encourage high-fibre, low-glycaemic-index sources of carbohydrate in the diet, such as fruit, vegetables, wholegrains and pulses; include low-fat dairy products and oily fish; and control the intake of foods containing saturated and trans fatty acids.	Integrate dietary advice with a personalised diabetes management plan, including other aspects of lifestyle modification, such as increasing physical activity and losing weight.	For adults with type 2 diabetes managed either by lifestyle and diet, or by lifestyle and diet combined with a single drug not associated with hypoglycaemia, support the person to aim for an HbA1c level of 48 mmol mol(6.5percent).	In adults with type 2 diabetes, if HbA1c levels are not adequately controlled by a single drug and rise to 58 mmol mol (7.5percent) or higher: reinforce advice about diet, lifestyle and adherence to drug treatment and support the person to aim for an HbA1c level of 53 mmol mol (7.0percent) and intensify drug treatment.	
perform	0	1.2745	2	Perform screening as soon as possible and no later than 3 months from referral.	Perform visual acuity testing as a routine part of eye screening programmes.	
programmes	0	1.2634	4	Offer group education programmes as the preferred option. Provide an alternative of equal standard for a person unable or unwilling to participate in group education.	Ensure that the patient-education programmes available meet the cultural, linguistic, cognitive and literacy needs within the local area.	Ensure that all members of the diabetes healthcare team are familiar with the patient-education programmes available locally, that these programmes are integrated with the rest of the care pathway, and that adults with type 2 diabetes and their family members or carers (as appropriate) have the opportunity to contribute to the design and provision of local programmes.	Perform visual acuity testing as a routine part of eye screening programmes.	
loss	1	1.2622	5	For adults with type 2 diabetes who are overweight, set an initial body weight loss target of 5–10percent.	Remember that lesser degrees of weight loss may still be of benefit, and that larger degrees of weight loss in the longer term will have advantageous metabolic impact.	Be aware that there are other possible reasons for a low HbA1c level, for example, deteriorating renal function or sudden weight loss.	Be aware that there are other possible reasons for a low HbA1c level, for example, deteriorating renal function or sudden weight loss.	Arrange emergency review by an ophthalmologist for: sudden loss of vision rubeosis iridis pre-retinal or vitreous haemorrhage retinal detachment.	
disease	0	1.2564	4	Measure blood pressure at least annually in an adult with type 2 diabetes without previously diagnosed hypertension or renal disease.	Do not offer antiplatelet therapy (aspirin or clopidogrel) for adults with type 2 diabetes without cardiovascular disease.	For guidance on managing kidney disease in adults with type 2 diabetes, see the NICE guideline on chronic kidney disease in adults.	Assess, educate and support men with type 2 diabetes who have problematic erectile dysfunction, addressing contributory factors such as cardiovascular disease as well as possible treatment options.	
educators	0	1.2562	2	Ensure that any structured education programme for adults with type 2 diabetes includes the following components: It is evidence-based, and suits the needs of the person. It has specific aims and learning objectives, and supports the person and their family members and carers in developing attitudes, beliefs, knowledge and skills to self-manage diabetes. It has a structured curriculum that is theory-driven, evidence-based and resource-effective, has supporting materials, and is written down. It is delivered by trained educators who have an understanding of educational theory appropriate to the age and needs of the person, and who are trained and competent to deliver the principles and content of the programme. It is quality assured, and reviewed by trained, competent, independent assessors who measure it against criteria that ensure consistency. The outcomes are audited regularly.	Ensure the patient-education programme provides the necessary resources to support the educators, and that educators are properly trained and given time to develop and maintain their skills.	
level	1	1.2512	9	For adults with type 2 diabetes managed either by lifestyle and diet, or by lifestyle and diet combined with a single drug not associated with hypoglycaemia, support the person to aim for an HbA1c level of 48 mmol mol(6.5percent).	For adults on a drug associated with hypoglycaemia, support the person to aim for an HbA1c level of 53 mmol mol (7.0percent).	In adults with type 2 diabetes, if HbA1c levels are not adequately controlled by a single drug and rise to 58 mmol mol (7.5percent) or higher: reinforce advice about diet, lifestyle and adherence to drug treatment and support the person to aim for an HbA1c level of 53 mmol mol (7.0percent) and intensify drug treatment.	If adults with type 2 diabetes achieve an HbA1c level that is lower than their target and they are not experiencing hypoglycaemia, encourage them to maintain it.	Be aware that there are other possible reasons for a low HbA1c level, for example, deteriorating renal function or sudden weight loss.	If adults with type 2 diabetes achieve an HbA1c level that is lower than their target and they are not experiencing hypoglycaemia, encourage them to maintain it.	Be aware that there are other possible reasons for a low HbA1c level, for example, deteriorating renal function or sudden weight loss.	Do not routinely offer self-monitoring of blood glucose levels for adults with type 2 diabetes unless: the person is on insulin or there is evidence of hypoglycaemic episodes or the person is on oral medication that may increase their risk of hypoglycaemia while driving or operating machinery or the person is pregnant, or is planning to become pregnant.	Consider short-term self-monitoring of blood glucose levels in adults with type 2 diabetes (and review treatment as necessary): when starting treatment with oral or intravenous corticosteroids or to confirm suspected hypoglycaemia.	
arrange	1	1.243	3	Arrange repeat structured eye screening annually.	Arrange emergency review by an ophthalmologist for: sudden loss of vision rubeosis iridis pre-retinal or vitreous haemorrhage retinal detachment.	Arrange rapid review by an ophthalmologist for new vessel formation.	
circumstances	0	1.243	3	Adopt an individualised approach to diabetes care that is tailored to the needs and circumstances of adults with type 2 diabetes, taking into account their personal preferences, comorbidities, risks from polypharmacy, and their ability to benefit from long-term interventions because of reduced life expectancy.	Reassess the person's needs and circumstances at each review and think about whether to stop any medicines that are not effective.	For treating vomiting caused by gastroparesis in adults with type 2 diabetes: consider alternating use of erythomycin12 and metoclopramide13 consider domperidone11 only in exceptional circumstances (if domperidone is the only effective treatment) and in accordance with MHRA guidance.	
control	0	1.243	5	Encourage high-fibre, low-glycaemic-index sources of carbohydrate in the diet, such as fruit, vegetables, wholegrains and pulses; include low-fat dairy products and oily fish; and control the intake of foods containing saturated and trans fatty acids.	For an adult with type 2 diabetes on antihypertensive drug treatment when diabetes is diagnosed, review blood pressure control and medications used.	Make changes only if there is poor control or if current drug treatment is not appropriate because of microvascular complications or metabolic problems.	In adults with type 2 diabetes, if HbA1c levels are not adequately controlled by a single drug and rise to 58 mmol mol (7.5percent) or higher: reinforce advice about diet, lifestyle and adherence to drug treatment and support the person to aim for an HbA1c level of 53 mmol mol (7.0percent) and intensify drug treatment.	Think about a diagnosis of gastroparesis in adults with type 2 diabetes with erratic blood glucose control or unexplained gastric bloating or vomiting, taking into account possible alternative diagnoses.	
diuretic	1	1.243	4	The first-line antihypertensive drug treatment for a person of African or Caribbean family origin should be an ACE inhibitor plus either a diuretic or a generic calcium-channel blocker.	If the person's blood pressure is not reduced to the individually agreed target with first-line therapy, add a calcium-channel blocker or a diuretic (usually a thiazide or thiazide-related diuretic).	Add the other drug (that is, the calcium-channel blocker or diuretic) if the target is not reached with dual therapy.	If the person's blood pressure is not reduced to the individually agreed target with triple therapy, add an alpha-blocker, a beta-blocker or a potassium-sparing diuretic (the last with caution if the person is already taking an ACE inhibitor or an angiotensin II-receptor antagonist).	
evidence	0	1.243	4	Ensure that any structured education programme for adults with type 2 diabetes includes the following components: It is evidence-based, and suits the needs of the person. It has specific aims and learning objectives, and supports the person and their family members and carers in developing attitudes, beliefs, knowledge and skills to self-manage diabetes. It has a structured curriculum that is theory-driven, evidence-based and resource-effective, has supporting materials, and is written down. It is delivered by trained educators who have an understanding of educational theory appropriate to the age and needs of the person, and who are trained and competent to deliver the principles and content of the programme. It is quality assured, and reviewed by trained, competent, independent assessors who measure it against criteria that ensure consistency. The outcomes are audited regularly.	Do not routinely offer self-monitoring of blood glucose levels for adults with type 2 diabetes unless: the person is on insulin or there is evidence of hypoglycaemic episodes or the person is on oral medication that may increase their risk of hypoglycaemia while driving or operating machinery or the person is pregnant, or is planning to become pregnant.	For adults with type 2 diabetes who have vomiting caused by gastroparesis, explain that: there is not strong evidence that any available antiemetic therapy is effective some people have had benefit with domperidone11, erythromycin12 or metoclopramide13.	the strongest evidence for effectiveness is for domperidone11, but prescribers must take into account its safety profile, in particular its cardiac risk and potential interactions with other medicines.	
foods	0	1.243	3	Encourage high-fibre, low-glycaemic-index sources of carbohydrate in the diet, such as fruit, vegetables, wholegrains and pulses; include low-fat dairy products and oily fish; and control the intake of foods containing saturated and trans fatty acids.	Advise adults with type 2 diabetes that limited substitution of sucrose-containing foods for other carbohydrate in the meal plan is allowable, but that they should take care to avoid excess energy intake.	Discourage the use of foods marketed specifically for people with diabetes.	
intake	0	1.243	3	Encourage high-fibre, low-glycaemic-index sources of carbohydrate in the diet, such as fruit, vegetables, wholegrains and pulses; include low-fat dairy products and oily fish; and control the intake of foods containing saturated and trans fatty acids.	Individualise recommendations for carbohydrate and alcohol intake, and meal patterns.	Advise adults with type 2 diabetes that limited substitution of sucrose-containing foods for other carbohydrate in the meal plan is allowable, but that they should take care to avoid excess energy intake.	
life	0	1.243	10	Adopt an individualised approach to diabetes care that is tailored to the needs and circumstances of adults with type 2 diabetes, taking into account their personal preferences, comorbidities, risks from polypharmacy, and their ability to benefit from long-term interventions because of reduced life expectancy.	Provide dietary advice in a form sensitive to the person's needs, culture and beliefs, being sensitive to their willingness to change and the effects on their quality of life.	Integrate dietary advice with a personalised diabetes management plan, including other aspects of lifestyle modification, such as increasing physical activity and losing weight.	For recommendations on lifestyle advice, see the NICE guidelines on: preventing excess weight gain, weight management, obesity, physical activity, smoking: brief interventions and referrals, stop smoking services, smoking: harm reduction, and smoking: acute, maternity and mental health services.	Offer and reinforce preventive lifestyle advice.	Add medications if lifestyle advice does not reduce blood pressure to below 140 80 mmHg (below 130 80 mmHg if there is kidney, eye or cerebrovascular damage).	Encourage them to achieve the target and maintain it unless any resulting adverse effects (including hypoglycaemia), or their efforts to achievetheir target, impair their quality of life.	For adults with type 2 diabetes managed either by lifestyle and diet, or by lifestyle and diet combined with a single drug not associated with hypoglycaemia, support the person to aim for an HbA1c level of 48 mmol mol(6.5percent).	In adults with type 2 diabetes, if HbA1c levels are not adequately controlled by a single drug and rise to 58 mmol mol (7.5percent) or higher: reinforce advice about diet, lifestyle and adherence to drug treatment and support the person to aim for an HbA1c level of 53 mmol mol (7.0percent) and intensify drug treatment.	Refer to an ophthalmologist in accordance with the National Screening Committee criteria and timelines if any of these features are present: referable maculopathy: exudate or retinal thickening within 1 disc diameter of the centre of the fovea circinate or group of exudates within the macula (the macula is defined here as a circle centred on the fovea, with a diameter the distance between the temporal border of the optic disc and the fovea) any microaneurysm or haemorrhage within 1 disc diameter of the centre of the fovea, only if associated with deterioration of best visual acuity to 6 12 or worse. referable pre-proliferative retinopathy (if cotton wool spots are present, look carefully for the following features, but cotton wool spots themselves do not define pre-proliferative retinopathy): any venous beading any venous reduplication any intraretinal microvascular abnormalities multiple deep, round or blot haemorrhages. any large, sudden unexplained drop in visual acuity.	
