general population	1	1.1799	1	Emphasise advice on healthy balanced eating that is applicable to the general population when providing advice to adults with type 2 diabetes	
healthy balanced	0	1.1799	1	Emphasise advice on healthy balanced eating that is applicable to the general population when providing advice to adults with type 2 diabetes	
low-fat dairy	0	1.1799	1	Encourage high-fibre, low-glycaemic-index sources of carbohydrate in the diet, such as fruit, vegetables, wholegrains and pulses; include low-fat dairy products and oily fish; and control the intake of foods containing saturated and trans fatty acids.	
low-glycaemic-index sources	0	1.1799	1	Encourage high-fibre, low-glycaemic-index sources of carbohydrate in the diet, such as fruit, vegetables, wholegrains and pulses; include low-fat dairy products and oily fish; and control the intake of foods containing saturated and trans fatty acids.	
oily fish	0	1.1799	1	Encourage high-fibre, low-glycaemic-index sources of carbohydrate in the diet, such as fruit, vegetables, wholegrains and pulses; include low-fat dairy products and oily fish; and control the intake of foods containing saturated and trans fatty acids.	
trans fatty	0	1.1799	1	Encourage high-fibre, low-glycaemic-index sources of carbohydrate in the diet, such as fruit, vegetables, wholegrains and pulses; include low-fat dairy products and oily fish; and control the intake of foods containing saturated and trans fatty acids.	
oral medication	0	1.1332	1	Do not routinely offer self-monitoring of blood glucose levels for adults with type 2 diabetes unless: the person is on insulin or there is evidence of hypoglycaemic episodes or the person is on oral medication that may increase their risk of hypoglycaemia while driving or operating machinery or	
adverse effects	0	1.1301	6	When prescribing pioglitazone, exercise particular caution if the person is at high risk of the adverse effects of the drug	When prescribing pioglitazone, exercise particular caution if the person is at high risk of the adverse effects of the drug	When prescribing pioglitazone, exercise particular caution if the person is at high risk of the adverse effects of the drug	When prescribing pioglitazone, exercise particular caution if the person is at high risk of the adverse effects of the drug	Check for possible adverse effects of antihypertensive drug treatment – including the risks from unnecessarily low blood pressure.	Encourage them to achieve the target and maintain it unless any resulting adverse effects (including hypoglycaemia), or their efforts to achieve their target, impair their quality of life.	
initial drug	0	1.1236	6	Initial drug treatment	Initial drug treatment	Offer standard-release metformin as the initial drug treatment for adults with type 2 diabetes.	In adults with type 2 diabetes, if metformin is contraindicated or not tolerated, consider initial drug treatment with: a dipeptidyl peptidase-4 (DPP-4) inhibitor or pioglitazone or a sulfonylurea.	In adults with type 2 diabetes, if initial drug treatment with metformin has not continued to control HbA1c to below the person's individually agreed threshold for intensification, consider dual therapy with: metformin and a DPP-4 inhibitor or metformin and pioglitazone or metformin and a sulfonylurea.	In adults with type 2 diabetes, if metformin is contraindicated or not tolerated and initial drug treatment has not continued to control HbA1c to below the person's individually agreed threshold for intensification, consider dual therapy with: a DPP-4 inhibitor and pioglitazone or a DPP-4 inhibitor and a sulfonylurea or pioglitazone and a sulfonylurea.	
antihypertensive drug	0	1.1235	7	For an adult with type 2 diabetes on antihypertensive drug treatment when diabetes is diagnosed, review blood pressure control and medications used.	Monitor blood pressure every 1–2 months, and intensify therapy if the person is already on antihypertensive drug treatment, until the blood pressure is consistently below 140 80 mmHg (below 130 80 mmHg if there is kidney, eye or cerebrovascular damage).	First-line antihypertensive drug treatment should be a once-daily, generic angiotensin-converting enzyme (ACE) inhibitor	The first-line antihypertensive drug treatment for a person of African or	A calcium-channel blocker should be the first-line antihypertensive drug treatment for a woman for whom, after an informed discussion, it is agreed there is a possibility of her becoming pregnant.	Check for possible adverse effects of antihypertensive drug treatment – including the risks from unnecessarily low blood pressure.	When using tricyclic drugs and antihypertensive drug treatments in adults with type 2 diabetes who have autonomic neuropathy, be aware of the increased likelihood of side effects such as orthostatic hypotension.	
glucagon-like peptide-1	1	1.1186	2	Recommendations in this section that cover dipeptidyl peptidase-4 (DPP-4) inhibitors, glucagon-like peptide-1 (GLP-1) mimetics and sulfonylureas refer to each of these groups of drugs at a class level.	If triple therapy with metformin and 2 other oral drugs (see recommendation ) is not effective, not tolerated or contraindicated, consider combination therapy with metformin, a sulfonylurea and a glucagon-like peptide-1 (GLP-1) mimetic for adults with type 2 diabetes who: have a BMI of 35 kg m2 or higher (adjust accordingly for people from black, Asian and other minority ethnic groups) and specific psychological or other medical problems associated with obesity or have a BMI lower than 35 kg m2and: for whom insulin therapy would have significant occupational implications or weight loss would benefit other significant obesity-related comorbidities.	
weight loss	0	1.1146	7	Remember that lesser degrees of weight loss may still be of benefit, and that larger degrees of weight loss in the longer term will have advantageous metabolic impact.	HbA1c and a weight loss of at least 3percent of initial body weight in 6 months).	Remember that lesser degrees of weight loss may still be of benefit, and that larger degrees of weight loss in the longer term will have advantageous metabolic impact.	HbA1c and a weight loss of at least 3percent of initial body weight in 6 months).	For adults with type 2 diabetes who are overweight, set an initial body weight loss target of 5–10percent	Be aware that there are other possible reasons for a low HbA1c level, for example, deteriorating renal function or sudden weight loss.	If triple therapy with metformin and 2 other oral drugs (see recommendation ) is not effective, not tolerated or contraindicated, consider combination therapy with metformin, a sulfonylurea and a glucagon-like peptide-1 (GLP-1) mimetic for adults with type 2 diabetes who: have a BMI of 35 kg m2 or higher (adjust accordingly for people from black, Asian and other minority ethnic groups) and specific psychological or other medical problems associated with obesity or have a BMI lower than 35 kg m2and: for whom insulin therapy would have significant occupational implications or weight loss would benefit other significant obesity-related comorbidities.	
healthcare products	0	1.0919	10	Medicines and Healthcare products Regulatory Agency (MHRA) guidance (2017) warned that canagliflozin may increase the risk of lower-limb amputation (mainly toes) in people with type 2 diabetes	Medicines and Healthcare products Regulatory Agency (MHRA) guidance (2011) notes that cases of cardiac failure have been reported when pioglitazone was used in combination with insulin, especially in patients with risk factors for the development of cardiac failure	Medicines and Healthcare products Regulatory Agency (MHRA) guidance (2014) notes that domperidone is associated with a small increased risk of serious cardiac side effects	Medicines and Healthcare products Regulatory Agency (MHRA) guidance (2017) warned that canagliflozin may increase the risk of lower-limb amputation (mainly toes) in people with type 2 diabetes	Medicines and Healthcare products Regulatory Agency (MHRA) guidance (2011) notes that cases of cardiac failure have been reported when pioglitazone was used in combination with insulin, especially in patients with risk factors for the development of cardiac failure	Medicines and Healthcare products Regulatory Agency (MHRA) guidance (2014) notes that domperidone is associated with a small increased risk of serious cardiac side effects	Medicines and Healthcare products Regulatory Agency (MHRA) guidance (2011) advises that 'prescribers should review the safety and efficacy of pioglitazone in individuals after 3–6 months of treatment to ensure that only patients who are deriving benefit continue to be treated'.	Last updated May 2017 safety (see Medicines and Healthcare products Regulatory Agency MHRA guidance) and tolerability of the drug treatment(s) the person's individual clinical circumstances, for example, comorbidities, risks from polypharmacy the person's individual preferences and needs the licensed indications or combinations available cost (if 2 drugs in the same class are appropriate, choose the option with the lowest acquisition cost).	Medicines and Healthcare products Regulatory Agency (MHRA) guidance (2011) advises that 'prescribers should review the safety and efficacy of pioglitazone in individuals after 3–6 months of treatment to ensure that only patients who are deriving benefit continue to be treated'.	Medicines and Healthcare products Regulatory Agency (MHRA) guidance (2016) warned that serious, life-threatening, and fatal cases of diabetic ketoacidosis have been reported rarely in people taking an SGLT-2 inhibitor (a substantial proportion of the cases concerned off-label use in people with type 1 diabetes, which is not recommended)	
products regulatory	0	1.0919	10	Medicines and Healthcare products Regulatory Agency (MHRA) guidance (2017) warned that canagliflozin may increase the risk of lower-limb amputation (mainly toes) in people with type 2 diabetes	Medicines and Healthcare products Regulatory Agency (MHRA) guidance (2011) notes that cases of cardiac failure have been reported when pioglitazone was used in combination with insulin, especially in patients with risk factors for the development of cardiac failure	Medicines and Healthcare products Regulatory Agency (MHRA) guidance (2014) notes that domperidone is associated with a small increased risk of serious cardiac side effects	Medicines and Healthcare products Regulatory Agency (MHRA) guidance (2017) warned that canagliflozin may increase the risk of lower-limb amputation (mainly toes) in people with type 2 diabetes	Medicines and Healthcare products Regulatory Agency (MHRA) guidance (2011) notes that cases of cardiac failure have been reported when pioglitazone was used in combination with insulin, especially in patients with risk factors for the development of cardiac failure	Medicines and Healthcare products Regulatory Agency (MHRA) guidance (2014) notes that domperidone is associated with a small increased risk of serious cardiac side effects	Medicines and Healthcare products Regulatory Agency (MHRA) guidance (2011) advises that 'prescribers should review the safety and efficacy of pioglitazone in individuals after 3–6 months of treatment to ensure that only patients who are deriving benefit continue to be treated'.	Last updated May 2017 safety (see Medicines and Healthcare products Regulatory Agency MHRA guidance) and tolerability of the drug treatment(s) the person's individual clinical circumstances, for example, comorbidities, risks from polypharmacy the person's individual preferences and needs the licensed indications or combinations available cost (if 2 drugs in the same class are appropriate, choose the option with the lowest acquisition cost).	Medicines and Healthcare products Regulatory Agency (MHRA) guidance (2011) advises that 'prescribers should review the safety and efficacy of pioglitazone in individuals after 3–6 months of treatment to ensure that only patients who are deriving benefit continue to be treated'.	Medicines and Healthcare products Regulatory Agency (MHRA) guidance (2016) warned that serious, life-threatening, and fatal cases of diabetic ketoacidosis have been reported rarely in people taking an SGLT-2 inhibitor (a substantial proportion of the cases concerned off-label use in people with type 1 diabetes, which is not recommended)	
regulatory agency	0	1.0919	10	Medicines and Healthcare products Regulatory Agency (MHRA) guidance (2017) warned that canagliflozin may increase the risk of lower-limb amputation (mainly toes) in people with type 2 diabetes	Medicines and Healthcare products Regulatory Agency (MHRA) guidance (2011) notes that cases of cardiac failure have been reported when pioglitazone was used in combination with insulin, especially in patients with risk factors for the development of cardiac failure	Medicines and Healthcare products Regulatory Agency (MHRA) guidance (2014) notes that domperidone is associated with a small increased risk of serious cardiac side effects	Medicines and Healthcare products Regulatory Agency (MHRA) guidance (2017) warned that canagliflozin may increase the risk of lower-limb amputation (mainly toes) in people with type 2 diabetes	Medicines and Healthcare products Regulatory Agency (MHRA) guidance (2011) notes that cases of cardiac failure have been reported when pioglitazone was used in combination with insulin, especially in patients with risk factors for the development of cardiac failure	Medicines and Healthcare products Regulatory Agency (MHRA) guidance (2014) notes that domperidone is associated with a small increased risk of serious cardiac side effects	Medicines and Healthcare products Regulatory Agency (MHRA) guidance (2011) advises that 'prescribers should review the safety and efficacy of pioglitazone in individuals after 3–6 months of treatment to ensure that only patients who are deriving benefit continue to be treated'.	Last updated May 2017 safety (see Medicines and Healthcare products Regulatory Agency MHRA guidance) and tolerability of the drug treatment(s) the person's individual clinical circumstances, for example, comorbidities, risks from polypharmacy the person's individual preferences and needs the licensed indications or combinations available cost (if 2 drugs in the same class are appropriate, choose the option with the lowest acquisition cost).	Medicines and Healthcare products Regulatory Agency (MHRA) guidance (2011) advises that 'prescribers should review the safety and efficacy of pioglitazone in individuals after 3–6 months of treatment to ensure that only patients who are deriving benefit continue to be treated'.	Medicines and Healthcare products Regulatory Agency (MHRA) guidance (2016) warned that serious, life-threatening, and fatal cases of diabetic ketoacidosis have been reported rarely in people taking an SGLT-2 inhibitor (a substantial proportion of the cases concerned off-label use in people with type 1 diabetes, which is not recommended)	
acquisition cost	0	1.0877	2	Last updated May 2017 safety (see Medicines and Healthcare products Regulatory Agency MHRA guidance) and tolerability of the drug treatment(s) the person's individual clinical circumstances, for example, comorbidities, risks from polypharmacy the person's individual preferences and needs the licensed indications or combinations available cost (if 2 drugs in the same class are appropriate, choose the option with the lowest acquisition cost).	Consider a phosphodiesterase-5 inhibitor to treat problematic erectile dysfunction in men with type 2 diabetes, initially choosing the drug with the lowest acquisition cost and taking into account any contraindications.	
hba1c level	0	1.0859	7	In adults with type 2 diabetes, measure HbA1c levels at: 3–6-monthly intervals (tailored to individual needs), until the HbA1c is stable on unchanging therapy 6-monthly intervals once the HbA1c level and blood glucose lowering therapy are stable.	For adults with type 2 diabetes managed either by lifestyle and diet, or by lifestyle and diet combined with a single drug not associated with hypoglycaemia, support the person to aim for an HbA1c level of 48 mmol mol ( percent)	For adults on a drug associated with hypoglycaemia, support the person to aim for an HbA1c level of 53 mmol mol ( percent).	In adults with type 2 diabetes, if HbA1c levels are not adequately controlled by a single drug and rise to 58 mmol mol ( percent) or higher: reinforce advice about diet, lifestyle and adherence to drug treatment and support the person to aim for an HbA1c level of 53 mmol mol ( percent) and intensify drug treatment.	Consider relaxing the target HbA1c level (see recommendations and )	If adults with type 2 diabetes achieve an HbA1c level that is lower than their target and they are not experiencing hypoglycaemia, encourage them to maintain it	Be aware that there are other possible reasons for a low HbA1c level, for example, deteriorating renal function or sudden weight loss.	
family members	0	1.0745	3	Offer structured education to adults with type 2 diabetes and or their family members or carers (as appropriate) at and around the time of diagnosis, with	It has specific aims and learning objectives, and supports the person and their family members and carers in developing attitudes, beliefs, knowledge and skills to self-manage diabetes.	Ensure that all members of the diabetes healthcare team are familiar with the patient-education programmes available locally, that these programmes are integrated with the rest of the care pathway, and that adults with type 2 diabetes and their family members or carers (as appropriate) have the opportunity to contribute to the design and provision of local programmes.	
low hba1c	0	1.0514	1	Be aware that there are other possible reasons for a low HbA1c level, for example, deteriorating renal function or sudden weight loss.	
offer standard-release	0	1.0514	1	Offer standard-release metformin as the initial drug treatment for adults with type 2 diabetes.	
renal function	0	1.0514	1	Be aware that there are other possible reasons for a low HbA1c level, for example, deteriorating renal function or sudden weight loss.	
sudden weight	0	1.0514	1	Be aware that there are other possible reasons for a low HbA1c level, for example, deteriorating renal function or sudden weight loss.	
treatment offer	0	1.0514	0	
weight gain	0	1.0342	2	For recommendations on lifestyle advice, see the NICE guidelines on: preventing excess weight gain, weight management, obesity, physical activity, smoking: brief interventions and referrals, stop smoking services, smoking: harm reduction, and smoking: acute, maternity and mental health services.	It advises that if the combination is used, people should be observed for signs and symptoms of heart failure, weight gain, and oedema	
oral drug	0	1.0144	3	In adults with type 2 diabetes, if dual therapy with metformin and another oral drug (see recommendation ) has not continued to control HbA1c to below the person's individually agreed threshold for intensification, consider either: triple therapy with: metformin, a DPP-4 inhibitor and a sulfonylurea or metformin, pioglitazone and a sulfonylurea or starting insulin-based treatment (see recommendations – ).	If triple therapy with metformin and 2 other oral drugs (see recommendation ) is not effective, not tolerated or contraindicated, consider combination therapy with metformin, a sulfonylurea and a glucagon-like peptide-1 (GLP-1) mimetic for adults with type 2 diabetes who: have a BMI of 35 kg m2 or higher (adjust accordingly for people from black, Asian and other minority ethnic groups) and specific psychological or other medical problems associated with obesity or have a BMI lower than 35 kg m2and: for whom insulin therapy would have significant occupational implications or weight loss would benefit other significant obesity-related comorbidities.	In adults with type 2 diabetes, if metformin is contraindicated or not tolerated, and if dual therapy with 2 oral drugs (see recommendation ) has not continued to control HbA1c to below the person's individually agreed threshold for intensification, consider insulin-based treatment (see recommendations – ).	
drug treatments	0	1.0004	1	When using tricyclic drugs and antihypertensive drug treatments in adults with type 2 diabetes who have autonomic neuropathy, be aware of the increased likelihood of side effects such as orthostatic hypotension.	
orthostatic hypotension	0	1.0004	1	When using tricyclic drugs and antihypertensive drug treatments in adults with type 2 diabetes who have autonomic neuropathy, be aware of the increased likelihood of side effects such as orthostatic hypotension.	
tricyclic drugs	0	1.0004	1	When using tricyclic drugs and antihypertensive drug treatments in adults with type 2 diabetes who have autonomic neuropathy, be aware of the increased likelihood of side effects such as orthostatic hypotension.	
unexplained diarrhoea	0	1.0004	1	Think about the possibility of autonomic neuropathy affecting the gut in adults with type 2 diabetes who have unexplained diarrhoea that happens particularly at night 2009, amended 2015	
myocardial infarction	1	0.9889	1	For guidance on the primary and secondary prevention of cardiovascular disease in adults with type 2 diabetes, see the NICE guidelines on cardiovascular disease and myocardial infarction.	
secondary prevention	0	0.9889	1	For guidance on the primary and secondary prevention of cardiovascular disease in adults with type 2 diabetes, see the NICE guidelines on cardiovascular disease and myocardial infarction.	
dual therapy	0	0.9753	8	Add the other drug (that is, the calcium-channel blocker or diuretic) if the target is not reached with dual therapy 2009, amended 2015	Add the other drug (that is, the calcium-channel blocker or diuretic) if the target is not reached with dual therapy 2009, amended 2015	Treatment with 2 non-insulin blood glucose lowering therapies in combination (dual therapy)	In adults with type 2 diabetes, if initial drug treatment with metformin has not continued to control HbA1c to below the person's individually agreed threshold for intensification, consider dual therapy with: metformin and a DPP-4 inhibitor or metformin and pioglitazone or metformin and a sulfonylurea.	In adults with type 2 diabetes, if metformin is contraindicated or not tolerated and initial drug treatment has not continued to control HbA1c to below the person's individually agreed threshold for intensification, consider dual therapy with: a DPP-4 inhibitor and pioglitazone or a DPP-4 inhibitor and a sulfonylurea or pioglitazone and a sulfonylurea.	In adults with type 2 diabetes, if dual therapy with metformin and another oral drug (see recommendation ) has not continued to control HbA1c to below the person's individually agreed threshold for intensification, consider either: triple therapy with: metformin, a DPP-4 inhibitor and a sulfonylurea or metformin, pioglitazone and a sulfonylurea or starting insulin-based treatment (see recommendations – ).	In adults with type 2 diabetes, if metformin is contraindicated or not tolerated, and if dual therapy with 2 oral drugs (see recommendation ) has not continued to control HbA1c to below the person's individually agreed threshold for intensification, consider insulin-based treatment (see recommendations – ).	Be aware that the drugs in dual therapy should be introduced in a stepwise manner, checking for tolerability and effectiveness of each drug.	
lifestyle advice	0	0.9675	7	Add medications if lifestyle advice does not reduce blood pressure to below 140 80 mmHg (below 130 80 mmHg if there is kidney, eye or cerebrovascular damage).	Add medications if lifestyle advice does not reduce blood pressure to below 140 80 mmHg (below 130 80 mmHg if there is kidney, eye or cerebrovascular damage).	For recommendations on lifestyle advice, see the NICE guidelines on: preventing excess weight gain, weight management, obesity, physical activity, smoking: brief interventions and referrals, stop smoking services, smoking: harm reduction, and smoking: acute, maternity and mental health services.	Offer and reinforce preventive lifestyle advice.	Provide lifestyle advice (diet and exercise) at the same time.	Provide lifestyle advice (see section in this guideline and the lifestyle interventions section in hypertension in adults NICE guideline CG127) if blood	Offer lifestyle advice and drug treatment to support adults with type 2 diabetes to achieve and maintain their HbA1c target (see section )	
current medical	0	0.9509	3	DVLA guidance (At a glance guide to the current medical standards of fitness to drive) management of hypoglycaemia management of acute changes in plasma glucose control support from an appropriately trained and experienced healthcare professional.	DVLA guidance (At a glance guide to the current medical standards of fitness to drive) management of hypoglycaemia management of acute changes in plasma glucose control support from an appropriately trained and experienced healthcare professional.	Take the Driver and Vehicle Licensing Agency (DVLA) At a glance guide to the current medical standards of fitness to drive into account when offering self-monitoring of blood glucose levels for adults with type 2 diabetes.	
