mmol mol	0	1.7067	7	Only continue GLP-1 mimetic therapy if the person with type 2 diabetes has had a beneficial metabolic response (a reduction of at least 11 mmol mol  percent in	HbA1c is 75 mmol mol  percent or higher), administered either: separately or as a pre-mixed (biphasic) human insulin preparation.	Only continue GLP-1 mimetic therapy if the person with type 2 diabetes has had a beneficial metabolic response (a reduction of at least 11 mmol mol  percent in	HbA1c is 75 mmol mol  percent or higher), administered either: separately or as a pre-mixed (biphasic) human insulin preparation.	For adults with type 2 diabetes managed either by lifestyle and diet, or by lifestyle and diet combined with a single drug not associated with hypoglycaemia, support the person to aim for an HbA1c level of 48 mmol mol ( percent)	For adults on a drug associated with hypoglycaemia, support the person to aim for an HbA1c level of 53 mmol mol ( percent).	In adults with type 2 diabetes, if HbA1c levels are not adequately controlled by a single drug and rise to 58 mmol mol ( percent) or higher: reinforce advice about diet, lifestyle and adherence to drug treatment and support the person to aim for an HbA1c level of 53 mmol mol ( percent) and intensify drug treatment.	
drug treatment(s)	0	1.6525	2	Base the choice of drug treatment(s) on: the effectiveness of the drug treatment(s) in terms of metabolic response	Last updated May 2017 safety (see Medicines and Healthcare products Regulatory Agency MHRA guidance) and tolerability of the drug treatment(s) the person's individual clinical circumstances, for example, comorbidities, risks from polypharmacy the person's individual preferences and needs the licensed indications or combinations available cost (if 2 drugs in the same class are appropriate, choose the option with the lowest acquisition cost).	
non-insulin blood	0	1.6525	3	Treatment with a single non-insulin blood glucose lowering therapy (monotherapy)	Treatment with 2 non-insulin blood glucose lowering therapies in combination (dual therapy)	Treatment with either 3 non-insulin blood glucose lowering therapies in combination (triple therapy) or any treatment combination containing insulin	
treatment treatment	1	1.6525	0	
combination therapy	0	1.6138	4	Treatment with combinations of medicines including sodium–glucose cotransporter 2 (SGLT-2) inhibitors , may be appropriate for some people with type 2 diabetes; see the NICE guidance on canagliflozin in combination therapy for treating type 2 diabetes, dapagliflozin in combination therapy for treating type 2 diabetes and empagliflozin in combination therapy for treating type 2 diabetes.	If triple therapy with metformin and 2 other oral drugs (see recommendation ) is not effective, not tolerated or contraindicated, consider combination therapy with metformin, a sulfonylurea and a glucagon-like peptide-1 (GLP-1) mimetic for adults with type 2 diabetes who: have a BMI of 35 kg m2 or higher (adjust accordingly for people from black, Asian and other minority ethnic groups) and specific psychological or other medical problems associated with obesity or have a BMI lower than 35 kg m2and: for whom insulin therapy would have significant occupational implications or weight loss would benefit other significant obesity-related comorbidities.	Treatment with combinations of medicines including SGLT-2 inhibitors , may be appropriate for some people with type 2 diabetes; see the NICE guidance on canagliflozin in combination therapy for treating type 2 diabetes, dapagliflozin in combination therapy for treating type 2 diabetes, dapagliflozin in triple therapy for treating type 2 diabetes and empagliflozin in combination therapy for treating type 2 diabetes.	Treatment with combinations of medicines including SGLT-2 inhibitors , may be appropriate for some people with type 2 diabetes; see the NICE guidance on canagliflozin in combination therapy for treating type 2 diabetes, dapagliflozin in combination therapy for treating type 2 diabetes and empagliflozin in combination therapy for treating type 2 diabetes.	
heart failure	0	1.5779	6	Pioglitazone is associated with an increased risk of heart failure, bladder cancer and bone fracture	Pioglitazone is associated with an increased risk of heart failure, bladder cancer and bone fracture	Pioglitazone is associated with an increased risk of heart failure, bladder cancer and bone fracture	Pioglitazone is associated with an increased risk of heart failure, bladder cancer and bone fracture	In adults with type 2 diabetes, do not offer or continue pioglitazone if they have any of the following: heart failure or history of heart failure	It advises that if the combination is used, people should be observed for signs and symptoms of heart failure, weight gain, and oedema	
cardiovascular disease	0	1.5453	3	Do not offer antiplatelet therapy (aspirin or clopidogrel) for adults with type 2 diabetes without cardiovascular disease.	For guidance on the primary and secondary prevention of cardiovascular disease in adults with type 2 diabetes, see the NICE guidelines on cardiovascular disease and myocardial infarction.	Assess, educate and support men with type 2 diabetes who have problematic erectile dysfunction, addressing contributory factors such as cardiovascular disease as well as possible treatment options.	
3–6 months	0	1.5204	2	Medicines and Healthcare products Regulatory Agency (MHRA) guidance (2011) advises that 'prescribers should review the safety and efficacy of pioglitazone in individuals after 3–6 months of treatment to ensure that only patients who are deriving benefit continue to be treated'.	Medicines and Healthcare products Regulatory Agency (MHRA) guidance (2011) advises that 'prescribers should review the safety and efficacy of pioglitazone in individuals after 3–6 months of treatment to ensure that only patients who are deriving benefit continue to be treated'.	
bariatric surgery	0	1.5204	3	Dietary advice and bariatric surgery	Dietary advice and bariatric surgery	For recommendations on bariatric surgery for people with recent-onset type 2 diabetes, see the section on bariatric surgery for people with recent-onset type 2 diabetes in the NICE guideline on obesity.	
details medicines	0	1.5204	0	
dose titration	0	1.5204	1	When starting insulin therapy in adults with type 2 diabetes, use a structured programme employing active insulin dose titration that encompasses: injection technique, including rotating injection sites and avoiding repeated injections at the same point within sites continuing telephone support self-monitoring dose titration to target levels dietary understanding	
eye screening	0	1.5204	7	Arrange repeat structured eye screening annually. 2009, amended 2016	Perform visual acuity testing as a routine part of eye screening programmes.	Arrange repeat structured eye screening annually. 2009, amended 2016	Perform visual acuity testing as a routine part of eye screening programmes.	On diagnosis, GPs should immediately refer adults with type 2 diabetes to the local eye screening service	Explain the reasons for, and success of, eye screening systems to adults with type 2 diabetes, so that attendance is not reduced by lack of knowledge or fear of outcome.	Depending on the findings, follow structured eye screening by: routine review in 1 year or earlier review or referral to an ophthalmologist.	
foot problems	0	1.5204	3	Diabetic foot problems	Diabetic foot problems	For guidance on preventing and managing foot problems in adults with type 2 diabetes, see the NICE guideline on diabetic foot problems.	
insulin delivery	0	1.5204	3	Insulin delivery	Insulin delivery	For guidance on insulin delivery for adults with type 2 diabetes, see the insulin delivery section in the NICE guideline on type 1 diabetes.	
kidney disease	1	1.5204	4	Diabetic kidney disease	Diabetic kidney disease	For guidance on managing kidney disease in adults with type 2 diabetes, see the	NICE guideline on chronic kidney disease in adults.	
minute m2	0	1.5204	4	Stop metformin if the eGFR is below 30 ml minute m2.	Stop metformin if the eGFR is below 30 ml minute m2.	In adults with type 2 diabetes, review the dose of metformin if the estimated glomerular filtration rate (eGFR) is below 45 ml minute m2:	Prescribe metformin with caution for those at risk of a sudden deterioration in kidney function and those at risk of eGFR falling below 45 ml minute m2.	
ml minute	0	1.5204	4	Stop metformin if the eGFR is below 30 ml minute m2.	Stop metformin if the eGFR is below 30 ml minute m2.	In adults with type 2 diabetes, review the dose of metformin if the estimated glomerular filtration rate (eGFR) is below 45 ml minute m2:	Prescribe metformin with caution for those at risk of a sudden deterioration in kidney function and those at risk of eGFR falling below 45 ml minute m2.	
product characteristics	0	1.5204	4	MHRA guidance and summaries of product characteristics	MHRA guidance and summaries of product characteristics	Known risk factors for these conditions, including increased age, should be carefully evaluated before treatment: see the manufacturers' summaries of product characteristics for details	Known risk factors for these conditions, including increased age, should be carefully evaluated before treatment: see the manufacturers' summaries of product characteristics for details	
recent-onset type	0	1.5204	1	For recommendations on bariatric surgery for people with recent-onset type 2 diabetes, see the section on bariatric surgery for people with recent-onset type 2 diabetes in the NICE guideline on obesity.	
risk factors	0	1.5204	4	Medicines and Healthcare products Regulatory Agency (MHRA) guidance (2011) notes that cases of cardiac failure have been reported when pioglitazone was used in combination with insulin, especially in patients with risk factors for the development of cardiac failure	Medicines and Healthcare products Regulatory Agency (MHRA) guidance (2011) notes that cases of cardiac failure have been reported when pioglitazone was used in combination with insulin, especially in patients with risk factors for the development of cardiac failure	Known risk factors for these conditions, including increased age, should be carefully evaluated before treatment: see the manufacturers' summaries of product characteristics for details	Known risk factors for these conditions, including increased age, should be carefully evaluated before treatment: see the manufacturers' summaries of product characteristics for details	
sglt-2 inhibitor	0	1.5204	4	Treatment with combinations of medicines including SGLT-2 inhibitors , may be appropriate for some people with type 2 diabetes; see the NICE guidance on canagliflozin in combination therapy for treating type 2 diabetes, dapagliflozin in combination therapy for treating type 2 diabetes, dapagliflozin in triple therapy for treating type 2 diabetes and empagliflozin in combination therapy for treating type 2 diabetes.	Treatment with combinations of medicines including SGLT-2 inhibitors , may be appropriate for some people with type 2 diabetes; see the NICE guidance on canagliflozin in combination therapy for treating type 2 diabetes, dapagliflozin in combination therapy for treating type 2 diabetes and empagliflozin in combination therapy for treating type 2 diabetes.	Medicines and Healthcare products Regulatory Agency (MHRA) guidance (2016) warned that serious, life-threatening, and fatal cases of diabetic ketoacidosis have been reported rarely in people taking an SGLT-2 inhibitor (a substantial proportion of the cases concerned off-label use in people with type 1 diabetes, which is not recommended)	The MHRA advised that healthcare professionals should test for raised ketones in people with ketoacidosis symptoms who are receiving an SGLT-2 inhibitor, even if their plasma glucose levels are near-normal.	
blood pressure	0	1.5073	15	Blood pressure management	Add medications if lifestyle advice does not reduce blood pressure to below 140 80 mmHg (below 130 80 mmHg if there is kidney, eye or cerebrovascular damage).	If the person's blood pressure is not reduced to the individually agreed target with first-line therapy, add a calcium-channel blocker or a diuretic (usually a thiazide or thiazide-related diuretic)	If the person's blood pressure is not reduced to the individually agreed target with triple therapy, add an alpha-blocker, a beta-blocker or a potassium-sparing diuretic (the last with caution if the person is already taking an ACE inhibitor or an angiotensin II-receptor antagonist).	Monitor the blood pressure of a person who has attained and consistently remained at his or her blood pressure target every 4–6 months	Blood pressure management	Add medications if lifestyle advice does not reduce blood pressure to below 140 80 mmHg (below 130 80 mmHg if there is kidney, eye or cerebrovascular damage).	If the person's blood pressure is not reduced to the individually agreed target with first-line therapy, add a calcium-channel blocker or a diuretic (usually a thiazide or thiazide-related diuretic)	If the person's blood pressure is not reduced to the individually agreed target with triple therapy, add an alpha-blocker, a beta-blocker or a potassium-sparing diuretic (the last with caution if the person is already taking an ACE inhibitor or an angiotensin II-receptor antagonist).	Monitor the blood pressure of a person who has attained and consistently remained at his or her blood pressure target every 4–6 months	Measure blood pressure at least annually in an adult with type 2 diabetes without previously diagnosed hypertension or renal disease	For an adult with type 2 diabetes on antihypertensive drug treatment when diabetes is diagnosed, review blood pressure control and medications used.	Repeat blood pressure measurements within: 1 month if blood pressure is higher than 150 90 mmHg 2 months if blood pressure is higher than 140 80 mmHg 2 months if blood pressure is higher than 130 80 mmHg and there is kidney, eye or cerebrovascular damage.	Monitor blood pressure every 1–2 months, and intensify therapy if the person is already on antihypertensive drug treatment, until the blood pressure is consistently below 140 80 mmHg (below 130 80 mmHg if there is kidney, eye or cerebrovascular damage).	Check for possible adverse effects of antihypertensive drug treatment – including the risks from unnecessarily low blood pressure.	
autonomic neuropathy	0	1.4936	5	Autonomic neuropathy	Think about the possibility of autonomic neuropathy affecting the gut in adults with type 2 diabetes who have unexplained diarrhoea that happens particularly at night 2009, amended 2015	When using tricyclic drugs and antihypertensive drug treatments in adults with type 2 diabetes who have autonomic neuropathy, be aware of the increased likelihood of side effects such as orthostatic hypotension.	Investigate the possibility of autonomic neuropathy affecting the bladder in adults with type 2 diabetes who have unexplained bladder-emptying problems.	In managing autonomic neuropathy symptoms, include specific interventions indicated by the manifestations (for example, for abnormal sweating or nocturnal diarrhoea).	
dipeptidyl peptidase-4	0	1.457	2	Recommendations in this section that cover dipeptidyl peptidase-4 (DPP-4) inhibitors, glucagon-like peptide-1 (GLP-1) mimetics and sulfonylureas refer to each of these groups of drugs at a class level.	In adults with type 2 diabetes, if metformin is contraindicated or not tolerated, consider initial drug treatment with: a dipeptidyl peptidase-4 (DPP-4) inhibitor or pioglitazone or a sulfonylurea.	
phosphodiesterase-5 inhibitor	0	1.457	2	Consider a phosphodiesterase-5 inhibitor to treat problematic erectile dysfunction in men with type 2 diabetes, initially choosing the drug with the lowest acquisition cost and taking into account any contraindications.	Following discussion, refer men with type 2 diabetes to a service offering other medical, surgical or psychological management of erectile dysfunction if treatment (including a phosphodiesterase-5 inhibitor, as appropriate) has been unsuccessful.	
problematic erectile	0	1.457	2	Assess, educate and support men with type 2 diabetes who have problematic erectile dysfunction, addressing contributory factors such as cardiovascular disease as well as possible treatment options.	Consider a phosphodiesterase-5 inhibitor to treat problematic erectile dysfunction in men with type 2 diabetes, initially choosing the drug with the lowest acquisition cost and taking into account any contraindications.	
erectile dysfunction	0	1.4038	6	Erectile dysfunction	Erectile dysfunction	Offer men with type 2 diabetes the opportunity to discuss erectile dysfunction as part of their annual review.	Assess, educate and support men with type 2 diabetes who have problematic erectile dysfunction, addressing contributory factors such as cardiovascular disease as well as possible treatment options.	Consider a phosphodiesterase-5 inhibitor to treat problematic erectile dysfunction in men with type 2 diabetes, initially choosing the drug with the lowest acquisition cost and taking into account any contraindications.	Following discussion, refer men with type 2 diabetes to a service offering other medical, surgical or psychological management of erectile dysfunction if treatment (including a phosphodiesterase-5 inhibitor, as appropriate) has been unsuccessful.	
first-line antihypertensive	0	1.3986	3	First-line antihypertensive drug treatment should be a once-daily, generic angiotensin-converting enzyme (ACE) inhibitor	The first-line antihypertensive drug treatment for a person of African or	A calcium-channel blocker should be the first-line antihypertensive drug treatment for a woman for whom, after an informed discussion, it is agreed there is a possibility of her becoming pregnant.	
review treatment	0	1.3986	3	Consider short-term self-monitoring of blood glucose levels in adults with type 2 diabetes (and review treatment as necessary): when starting treatment with oral or intravenous corticosteroids or to confirm suspected hypoglycaemia.	Review treatment as necessary.	If an adult with type 2 diabetes is symptomatically hyperglycaemic, consider insulin (see recommendations – ) or a sulfonylurea, and review treatment when blood glucose control has been achieved.	
ace inhibitor	0	1.3919	6	For a person with continuing intolerance to an ACE inhibitor (other than renal deterioration or hyperkalaemia), substitute an angiotensin II-receptor antagonist for the ACE inhibitor.	If the person's blood pressure is not reduced to the individually agreed target with triple therapy, add an alpha-blocker, a beta-blocker or a potassium-sparing diuretic (the last with caution if the person is already taking an ACE inhibitor or an angiotensin II-receptor antagonist).	For a person with continuing intolerance to an ACE inhibitor (other than renal deterioration or hyperkalaemia), substitute an angiotensin II-receptor antagonist for the ACE inhibitor.	If the person's blood pressure is not reduced to the individually agreed target with triple therapy, add an alpha-blocker, a beta-blocker or a potassium-sparing diuretic (the last with caution if the person is already taking an ACE inhibitor or an angiotensin II-receptor antagonist).	Caribbean family origin should be an ACE inhibitor plus either a diuretic or a generic calcium-channel blocker.	Do not combine an ACE inhibitor with an angiotensin II-receptor antagonist to treat hypertension.	
calcium-channel blocker	0	1.3919	6	If the person's blood pressure is not reduced to the individually agreed target with first-line therapy, add a calcium-channel blocker or a diuretic (usually a thiazide or thiazide-related diuretic)	Add the other drug (that is, the calcium-channel blocker or diuretic) if the target is not reached with dual therapy 2009, amended 2015	If the person's blood pressure is not reduced to the individually agreed target with first-line therapy, add a calcium-channel blocker or a diuretic (usually a thiazide or thiazide-related diuretic)	Add the other drug (that is, the calcium-channel blocker or diuretic) if the target is not reached with dual therapy 2009, amended 2015	Caribbean family origin should be an ACE inhibitor plus either a diuretic or a generic calcium-channel blocker.	A calcium-channel blocker should be the first-line antihypertensive drug treatment for a woman for whom, after an informed discussion, it is agreed there is a possibility of her becoming pregnant.	
caribbean family	0	1.3919	2	African or Caribbean family origin, or women for whom there is a possibility of becoming pregnant.	Caribbean family origin should be an ACE inhibitor plus either a diuretic or a generic calcium-channel blocker.	
family origin	0	1.3919	2	African or Caribbean family origin, or women for whom there is a possibility of becoming pregnant.	Caribbean family origin should be an ACE inhibitor plus either a diuretic or a generic calcium-channel blocker.	
gastrointestinal side	0	1.3919	2	Gradually increase the dose of standard-release metformin over several weeks to minimise the risk of gastrointestinal side effects in adults with type 2 diabetes.	If an adult with type 2 diabetes experiences gastrointestinal side effects with standard-release metformin, consider a trial of modified-release metformin.	
insulin-based treatment	0	1.3188	3	In adults with type 2 diabetes, if dual therapy with metformin and another oral drug (see recommendation ) has not continued to control HbA1c to below the person's individually agreed threshold for intensification, consider either: triple therapy with: metformin, a DPP-4 inhibitor and a sulfonylurea or metformin, pioglitazone and a sulfonylurea or starting insulin-based treatment (see recommendations – ).	In adults with type 2 diabetes, if metformin is contraindicated or not tolerated, and if dual therapy with 2 oral drugs (see recommendation ) has not continued to control HbA1c to below the person's individually agreed threshold for intensification, consider insulin-based treatment (see recommendations – ).	Insulin-based treatments	
standard-release metformin	0	1.3129	3	Offer standard-release metformin as the initial drug treatment for adults with type 2 diabetes.	Gradually increase the dose of standard-release metformin over several weeks to minimise the risk of gastrointestinal side effects in adults with type 2 diabetes.	If an adult with type 2 diabetes experiences gastrointestinal side effects with standard-release metformin, consider a trial of modified-release metformin.	
side effects	0	1.2901	5	Medicines and Healthcare products Regulatory Agency (MHRA) guidance (2014) notes that domperidone is associated with a small increased risk of serious cardiac side effects	Medicines and Healthcare products Regulatory Agency (MHRA) guidance (2014) notes that domperidone is associated with a small increased risk of serious cardiac side effects	Gradually increase the dose of standard-release metformin over several weeks to minimise the risk of gastrointestinal side effects in adults with type 2 diabetes.	If an adult with type 2 diabetes experiences gastrointestinal side effects with standard-release metformin, consider a trial of modified-release metformin.	When using tricyclic drugs and antihypertensive drug treatments in adults with type 2 diabetes who have autonomic neuropathy, be aware of the increased likelihood of side effects such as orthostatic hypotension.	
dpp-4 inhibitor	0	1.2564	3	In adults with type 2 diabetes, if initial drug treatment with metformin has not continued to control HbA1c to below the person's individually agreed threshold for intensification, consider dual therapy with: metformin and a DPP-4 inhibitor or metformin and pioglitazone or metformin and a sulfonylurea.	In adults with type 2 diabetes, if metformin is contraindicated or not tolerated and initial drug treatment has not continued to control HbA1c to below the person's individually agreed threshold for intensification, consider dual therapy with: a DPP-4 inhibitor and pioglitazone or a DPP-4 inhibitor and a sulfonylurea or pioglitazone and a sulfonylurea.	In adults with type 2 diabetes, if dual therapy with metformin and another oral drug (see recommendation ) has not continued to control HbA1c to below the person's individually agreed threshold for intensification, consider either: triple therapy with: metformin, a DPP-4 inhibitor and a sulfonylurea or metformin, pioglitazone and a sulfonylurea or starting insulin-based treatment (see recommendations – ).	
5–10percent individualise	0	1.2263	0	
acute intercurrent	0	1.2263	1	Be aware that adults with type 2 diabetes who have acute intercurrent illness are at risk of worsening hyperglycaemia	
advise adults	0	1.2263	1	Advise adults with type 2 diabetes that limited substitution of sucrose-containing foods for other carbohydrate in the meal plan is allowable, but that they should take care to avoid excess energy intake.	
alcohol intake	0	1.2263	1	Individualise recommendations for carbohydrate and alcohol intake, and meal patterns	
